#======================================================================#
#| [1m            Welcome to ForceBalance version 1.6.0! =D             [0m |#
#| [1m                 Force Field Optimization System                  [0m |#
#| [1m                                                                  [0m |#
#| [1m                             Authors:                             [0m |#
#| [1m                          Lee-Ping Wang                           [0m |#
#| [1m                  Keri A. McKiernan, Yudong Qiu                   [0m |#
#| [1m           Arthur Vigil, Erik G. Brandt, Johnny Israeli           [0m |#
#======================================================================#

                          [44m     [0m                                        
                       [44m        [0m      [43m     [0m                              
                    [44m        [0m   [44m  [0m    [43m         [0m                          
                 [44m       [0m    [44m      [0m      [43m         [0m                       
             [44m        [0m    [44m        [0m          [43m         [0m                    
          [44m        [0m    [44m        [0m                 [43m        [0m                 
       [44m        [0m    [44m       [0m                        [43m        [0m              
    [44m        [0m   [44m        [0m                              [43m         [0m          
   [44m      [0m   [44m        [0m               `.:+@@###@'          [43m         [0m       
    [44m [0m    [44m        [0m          ,;'+###############.             [43m     [0m       
      [44m        [0m         +################':`                    [43m [0m        
      [44m     [0m              `.,,...####+.                                  
                                ,#####      +##.               [44m   [0m   [44m   [0m
 [43m    [0m                            #####      ######             [44m   [0m   [44m   [0m
 [43m    [0m                ###'        ####'     :#####'             [44m   [0m   [44m   [0m
 [43m    [0m                :####@      ####.    ,####'               [44m   [0m   [44m   [0m
 [43m    [0m                 ######     ####    +###+                 [44m   [0m   [44m   [0m
 [43m    [0m                  #####     ####   ###;                   [44m   [0m   [44m   [0m
 [43m    [0m                   :##      ####  ++`                     [44m   [0m   [44m   [0m
 [43m    [0m                            ####``..:;+##############+`   [44m   [0m   [44m   [0m
 [43m    [0m             .,:;;'++##################################`  [44m   [0m   [44m   [0m
 [43m    [0m    `############################++++''';;;;;;;;;;;'';    [44m   [0m   [44m   [0m
 [43m    [0m      ,########':,.``       ####                          [44m   [0m   [44m   [0m
 [43m    [0m                            ####                          [44m   [0m   [44m   [0m
 [43m    [0m                            ####                          [44m   [0m   [44m   [0m
 [43m    [0m                            ####                          [44m   [0m   [44m   [0m
 [43m    [0m                            ####                          [44m   [0m   [44m   [0m
 [43m    [0m                            ####                          [44m   [0m   [44m   [0m
 [43m    [0m                            ####                          [44m   [0m   [44m   [0m
 [43m    [0m                            ####                          [44m   [0m   [44m   [0m
      [44m    [0m                       ####                                   
     [44m        [0m                    ####                                   
    [44m [0m    [44m       [0m                 ####                       [43m     [0m       
   [44m     [0m    [44m        [0m             ####                    [43m        [0m       
   [44m        [0m    [44m        [0m          ###                  [43m         [0m         
      [44m        [0m    [44m        [0m        +`               [43m        [0m             
          [44m        [0m   [44m        [0m                   [43m        [0m                
             [44m        [0m   [44m         [0m           [43m         [0m                   
                [44m        [0m    [44m       [0m      [43m         [0m                      
                   [44m        [0m    [44m   [0m    [43m        [0m                          
                      [44m        [0m       [43m      [0m                             
                          [44m      [0m      [43m  [0m                                
                             [44m  [0m                                         

Reading options from file: optimize.in
#========================================================#
#| [95m  Options at their default values are not printed   [0m |#
#| [95m        Use 'verbose_options True' to Enable        [0m |#
#========================================================#
Reading force field from file: smirnoff99Frosst.offxml
#=========================================================#
#| [92m Starting parameter indices, physical values and IDs [0m |#
#=========================================================#
   0 [  1.6000e-01 ] : ProperTorsions/Proper/k1/[#6X4:1]-[#6X4:2]-[#8X2H1:3]-[#1:4]
   1 [  2.5000e-01 ] : ProperTorsions/Proper/k2/[#6X4:1]-[#6X4:2]-[#8X2H1:3]-[#1:4]
   2 [  1.5700e-02 ] : vdW/Atom/epsilon/[#1:1]-[#6X4]
   3 [  1.4870e+00 ] : vdW/Atom/rmin_half/[#1:1]-[#6X4]
   4 [  1.5700e-02 ] : vdW/Atom/epsilon/[#1:1]-[#6X4]-[#7,#8,#9,#16,#17,#35]
   5 [  1.3870e+00 ] : vdW/Atom/rmin_half/[#1:1]-[#6X4]-[#7,#8,#9,#16,#17,#35]
   6 [  5.2700e-05 ] : vdW/Atom/epsilon/[#1:1]-[#8]
   7 [  1.0940e-01 ] : vdW/Atom/epsilon/[#6X4:1]
   8 [  1.9080e+00 ] : vdW/Atom/rmin_half/[#6X4:1]
   9 [  2.1040e-01 ] : vdW/Atom/epsilon/[#8X2H1+0:1]
  10 [  1.7210e+00 ] : vdW/Atom/rmin_half/[#8X2H1+0:1]
-----------------------------------------------------------
#=========================================================#
#| [91m Rescaling Factors by Type (Lower Takes Precedence): [0m |#
#=========================================================#
   ProperTorsions/Proper/k1             : 1.60000e-01
   ProperTorsions/Proper/k2             : 2.50000e-01
   ProperTorsions/Proper/k              : 1.00000e+00
   vdW/Atom/epsilon                     : 1.00000e-01
   vdW/Atom/rmin_half                   : 1.00000e+00
-----------------------------------------------------------
#========================================================#
#| [91m   Rescaling Types / Factors by Parameter Number:   [0m |#
#========================================================#
   0 [    ProperTorsions/Proper/k       : 1.00000e+00 ] : ProperTorsions/Proper/k1/[#6X4:1]-[#6X4:2]-[#8X2H1:3]-[#1:4]
   1 [    ProperTorsions/Proper/k       : 1.00000e+00 ] : ProperTorsions/Proper/k2/[#6X4:1]-[#6X4:2]-[#8X2H1:3]-[#1:4]
   2 [    vdW/Atom/epsilon              : 1.00000e-01 ] : vdW/Atom/epsilon/[#1:1]-[#6X4]
   3 [    vdW/Atom/rmin_half            : 1.00000e+00 ] : vdW/Atom/rmin_half/[#1:1]-[#6X4]
   4 [    vdW/Atom/epsilon              : 1.00000e-01 ] : vdW/Atom/epsilon/[#1:1]-[#6X4]-[#7,#8,#9,#16,#17,#35]
   5 [    vdW/Atom/rmin_half            : 1.00000e+00 ] : vdW/Atom/rmin_half/[#1:1]-[#6X4]-[#7,#8,#9,#16,#17,#35]
   6 [    vdW/Atom/epsilon              : 1.00000e-01 ] : vdW/Atom/epsilon/[#1:1]-[#8]
   7 [    vdW/Atom/epsilon              : 1.00000e-01 ] : vdW/Atom/epsilon/[#6X4:1]
   8 [    vdW/Atom/rmin_half            : 1.00000e+00 ] : vdW/Atom/rmin_half/[#6X4:1]
   9 [    vdW/Atom/epsilon              : 1.00000e-01 ] : vdW/Atom/epsilon/[#8X2H1+0:1]
  10 [    vdW/Atom/rmin_half            : 1.00000e+00 ] : vdW/Atom/rmin_half/[#8X2H1+0:1]
----------------------------------------------------------
#========================================================#
#| [92m               Setup for force field                [0m |#
#========================================================#
fnms                      ['smirnoff99Frosst.offxml'] 
priors                    OrderedDict([('ProperTorsions/Proper/k', 1.0), ('vdW/Atom/epsilon', 0.1), ('vdW/Atom/rmin_half', 1.0)]) 
----------------------------------------------------------
Autodetected 256 molecules with 9 atoms each in liquid coordinates
#========================================================#
#| [92m         Setup for target ethanol-liquid :          [0m |#
#========================================================#
force_cuda                0 
mts_integrator            0 
rpmd_beads                0 
mol2                      ['ETH.mol2'] 
liquid_coords             liquid.pdb 
gas_coords                gas.pdb 
nvt_coords                surf.pdb 
name                      ethanol-liquid 
type                      LIQUID_SMIRNOFF 
tgtdir                    targets/ethanol-liquid 
w_rho                     1.0 
w_hvap                    1.0 
w_alpha                   1.0 
w_kappa                   1.0 
w_cp                      1.0 
w_eps0                    1.0 
w_normalize               0 
liquid_eq_steps           50000 
liquid_md_steps           500000 
gas_eq_steps              2000000 
gas_md_steps              20000000 
liquid_timestep           2.0 
liquid_interval           1.0 
gas_timestep              0.5 
gas_interval              1.0 
adapt_errors              0 
minimize_energy           1 
self_pol_mu0              0.0 
self_pol_alpha            0.0 
anisotropic_box           0 
w_surf_ten                0.0 
nvt_eq_steps              10000 
nvt_md_steps              100000 
nvt_timestep              1.0 
nvt_interval              0.1 
pure_num_grad             0 
liquid_fdiff_h            0.01 
rho_denom                 30.0 
hvap_denom                3.0 
alpha_denom               1.0 
kappa_denom               5.0 
cp_denom                  2.0 
eps0_denom                2.0 
use_cvib_intra            False 
use_cvib_inter            False 
use_cni                   False 
----------------------------------------------------------
QM forces are not present, only fitting energies.
#========================================================#
#| [92m      Setup for target ethanol-torsiondrive :       [0m |#
#========================================================#
pdb                       gas.pdb 
mol2                      ['ETH.mol2'] 
coords                    scan.xyz 
precision                 double 
platname                  CUDA 
name                      ethanol-torsiondrive 
type                      ABINITIO_SMIRNOFF 
tgtdir                    targets/ethanol-torsiondrive 
writelevel                1 
shots                     24 
----------------------------------------------------------
Using parabolic regularization (Gaussian prior) with strength 1.0e+00 (+), 0.0e+00 (x)
#========================================================#
#| [92m           Setup for objective function :           [0m |#
#========================================================#
penalty_additive          1.0 
normalize_weights         False 
----------------------------------------------------------
#========================================================#
#| [92m                Setup for optimizer                 [0m |#
#========================================================#
jobtype                   OPTIMIZE 
trust0                    0.25 
mintrust                  0.05 
eps                       0.01 
convergence_objective     0.1 
convergence_step          0.1 
convergence_gradient      0.1 
adapt_fac                 0.2 
adapt_damp                1.0 
print_hess                True 
err_tol                   1.0 
input_file                optimize.in 
----------------------------------------------------------
#========================================================#
#| [1m                  Main Optimizer                    [0m |#
#| [1m   Newton-Raphson Method (Adaptive Trust Radius)    [0m |#
#| [1m                                                    [0m |#
#| [1m       [0mConvergence criteria (1 of 3 needed):        [0m |#
#| [1m          [0mObjective Function  : 1.000e-01           [0m |#
#| [1m          [0mNorm of Gradient    : 1.000e-01           [0m |#
#| [1m          [0mParameter step size : 1.000e-01           [0m |#
#========================================================#
#========================================================================#
#|               Color Key for Objective Function -=X2=-                |#
#|  [1mBold[0m = Initial step                                                 |#
#|  [92mGreen = Current lowest value of objective function (best estimate)[0m  |#
#|  [91mRed = Objective function rises, step rejected[0m                       |#
#|  [0mNo color = Not at the lowest value                                  |#
#========================================================================#
#========================================================#
#| [94m     Iteration 0: Evaluating objective function     [0m |#
#| [94m        and derivatives through second order        [0m |#
#========================================================#
#========================================================#
#|  Target: ethanol-liquid - launching MD simulations   |#
#|         Time steps: 50000 (eq) + 500000 (md)         |#
#========================================================#
Running condensed phase simulation locally.
You may tail -f /home2/qyd/projects/forcebalance-dev/studies/017_smirnoff_ethanol/optimize.tmp/ethanol-liquid/iter_0000/298.15K-1.0atm/npt.out in another terminal window
Executing process: [92mbash runcuda.sh python npt.py smirnoff 298.150 1.000[0m Output: npt.out
Running condensed phase simulation locally.
You may tail -f /home2/qyd/projects/forcebalance-dev/studies/017_smirnoff_ethanol/optimize.tmp/ethanol-liquid/iter_0000/320.03K-1.0atm/npt.out in another terminal window
Executing process: [92mbash runcuda.sh python npt.py smirnoff 320.030 1.000[0m Output: npt.out
Reading information from ./298.15K-1.0atm/npt_result.p
Reading information from ./320.03K-1.0atm/npt_result.p
Weights have been renormalized to 1.0
Physical quantity Density uses denominator =  30.0000
Weights have been renormalized to 1.0
Physical quantity H_vap uses denominator =  3.0000
#==========================================================================================#
#| [1;94m                          ethanol-liquid Density (kg m^-3)                            [0m |#
#| [1;94m Temperature  Pressure  Reference  Calculated +- Stdev     Delta    Weight    Term    [0m |#
#==========================================================================================#
      298.15      1.0 atm   785.000      785.774 +- 0.564     0.774   0.50000   0.00033 
      320.03      1.0 atm   766.000      759.551 +- 0.738    -6.449   0.50000   0.02311 
--------------------------------------------------------------------------------------------
#========================================================#
#| [92m  Density objective function:  0.023, Derivative:   [0m |#
#========================================================#
   0 [  9.4150e-02 ] : ProperTorsions/Proper/k1/[#6X4:1]-[#6X4:2]-[#8X2H1:3]-[#1:4]
   1 [ -7.6974e-02 ] : ProperTorsions/Proper/k2/[#6X4:1]-[#6X4:2]-[#8X2H1:3]-[#1:4]
   2 [ -1.0719e+00 ] : vdW/Atom/epsilon/[#1:1]-[#6X4]
   3 [  2.3708e+00 ] : vdW/Atom/rmin_half/[#1:1]-[#6X4]
   4 [ -6.5318e-01 ] : vdW/Atom/epsilon/[#1:1]-[#6X4]-[#7,#8,#9,#16,#17,#35]
   5 [  1.2428e+00 ] : vdW/Atom/rmin_half/[#1:1]-[#6X4]-[#7,#8,#9,#16,#17,#35]
   6 [ -1.3091e+00 ] : vdW/Atom/epsilon/[#1:1]-[#8]
   7 [ -1.0237e+00 ] : vdW/Atom/epsilon/[#6X4:1]
   8 [ -6.4821e-01 ] : vdW/Atom/rmin_half/[#6X4:1]
   9 [ -1.4177e-01 ] : vdW/Atom/epsilon/[#8X2H1+0:1]
  10 [  1.9946e+00 ] : vdW/Atom/rmin_half/[#8X2H1+0:1]
----------------------------------------------------------
#==========================================================================================#
#| [1;94m                 ethanol-liquid Enthalpy of Vaporization (kJ mol^-1)                  [0m |#
#| [1;94m Temperature  Pressure  Reference  Calculated +- Stdev     Delta    Weight    Term    [0m |#
#==========================================================================================#
      298.15      1.0 atm    42.300       33.859 +- 0.183    -8.441   0.50000   3.95830 
      320.03      1.0 atm    41.000       31.612 +- 0.197    -9.388   0.50000   4.89650 
--------------------------------------------------------------------------------------------
#======================================================================#
#| [92m Enthalpy of Vaporization objective function:  8.855, Derivative: [0m |#
#======================================================================#
   0 [ -7.1144e-01 ] : ProperTorsions/Proper/k1/[#6X4:1]-[#6X4:2]-[#8X2H1:3]-[#1:4]
   1 [ -3.6692e+00 ] : ProperTorsions/Proper/k2/[#6X4:1]-[#6X4:2]-[#8X2H1:3]-[#1:4]
   2 [ -4.8188e+01 ] : vdW/Atom/epsilon/[#1:1]-[#6X4]
   3 [  1.6061e+01 ] : vdW/Atom/rmin_half/[#1:1]-[#6X4]
   4 [ -3.2446e+01 ] : vdW/Atom/epsilon/[#1:1]-[#6X4]-[#7,#8,#9,#16,#17,#35]
   5 [  3.8087e+00 ] : vdW/Atom/rmin_half/[#1:1]-[#6X4]-[#7,#8,#9,#16,#17,#35]
   6 [ -4.5184e+01 ] : vdW/Atom/epsilon/[#1:1]-[#8]
   7 [ -2.7841e+01 ] : vdW/Atom/epsilon/[#6X4:1]
   8 [ -4.5190e+01 ] : vdW/Atom/rmin_half/[#6X4:1]
   9 [  8.9178e-01 ] : vdW/Atom/epsilon/[#8X2H1+0:1]
  10 [  1.6561e+02 ] : vdW/Atom/rmin_half/[#8X2H1+0:1]
------------------------------------------------------------------------
#====================================================================#
#| [94m           ethanol-liquid Condensed Phase Properties:           [0m |#
#| [94m  Property Name                Residual x Weight = Contribution [0m |#
#====================================================================#
Density                            0.02344    1.000    2.34400e-02 
Enthalpy of Vaporization           8.85480    1.000    8.85480e+00 
Total                                                  8.87824e+00 
----------------------------------------------------------------------

#============================================================================================#
#|      Target: ethanol-torsiondrive  Type: AbInitio_SMIRNOFF  Objective = 3.43600e-01      |#
#|                    Difference   Denominator     Percent                                  |#
#|  Observable        (Calc-Ref)     RMS (Ref)   Difference       Term   x Wt =   Contrib.  |#
#============================================================================================#
    Energy (kJ/mol)       1.0797        1.8420     58.6174%     0.3436    1.000     0.3436 
----------------------------------------------------------------------------------------------
#====================================================================#
#| [94m                  Objective Function Breakdown                  [0m |#
#| [94m  Target Name              Residual  x  Weight  =  Contribution [0m |#
#====================================================================#
ethanol-liquid                 8.87824      1.000 [94m     8.87824e+00[0m 
ethanol-torsiondrive           0.34360      1.000 [94m     3.43600e-01[0m 
Regularization                 0.00000      1.000 [94m     0.00000e+00[0m 
Total                                             [94m     9.22184e+00[0m 
----------------------------------------------------------------------

  Step       |k|        |dk|       |grad|       -=X2=-     Delta(X2)    StepQual
     0   0.000e+00   0.000e+00   1.923e+02[1m   9.22184e+00[0m   0.000e+00      0.000

#========================================================#
#| [94m                   Total Gradient                   [0m |#
#========================================================#
   0 [ -1.91684196e+00 ] : ProperTorsions/Proper/k1/[#6X4:1]-[#6X4:2]-[#8X2H1:3]-[#1:4]
   1 [ -2.67629012e+00 ] : ProperTorsions/Proper/k2/[#6X4:1]-[#6X4:2]-[#8X2H1:3]-[#1:4]
   2 [ -4.95617171e+01 ] : vdW/Atom/epsilon/[#1:1]-[#6X4]
   3 [  1.79726054e+01 ] : vdW/Atom/rmin_half/[#1:1]-[#6X4]
   4 [ -3.31134239e+01 ] : vdW/Atom/epsilon/[#1:1]-[#6X4]-[#7,#8,#9,#16,#17,#35]
   5 [  5.02555303e+00 ] : vdW/Atom/rmin_half/[#1:1]-[#6X4]-[#7,#8,#9,#16,#17,#35]
   6 [ -4.68861468e+01 ] : vdW/Atom/epsilon/[#1:1]-[#8]
   7 [ -2.88645067e+01 ] : vdW/Atom/epsilon/[#6X4:1]
   8 [ -4.58391477e+01 ] : vdW/Atom/rmin_half/[#6X4:1]
   9 [  7.28559751e-01 ] : vdW/Atom/epsilon/[#8X2H1+0:1]
  10 [  1.67167811e+02 ] : vdW/Atom/rmin_half/[#8X2H1+0:1]
----------------------------------------------------------
#========================================================#
#| [94m                   Total Hessian                    [0m |#
#========================================================#
 7.38355832e+00 -4.79699652e-03 -6.76271146e-03  3.64495336e+00  1.51822198e-01  2.13005520e+00 -9.19633566e-01 -7.33744590e-01  6.29017661e-01 -3.34252242e-01 -3.76806101e+00 
-4.79699652e-03  8.10553114e+00  1.15380637e+01 -1.24191360e+01  8.44224895e+00 -4.58816559e+00  9.75234373e+00  8.64933498e+00  1.07443390e+01  4.84552822e-02 -4.30078021e+01 
-6.76271146e-03  1.15380637e+01  1.85522152e+02 -1.65046769e+02  1.19865481e+02 -7.49042313e+01  1.64897786e+02  1.26259243e+02  1.47030376e+02  2.14812758e+00 -5.89598775e+02 
 3.64495336e+00 -1.24191360e+01 -1.65046769e+02  3.34056557e+02 -1.05390816e+02  1.68393824e+02 -1.45114866e+02 -1.50731314e+02 -9.52010393e+01 -1.12394545e+01  4.84032640e+02 
 1.51822198e-01  8.44224895e+00  1.19865481e+02 -1.05390816e+02  8.07334046e+01 -4.70268692e+01  1.08689225e+02  8.21223764e+01  9.73210311e+01  1.24898188e+00 -3.87977745e+02 
 2.13005520e+00 -4.58816559e+00 -7.49042313e+01  1.68393824e+02 -4.70268692e+01  8.89529890e+01 -6.40384699e+01 -7.17850752e+01 -3.84838469e+01 -6.02000161e+00  2.12416476e+02 
-9.19633566e-01  9.75234373e+00  1.64897786e+02 -1.45114866e+02  1.08689225e+02 -6.40384699e+01  1.63496380e+02  1.13378343e+02  1.36814638e+02  2.85461506e+00 -5.17121930e+02 
-7.33744590e-01  8.64933498e+00  1.26259243e+02 -1.50731314e+02  8.21223764e+01 -7.17850752e+01  1.13378343e+02  9.64495293e+01  9.39944373e+01  3.37888912e+00 -3.96625117e+02 
 6.29017661e-01  1.07443390e+01  1.47030376e+02 -9.52010393e+01  9.73210311e+01 -3.84838469e+01  1.36814638e+02  9.39944373e+01  1.29431234e+02  5.35727387e-02 -4.81592365e+02 
-3.34252242e-01  4.84552822e-02  2.14812758e+00 -1.12394545e+01  1.24898188e+00 -6.02000161e+00  2.85461506e+00  3.37888912e+00  5.35727387e-02  2.63202609e+00 -2.21047330e+00 
-3.76806101e+00 -4.30078021e+01 -5.89598775e+02  4.84032640e+02 -3.87977745e+02  2.12416476e+02 -5.17121930e+02 -3.96625117e+02 -4.81592365e+02 -2.21047330e+00  1.95613816e+03 
----------------------------------------------------------
Calculating nonlinear optimization step
Finding trust radius: H+0.0000*I, length 2.9691e-01 (target 2.5000e-01)
Finding trust radius: H+9.0000*I, length 1.9187e-01 (target 2.5000e-01)
Finding trust radius: H+23.5623*I, length 1.5632e-01 (target 2.5000e-01)
Finding trust radius: H+0.0000*I, length 2.9691e-01 (target 2.5000e-01)
Finding trust radius: H+3.4377*I, length 2.3188e-01 (target 2.5000e-01)
Finding trust radius: H+9.0000*I, length 1.9187e-01 (target 2.5000e-01)
Finding trust radius: H+1.7940*I, length 2.5504e-01 (target 2.5000e-01)
Finding trust radius: H+1.8226*I, length 2.5454e-01 (target 2.5000e-01)
Finding trust radius: H+2.1115*I, length 2.4978e-01 (target 2.5000e-01)
Finding trust radius: H+2.0971*I, length 2.5001e-01 (target 2.5000e-01)
Finding trust radius: H+2.0976*I, length 2.5000e-01 (target 2.5000e-01)
Finding trust radius: H+2.0976*I, length 2.5000e-01 (target 2.5000e-01)
Finding trust radius: H+2.0976*I, length 2.5000e-01 (target 2.5000e-01)
Finding trust radius: H+2.0976*I, length 2.5000e-01 (target 2.5000e-01)
Trust-radius step found (length 2.5000e-01),  2.0976e+00 added to Hessian diagonal
#========================================================#
#| [95m  Mathematical Parameters (Current + Step = Next)   [0m |#
#========================================================#
   0 [  0.0000e+00 + 1.4509e-01 =  1.4509e-01 ] : ProperTorsions/Proper/k1/[#6X4:1]-[#6X4:2]-[#8X2H1:3]-[#1:4]
   1 [  0.0000e+00 - 6.8703e-02 = -6.8703e-02 ] : ProperTorsions/Proper/k2/[#6X4:1]-[#6X4:2]-[#8X2H1:3]-[#1:4]
   2 [  0.0000e+00 + 2.5272e-03 =  2.5272e-03 ] : vdW/Atom/epsilon/[#1:1]-[#6X4]
   3 [  0.0000e+00 + 7.1777e-02 =  7.1777e-02 ] : vdW/Atom/rmin_half/[#1:1]-[#6X4]
   4 [  0.0000e+00 + 2.3603e-02 =  2.3603e-02 ] : vdW/Atom/epsilon/[#1:1]-[#6X4]-[#7,#8,#9,#16,#17,#35]
   5 [  0.0000e+00 + 7.1831e-02 =  7.1831e-02 ] : vdW/Atom/rmin_half/[#1:1]-[#6X4]-[#7,#8,#9,#16,#17,#35]
   6 [  0.0000e+00 + 1.4127e-01 =  1.4127e-01 ] : vdW/Atom/epsilon/[#1:1]-[#8]
   7 [  0.0000e+00 - 4.4834e-03 = -4.4834e-03 ] : vdW/Atom/epsilon/[#6X4:1]
   8 [  0.0000e+00 + 5.0125e-02 =  5.0125e-02 ] : vdW/Atom/rmin_half/[#6X4:1]
   9 [  0.0000e+00 + 1.8106e-03 =  1.8106e-03 ] : vdW/Atom/epsilon/[#8X2H1+0:1]
  10 [  0.0000e+00 - 5.7964e-02 = -5.7964e-02 ] : vdW/Atom/rmin_half/[#8X2H1+0:1]
----------------------------------------------------------
#========================================================#
#| [95m    Physical Parameters (Current + Step = Next)     [0m |#
#========================================================#
   0 [  1.6000e-01 + 1.4509e-01 =  3.0509e-01 ] : ProperTorsions/Proper/k1/[#6X4:1]-[#6X4:2]-[#8X2H1:3]-[#1:4]
   1 [  2.5000e-01 - 6.8703e-02 =  1.8130e-01 ] : ProperTorsions/Proper/k2/[#6X4:1]-[#6X4:2]-[#8X2H1:3]-[#1:4]
   2 [  1.5700e-02 + 2.5272e-04 =  1.5953e-02 ] : vdW/Atom/epsilon/[#1:1]-[#6X4]
   3 [  1.4870e+00 + 7.1777e-02 =  1.5588e+00 ] : vdW/Atom/rmin_half/[#1:1]-[#6X4]
   4 [  1.5700e-02 + 2.3603e-03 =  1.8060e-02 ] : vdW/Atom/epsilon/[#1:1]-[#6X4]-[#7,#8,#9,#16,#17,#35]
   5 [  1.3870e+00 + 7.1831e-02 =  1.4588e+00 ] : vdW/Atom/rmin_half/[#1:1]-[#6X4]-[#7,#8,#9,#16,#17,#35]
   6 [  5.2700e-05 + 1.4127e-02 =  1.4180e-02 ] : vdW/Atom/epsilon/[#1:1]-[#8]
   7 [  1.0940e-01 - 4.4834e-04 =  1.0895e-01 ] : vdW/Atom/epsilon/[#6X4:1]
   8 [  1.9080e+00 + 5.0125e-02 =  1.9581e+00 ] : vdW/Atom/rmin_half/[#6X4:1]
   9 [  2.1040e-01 + 1.8106e-04 =  2.1058e-01 ] : vdW/Atom/epsilon/[#8X2H1+0:1]
  10 [  1.7210e+00 - 5.7964e-02 =  1.6630e+00 ] : vdW/Atom/rmin_half/[#8X2H1+0:1]
----------------------------------------------------------
Input file with saved parameters: optimize.sav
#========================================================#
#| [94m     Iteration 1: Evaluating objective function     [0m |#
#| [94m        and derivatives through second order        [0m |#
#========================================================#
#========================================================#
#|  Target: ethanol-liquid - launching MD simulations   |#
#|         Time steps: 50000 (eq) + 500000 (md)         |#
#========================================================#
Running condensed phase simulation locally.
You may tail -f /home2/qyd/projects/forcebalance-dev/studies/017_smirnoff_ethanol/optimize.tmp/ethanol-liquid/iter_0001/298.15K-1.0atm/npt.out in another terminal window
Executing process: [92mbash runcuda.sh python npt.py smirnoff 298.150 1.000[0m Output: npt.out
Running condensed phase simulation locally.
You may tail -f /home2/qyd/projects/forcebalance-dev/studies/017_smirnoff_ethanol/optimize.tmp/ethanol-liquid/iter_0001/320.03K-1.0atm/npt.out in another terminal window
Executing process: [92mbash runcuda.sh python npt.py smirnoff 320.030 1.000[0m Output: npt.out
Reading information from ./298.15K-1.0atm/npt_result.p
Reading information from ./320.03K-1.0atm/npt_result.p
Weights have been renormalized to 1.0
Physical quantity Density uses denominator =  30.0000
Weights have been renormalized to 1.0
Physical quantity H_vap uses denominator =  3.0000
#==========================================================================================#
#| [1;94m                          ethanol-liquid Density (kg m^-3)                            [0m |#
#| [1;94m Temperature  Pressure  Reference  Calculated +- Stdev     Delta    Weight    Term    [0m |#
#==========================================================================================#
      298.15      1.0 atm   785.000      768.707 +- 0.608   -16.293   0.50000   0.14747 
      320.03      1.0 atm   766.000      747.298 +- 0.615   -18.702   0.50000   0.19432 
--------------------------------------------------------------------------------------------
#========================================================#
#| [92m  Density objective function:  0.342, Derivative:   [0m |#
#========================================================#
   0 [  1.7077e-01 ] : ProperTorsions/Proper/k1/[#6X4:1]-[#6X4:2]-[#8X2H1:3]-[#1:4]
   1 [ -2.5837e-01 ] : ProperTorsions/Proper/k2/[#6X4:1]-[#6X4:2]-[#8X2H1:3]-[#1:4]
   2 [ -3.7732e+00 ] : vdW/Atom/epsilon/[#1:1]-[#6X4]
   3 [  1.5590e+01 ] : vdW/Atom/rmin_half/[#1:1]-[#6X4]
   4 [ -2.2493e+00 ] : vdW/Atom/epsilon/[#1:1]-[#6X4]-[#7,#8,#9,#16,#17,#35]
   5 [  8.8406e+00 ] : vdW/Atom/rmin_half/[#1:1]-[#6X4]-[#7,#8,#9,#16,#17,#35]
   6 [ -2.7136e-01 ] : vdW/Atom/epsilon/[#1:1]-[#8]
   7 [ -5.2715e+00 ] : vdW/Atom/epsilon/[#6X4:1]
   8 [ -2.0251e+00 ] : vdW/Atom/rmin_half/[#6X4:1]
   9 [ -4.9829e-01 ] : vdW/Atom/epsilon/[#8X2H1+0:1]
  10 [  1.1483e+01 ] : vdW/Atom/rmin_half/[#8X2H1+0:1]
----------------------------------------------------------
#==========================================================================================#
#| [1;94m                 ethanol-liquid Enthalpy of Vaporization (kJ mol^-1)                  [0m |#
#| [1;94m Temperature  Pressure  Reference  Calculated +- Stdev     Delta    Weight    Term    [0m |#
#==========================================================================================#
      298.15      1.0 atm    42.300       39.326 +- 0.189    -2.974   0.50000   0.49153 
      320.03      1.0 atm    41.000       37.484 +- 0.219    -3.516   0.50000   0.68696 
--------------------------------------------------------------------------------------------
#======================================================================#
#| [92m Enthalpy of Vaporization objective function:  1.178, Derivative: [0m |#
#======================================================================#
   0 [  2.4323e-01 ] : ProperTorsions/Proper/k1/[#6X4:1]-[#6X4:2]-[#8X2H1:3]-[#1:4]
   1 [ -1.4012e+00 ] : ProperTorsions/Proper/k2/[#6X4:1]-[#6X4:2]-[#8X2H1:3]-[#1:4]
   2 [ -1.8754e+01 ] : vdW/Atom/epsilon/[#1:1]-[#6X4]
   3 [  5.4788e+00 ] : vdW/Atom/rmin_half/[#1:1]-[#6X4]
   4 [ -1.1268e+01 ] : vdW/Atom/epsilon/[#1:1]-[#6X4]-[#7,#8,#9,#16,#17,#35]
   5 [  2.1210e+00 ] : vdW/Atom/rmin_half/[#1:1]-[#6X4]-[#7,#8,#9,#16,#17,#35]
   6 [ -9.8260e-01 ] : vdW/Atom/epsilon/[#1:1]-[#8]
   7 [ -1.0403e+01 ] : vdW/Atom/epsilon/[#6X4:1]
   8 [ -1.6429e+01 ] : vdW/Atom/rmin_half/[#6X4:1]
   9 [ -1.5075e-01 ] : vdW/Atom/epsilon/[#8X2H1+0:1]
  10 [  5.1405e+01 ] : vdW/Atom/rmin_half/[#8X2H1+0:1]
------------------------------------------------------------------------
#====================================================================#
#| [94m           ethanol-liquid Condensed Phase Properties:           [0m |#
#| [94m  Property Name                Residual x Weight = Contribution [0m |#
#====================================================================#
Density                            0.34179    1.000    3.41788e-01 
Enthalpy of Vaporization           1.17849    1.000    1.17849e+00 
Total                                                  1.52028e+00 
----------------------------------------------------------------------

#============================================================================================#
#|      Target: ethanol-torsiondrive  Type: AbInitio_SMIRNOFF  Objective = 1.34181e-01      |#
#|                    Difference   Denominator     Percent                                  |#
#|  Observable        (Calc-Ref)     RMS (Ref)   Difference       Term   x Wt =   Contrib.  |#
#============================================================================================#
    Energy (kJ/mol)       0.6747        1.8420     36.6307%     0.1342    1.000     0.1342 
----------------------------------------------------------------------------------------------
#===================================================================================#
#| [94m                         Objective Function Breakdown                          [0m |#
#| [94m  Target Name              Residual  x  Weight  =  Contribution (Current-Prev) [0m |#
#===================================================================================#
ethanol-liquid                 1.52028      1.000 [92m     1.52028e+00[0m ( -7.358e+00 ) 
ethanol-torsiondrive           0.13418      1.000 [92m     1.34181e-01[0m ( -2.094e-01 ) 
Regularization                 0.06250      1.000 [91m     6.25000e-02[0m ( +6.250e-02 ) 
Total                                             [92m     1.71696e+00[0m ( -7.505e+00 ) 
-------------------------------------------------------------------------------------
Creating the directory /home2/qyd/projects/forcebalance-dev/studies/017_smirnoff_ethanol/result/optimize to print the force field
#========================================================================#
#|  The force field has been written to the result/optimize directory.  |#
#|    Input file with optimization parameters saved to optimize.sav.    |#
#========================================================================#

  Step       |k|        |dk|       |grad|       -=X2=-     Delta(X2)    StepQual
     1   2.500e-01   2.500e-01   7.580e+01[92m   1.71696e+00[0m  -7.505e+00      0.836

#========================================================#
#| [94m                   Total Gradient                   [0m |#
#========================================================#
   0 [  1.52249794e-01 ] : ProperTorsions/Proper/k1/[#6X4:1]-[#6X4:2]-[#8X2H1:3]-[#1:4]
   1 [ -1.17538258e+00 ] : ProperTorsions/Proper/k2/[#6X4:1]-[#6X4:2]-[#8X2H1:3]-[#1:4]
   2 [ -2.27572363e+01 ] : vdW/Atom/epsilon/[#1:1]-[#6X4]
   3 [  2.08596457e+01 ] : vdW/Atom/rmin_half/[#1:1]-[#6X4]
   4 [ -1.34883806e+01 ] : vdW/Atom/epsilon/[#1:1]-[#6X4]-[#7,#8,#9,#16,#17,#35]
   5 [  1.10709823e+01 ] : vdW/Atom/rmin_half/[#1:1]-[#6X4]-[#7,#8,#9,#16,#17,#35]
   6 [ -9.86601884e-01 ] : vdW/Atom/epsilon/[#1:1]-[#8]
   7 [ -1.56850319e+01 ] : vdW/Atom/epsilon/[#6X4:1]
   8 [ -1.83607980e+01 ] : vdW/Atom/rmin_half/[#6X4:1]
   9 [ -6.61065407e-01 ] : vdW/Atom/epsilon/[#8X2H1+0:1]
  10 [  6.24615846e+01 ] : vdW/Atom/rmin_half/[#8X2H1+0:1]
----------------------------------------------------------
#========================================================#
#| [94m                   Total Hessian                    [0m |#
#========================================================#
 7.32464215e+00 -1.41343935e-01 -2.79576487e+00  3.90673847e+00 -1.55405116e+00  2.35928675e+00 -2.10577097e-01 -2.24384166e+00 -2.17996482e+00 -1.29690280e-01  7.90499421e+00 
-1.41343935e-01  8.16361552e+00  1.11422261e+01 -1.17407235e+01  7.51461563e+00 -4.89100958e+00  4.74001924e-01  8.22779591e+00  1.03112167e+01  2.01529052e-01 -3.65745078e+01 
-2.79576487e+00  1.11422261e+01  1.73201424e+02 -1.29099563e+02  1.02743385e+02 -6.53246153e+01  9.32530962e+00  1.12259505e+02  1.42713239e+02  3.97517919e+00 -4.73442347e+02 
 3.90673847e+00 -1.17407235e+01 -1.29099563e+02  3.74161647e+02 -7.76082737e+01  2.07722061e+02 -8.21592482e+00 -1.44856499e+02 -8.32509161e+01 -1.18006612e+01  3.80762661e+02 
-1.55405116e+00  7.51461563e+00  1.02743385e+02 -7.76082737e+01  6.38719744e+01 -3.89580451e+01  5.55451645e+00  6.74389517e+01  8.59332572e+01  2.35855699e+00 -2.85010238e+02 
 2.35928675e+00 -4.89100958e+00 -6.53246153e+01  2.07722061e+02 -3.89580451e+01  1.18851262e+02 -4.33389778e+00 -7.75268079e+01 -4.01145179e+01 -6.63298298e+00  1.93370495e+02 
-2.10577097e-01  4.74001924e-01  9.32530962e+00 -8.21592482e+00  5.55451645e+00 -4.33389778e+00  2.53783362e+00  6.38480131e+00  7.68983348e+00  2.55726899e-01 -2.59514162e+01 
-2.24384166e+00  8.22779591e+00  1.12259505e+02 -1.44856499e+02  6.74389517e+01 -7.75268079e+01  6.38480131e+00  8.88300651e+01  8.83972984e+01  4.52347965e+00 -3.16085920e+02 
-2.17996482e+00  1.03112167e+01  1.42713239e+02 -8.32509161e+01  8.59332572e+01 -4.01145179e+01  7.68983348e+00  8.83972984e+01  1.23978516e+02  2.46400503e+00 -3.94983396e+02 
-1.29690280e-01  2.01529052e-01  3.97517919e+00 -1.18006612e+01  2.35855699e+00 -6.63298298e+00  2.55726899e-01  4.52347965e+00  2.46400503e+00  2.38107091e+00 -1.15218817e+01 
 7.90499421e+00 -3.65745078e+01 -4.73442347e+02  3.80762661e+02 -2.85010238e+02  1.93370495e+02 -2.59514162e+01 -3.16085920e+02 -3.94983396e+02 -1.15218817e+01  1.32183689e+03 
----------------------------------------------------------
Increasing trust radius to  3.0000e-01
Calculating nonlinear optimization step
Newton-Raphson step found (length 1.9736e-01)
#========================================================#
#| [95m  Mathematical Parameters (Current + Step = Next)   [0m |#
#========================================================#
   0 [  1.4509e-01 + 3.5238e-02 =  1.8033e-01 ] : ProperTorsions/Proper/k1/[#6X4:1]-[#6X4:2]-[#8X2H1:3]-[#1:4]
   1 [ -6.8703e-02 - 4.2373e-02 = -1.1108e-01 ] : ProperTorsions/Proper/k2/[#6X4:1]-[#6X4:2]-[#8X2H1:3]-[#1:4]
   2 [  2.5272e-03 + 1.0614e-01 =  1.0867e-01 ] : vdW/Atom/epsilon/[#1:1]-[#6X4]
   3 [  7.1777e-02 + 3.2426e-02 =  1.0420e-01 ] : vdW/Atom/rmin_half/[#1:1]-[#6X4]
   4 [  2.3603e-02 - 9.0134e-04 =  2.2701e-02 ] : vdW/Atom/epsilon/[#1:1]-[#6X4]-[#7,#8,#9,#16,#17,#35]
   5 [  7.1831e-02 - 7.0286e-02 =  1.5446e-03 ] : vdW/Atom/rmin_half/[#1:1]-[#6X4]-[#7,#8,#9,#16,#17,#35]
   6 [  1.4127e-01 - 1.3334e-01 =  7.9333e-03 ] : vdW/Atom/epsilon/[#1:1]-[#8]
   7 [ -4.4834e-03 + 2.5375e-02 =  2.0892e-02 ] : vdW/Atom/epsilon/[#6X4:1]
   8 [  5.0125e-02 - 1.1483e-02 =  3.8642e-02 ] : vdW/Atom/rmin_half/[#6X4:1]
   9 [  1.8106e-03 + 2.1404e-03 =  3.9510e-03 ] : vdW/Atom/epsilon/[#8X2H1+0:1]
  10 [ -5.7964e-02 - 9.8361e-03 = -6.7800e-02 ] : vdW/Atom/rmin_half/[#8X2H1+0:1]
----------------------------------------------------------
#========================================================#
#| [95m    Physical Parameters (Current + Step = Next)     [0m |#
#========================================================#
   0 [  3.0509e-01 + 3.5238e-02 =  3.4033e-01 ] : ProperTorsions/Proper/k1/[#6X4:1]-[#6X4:2]-[#8X2H1:3]-[#1:4]
   1 [  1.8130e-01 - 4.2373e-02 =  1.3892e-01 ] : ProperTorsions/Proper/k2/[#6X4:1]-[#6X4:2]-[#8X2H1:3]-[#1:4]
   2 [  1.5953e-02 + 1.0614e-02 =  2.6567e-02 ] : vdW/Atom/epsilon/[#1:1]-[#6X4]
   3 [  1.5588e+00 + 3.2426e-02 =  1.5912e+00 ] : vdW/Atom/rmin_half/[#1:1]-[#6X4]
   4 [  1.8060e-02 - 9.0134e-05 =  1.7970e-02 ] : vdW/Atom/epsilon/[#1:1]-[#6X4]-[#7,#8,#9,#16,#17,#35]
   5 [  1.4588e+00 - 7.0286e-02 =  1.3885e+00 ] : vdW/Atom/rmin_half/[#1:1]-[#6X4]-[#7,#8,#9,#16,#17,#35]
   6 [  1.4180e-02 - 1.3334e-02 =  8.4603e-04 ] : vdW/Atom/epsilon/[#1:1]-[#8]
   7 [  1.0895e-01 + 2.5375e-03 =  1.1149e-01 ] : vdW/Atom/epsilon/[#6X4:1]
   8 [  1.9581e+00 - 1.1483e-02 =  1.9466e+00 ] : vdW/Atom/rmin_half/[#6X4:1]
   9 [  2.1058e-01 + 2.1404e-04 =  2.1080e-01 ] : vdW/Atom/epsilon/[#8X2H1+0:1]
  10 [  1.6630e+00 - 9.8361e-03 =  1.6532e+00 ] : vdW/Atom/rmin_half/[#8X2H1+0:1]
----------------------------------------------------------
Input file with saved parameters: optimize.sav
#========================================================#
#| [94m     Iteration 2: Evaluating objective function     [0m |#
#| [94m        and derivatives through second order        [0m |#
#========================================================#
#========================================================#
#|  Target: ethanol-liquid - launching MD simulations   |#
#|         Time steps: 50000 (eq) + 500000 (md)         |#
#========================================================#
Running condensed phase simulation locally.
You may tail -f /home2/qyd/projects/forcebalance-dev/studies/017_smirnoff_ethanol/optimize.tmp/ethanol-liquid/iter_0002/298.15K-1.0atm/npt.out in another terminal window
Executing process: [92mbash runcuda.sh python npt.py smirnoff 298.150 1.000[0m Output: npt.out
Running condensed phase simulation locally.
You may tail -f /home2/qyd/projects/forcebalance-dev/studies/017_smirnoff_ethanol/optimize.tmp/ethanol-liquid/iter_0002/320.03K-1.0atm/npt.out in another terminal window
Executing process: [92mbash runcuda.sh python npt.py smirnoff 320.030 1.000[0m Output: npt.out
Reading information from ./298.15K-1.0atm/npt_result.p
Reading information from ./320.03K-1.0atm/npt_result.p
Weights have been renormalized to 1.0
Physical quantity Density uses denominator =  30.0000
Weights have been renormalized to 1.0
Physical quantity H_vap uses denominator =  3.0000
#==========================================================================================#
#| [1;94m                          ethanol-liquid Density (kg m^-3)                            [0m |#
#| [1;94m Temperature  Pressure  Reference  Calculated +- Stdev     Delta    Weight    Term    [0m |#
#==========================================================================================#
      298.15      1.0 atm   785.000      784.810 +- 0.642    -0.190   0.50000   0.00002 
      320.03      1.0 atm   766.000      764.975 +- 0.636    -1.025   0.50000   0.00058 
--------------------------------------------------------------------------------------------
#========================================================#
#| [92m  Density objective function:  0.001, Derivative:   [0m |#
#========================================================#
   0 [  1.4810e-04 ] : ProperTorsions/Proper/k1/[#6X4:1]-[#6X4:2]-[#8X2H1:3]-[#1:4]
   1 [  5.6789e-03 ] : ProperTorsions/Proper/k2/[#6X4:1]-[#6X4:2]-[#8X2H1:3]-[#1:4]
   2 [ -1.7819e-01 ] : vdW/Atom/epsilon/[#1:1]-[#6X4]
   3 [  6.5551e-01 ] : vdW/Atom/rmin_half/[#1:1]-[#6X4]
   4 [ -9.9275e-02 ] : vdW/Atom/epsilon/[#1:1]-[#6X4]-[#7,#8,#9,#16,#17,#35]
   5 [  2.9168e-01 ] : vdW/Atom/rmin_half/[#1:1]-[#6X4]-[#7,#8,#9,#16,#17,#35]
   6 [ -6.1767e-03 ] : vdW/Atom/epsilon/[#1:1]-[#8]
   7 [ -2.0236e-01 ] : vdW/Atom/epsilon/[#6X4:1]
   8 [ -1.1435e-01 ] : vdW/Atom/rmin_half/[#6X4:1]
   9 [ -1.5317e-02 ] : vdW/Atom/epsilon/[#8X2H1+0:1]
  10 [  4.8555e-01 ] : vdW/Atom/rmin_half/[#8X2H1+0:1]
----------------------------------------------------------
#==========================================================================================#
#| [1;94m                 ethanol-liquid Enthalpy of Vaporization (kJ mol^-1)                  [0m |#
#| [1;94m Temperature  Pressure  Reference  Calculated +- Stdev     Delta    Weight    Term    [0m |#
#==========================================================================================#
      298.15      1.0 atm    42.300       42.990 +- 0.189     0.690   0.50000   0.02645 
      320.03      1.0 atm    41.000       40.948 +- 0.205    -0.052   0.50000   0.00015 
--------------------------------------------------------------------------------------------
#======================================================================#
#| [92m Enthalpy of Vaporization objective function:  0.027, Derivative: [0m |#
#======================================================================#
   0 [  3.9147e-02 ] : ProperTorsions/Proper/k1/[#6X4:1]-[#6X4:2]-[#8X2H1:3]-[#1:4]
   1 [  6.5850e-02 ] : ProperTorsions/Proper/k2/[#6X4:1]-[#6X4:2]-[#8X2H1:3]-[#1:4]
   2 [  1.7038e+00 ] : vdW/Atom/epsilon/[#1:1]-[#6X4]
   3 [ -8.8851e-01 ] : vdW/Atom/rmin_half/[#1:1]-[#6X4]
   4 [  1.0381e+00 ] : vdW/Atom/epsilon/[#1:1]-[#6X4]-[#7,#8,#9,#16,#17,#35]
   5 [ -4.3073e-01 ] : vdW/Atom/rmin_half/[#1:1]-[#6X4]-[#7,#8,#9,#16,#17,#35]
   6 [ -9.9753e-02 ] : vdW/Atom/epsilon/[#1:1]-[#8]
   7 [  1.1199e+00 ] : vdW/Atom/epsilon/[#6X4:1]
   8 [  1.6159e+00 ] : vdW/Atom/rmin_half/[#6X4:1]
   9 [ -1.0824e-01 ] : vdW/Atom/epsilon/[#8X2H1+0:1]
  10 [ -7.7183e+00 ] : vdW/Atom/rmin_half/[#8X2H1+0:1]
------------------------------------------------------------------------
#====================================================================#
#| [94m           ethanol-liquid Condensed Phase Properties:           [0m |#
#| [94m  Property Name                Residual x Weight = Contribution [0m |#
#====================================================================#
Density                            0.00060    1.000    6.03763e-04 
Enthalpy of Vaporization           0.02660    1.000    2.65998e-02 
Total                                                  2.72036e-02 
----------------------------------------------------------------------

#============================================================================================#
#|      Target: ethanol-torsiondrive  Type: AbInitio_SMIRNOFF  Objective = 7.82871e-02      |#
#|                    Difference   Denominator     Percent                                  |#
#|  Observable        (Calc-Ref)     RMS (Ref)   Difference       Term   x Wt =   Contrib.  |#
#============================================================================================#
    Energy (kJ/mol)       0.5154        1.8420     27.9798%     0.0783    1.000     0.0783 
----------------------------------------------------------------------------------------------
#===================================================================================#
#| [94m                         Objective Function Breakdown                          [0m |#
#| [94m  Target Name              Residual  x  Weight  =  Contribution (Current-Prev) [0m |#
#===================================================================================#
ethanol-liquid                 0.02720      1.000 [92m     2.72036e-02[0m ( -1.493e+00 ) 
ethanol-torsiondrive           0.07829      1.000 [92m     7.82871e-02[0m ( -5.589e-02 ) 
Regularization                 0.07465      1.000 [91m     7.46452e-02[0m ( +1.215e-02 ) 
Total                                             [92m     1.80136e-01[0m ( -1.537e+00 ) 
-------------------------------------------------------------------------------------
Backing up result/optimize/smirnoff99Frosst.offxml -> result/optimize/smirnoff99Frosst_1.offxml
#========================================================================#
#|  The force field has been written to the result/optimize directory.  |#
#|    Input file with optimization parameters saved to optimize.sav.    |#
#========================================================================#

  Step       |k|        |dk|       |grad|       -=X2=-     Delta(X2)    StepQual
     2   2.732e-01   1.974e-01   8.067e+00[92m   1.80136e-01[0m  -1.537e+00      0.985

#========================================================#
#| [94m                   Total Gradient                   [0m |#
#========================================================#
   0 [  1.79404106e-02 ] : ProperTorsions/Proper/k1/[#6X4:1]-[#6X4:2]-[#8X2H1:3]-[#1:4]
   1 [  1.08978046e-01 ] : ProperTorsions/Proper/k2/[#6X4:1]-[#6X4:2]-[#8X2H1:3]-[#1:4]
   2 [  1.63470745e+00 ] : vdW/Atom/epsilon/[#1:1]-[#6X4]
   3 [ -2.92960278e-01 ] : vdW/Atom/rmin_half/[#1:1]-[#6X4]
   4 [  9.69695162e-01 ] : vdW/Atom/epsilon/[#1:1]-[#6X4]-[#7,#8,#9,#16,#17,#35]
   5 [ -1.63084270e-01 ] : vdW/Atom/rmin_half/[#1:1]-[#6X4]-[#7,#8,#9,#16,#17,#35]
   6 [ -1.04679082e-01 ] : vdW/Atom/epsilon/[#1:1]-[#8]
   7 [  9.59203419e-01 ] : vdW/Atom/epsilon/[#6X4:1]
   8 [  1.57782710e+00 ] : vdW/Atom/rmin_half/[#6X4:1]
   9 [ -1.28018910e-01 ] : vdW/Atom/epsilon/[#8X2H1+0:1]
  10 [ -7.60914681e+00 ] : vdW/Atom/rmin_half/[#8X2H1+0:1]
----------------------------------------------------------
#========================================================#
#| [94m                   Total Hessian                    [0m |#
#========================================================#
 7.22785530e+00  5.17141350e-02  1.19729632e+00  1.53813031e+00  9.16209804e-01  8.17191205e-01 -2.24005760e-01  4.88190933e-01  1.50353027e+00 -1.84575443e-01 -6.71525465e+00 
 5.17141350e-02  7.75066902e+00  6.42248769e+00 -5.17619464e+00  5.12449191e+00 -3.43529698e-01 -2.15012064e+00  4.74286204e+00  7.76167300e+00 -7.94507958e-01 -3.86707122e+01 
 1.19729632e+00  6.42248769e+00  1.66361415e+02 -1.80048125e+02  1.05543936e+02 -7.02359247e+01 -1.62608944e+01  1.22361522e+02  1.51655498e+02 -7.09637517e+00 -6.95453559e+02 
 1.53813031e+00 -5.17619464e+00 -1.80048125e+02  5.41452904e+02 -1.02825390e+02  2.35173606e+02  1.95874490e+00 -1.85431666e+02 -1.28426154e+02 -7.50081626e+00  6.05942236e+02 
 9.16209804e-01  5.12449191e+00  1.05543936e+02 -1.02825390e+02  7.06967280e+01 -3.84883730e+01 -1.15761533e+01  7.67090323e+01  9.92927760e+01 -5.22129761e+00 -4.53951107e+02 
 8.17191205e-01 -3.43529698e-01 -7.02359247e+01  2.35173606e+02 -3.84883730e+01  1.06376555e+02 -1.31371799e+00 -7.59752803e+01 -4.65949502e+01 -4.21382048e+00  2.21964680e+02 
-2.24005760e-01 -2.15012064e+00 -1.62608944e+01  1.95874490e+00 -1.15761533e+01 -1.31371799e+00  5.11245049e+00 -9.78625350e+00 -1.73665968e+01  1.55811939e+00  7.86586566e+01 
 4.88190933e-01  4.74286204e+00  1.22361522e+02 -1.85431666e+02  7.67090323e+01 -7.59752803e+01 -9.78625350e+00  1.00826567e+02  1.07331872e+02 -3.00599947e+00 -4.94749843e+02 
 1.50353027e+00  7.76167300e+00  1.51655498e+02 -1.28426154e+02  9.92927760e+01 -4.65949502e+01 -1.73665968e+01  1.07331872e+02  1.46770220e+02 -8.37692365e+00 -6.61968750e+02 
-1.84575443e-01 -7.94507958e-01 -7.09637517e+00 -7.50081626e+00 -5.22129761e+00 -4.21382048e+00  1.55811939e+00 -3.00599947e+00 -8.37692365e+00  3.03667291e+00  3.80710169e+01 
-6.71525465e+00 -3.86707122e+01 -6.95453559e+02  6.05942236e+02 -4.53951107e+02  2.21964680e+02  7.86586566e+01 -4.94749843e+02 -6.61968750e+02  3.80710169e+01  3.04233284e+03 
----------------------------------------------------------
Calculating nonlinear optimization step
Newton-Raphson step found (length 7.3600e-02)
#========================================================#
#| [95m  Mathematical Parameters (Current + Step = Next)   [0m |#
#========================================================#
   0 [  1.8033e-01 + 1.0173e-03 =  1.8134e-01 ] : ProperTorsions/Proper/k1/[#6X4:1]-[#6X4:2]-[#8X2H1:3]-[#1:4]
   1 [ -1.1108e-01 - 1.0552e-02 = -1.2163e-01 ] : ProperTorsions/Proper/k2/[#6X4:1]-[#6X4:2]-[#8X2H1:3]-[#1:4]
   2 [  1.0867e-01 - 1.2746e-02 =  9.5920e-02 ] : vdW/Atom/epsilon/[#1:1]-[#6X4]
   3 [  1.0420e-01 - 1.8885e-02 =  8.5317e-02 ] : vdW/Atom/rmin_half/[#1:1]-[#6X4]
   4 [  2.2701e-02 + 3.7151e-02 =  5.9852e-02 ] : vdW/Atom/epsilon/[#1:1]-[#6X4]-[#7,#8,#9,#16,#17,#35]
   5 [  1.5446e-03 + 3.6905e-02 =  3.8450e-02 ] : vdW/Atom/rmin_half/[#1:1]-[#6X4]-[#7,#8,#9,#16,#17,#35]
   6 [  7.9333e-03 - 3.7193e-02 = -2.9259e-02 ] : vdW/Atom/epsilon/[#1:1]-[#8]
   7 [  2.0892e-02 + 1.1305e-02 =  3.2197e-02 ] : vdW/Atom/epsilon/[#6X4:1]
   8 [  3.8642e-02 + 1.8873e-02 =  5.7516e-02 ] : vdW/Atom/rmin_half/[#6X4:1]
   9 [  3.9510e-03 - 2.6191e-03 =  1.3319e-03 ] : vdW/Atom/epsilon/[#8X2H1+0:1]
  10 [ -6.7800e-02 + 1.3007e-02 = -5.4793e-02 ] : vdW/Atom/rmin_half/[#8X2H1+0:1]
----------------------------------------------------------
#========================================================#
#| [95m    Physical Parameters (Current + Step = Next)     [0m |#
#========================================================#
   0 [  3.4033e-01 + 1.0173e-03 =  3.4134e-01 ] : ProperTorsions/Proper/k1/[#6X4:1]-[#6X4:2]-[#8X2H1:3]-[#1:4]
   1 [  1.3892e-01 - 1.0552e-02 =  1.2837e-01 ] : ProperTorsions/Proper/k2/[#6X4:1]-[#6X4:2]-[#8X2H1:3]-[#1:4]
   2 [  2.6567e-02 - 1.2746e-03 =  2.5292e-02 ] : vdW/Atom/epsilon/[#1:1]-[#6X4]
   3 [  1.5912e+00 - 1.8885e-02 =  1.5723e+00 ] : vdW/Atom/rmin_half/[#1:1]-[#6X4]
   4 [  1.7970e-02 + 3.7151e-03 =  2.1685e-02 ] : vdW/Atom/epsilon/[#1:1]-[#6X4]-[#7,#8,#9,#16,#17,#35]
   5 [  1.3885e+00 + 3.6905e-02 =  1.4255e+00 ] : vdW/Atom/rmin_half/[#1:1]-[#6X4]-[#7,#8,#9,#16,#17,#35]
   6 [  8.4603e-04 - 8.4603e-04 =  0.0000e+00 ] : vdW/Atom/epsilon/[#1:1]-[#8]
   7 [  1.1149e-01 + 1.1305e-03 =  1.1262e-01 ] : vdW/Atom/epsilon/[#6X4:1]
   8 [  1.9466e+00 + 1.8873e-02 =  1.9655e+00 ] : vdW/Atom/rmin_half/[#6X4:1]
   9 [  2.1080e-01 - 2.6191e-04 =  2.1053e-01 ] : vdW/Atom/epsilon/[#8X2H1+0:1]
  10 [  1.6532e+00 + 1.3007e-02 =  1.6662e+00 ] : vdW/Atom/rmin_half/[#8X2H1+0:1]
----------------------------------------------------------
Input file with saved parameters: optimize.sav
#========================================================#
#| [94m     Iteration 3: Evaluating objective function     [0m |#
#| [94m        and derivatives through second order        [0m |#
#========================================================#
#========================================================#
#|  Target: ethanol-liquid - launching MD simulations   |#
#|         Time steps: 50000 (eq) + 500000 (md)         |#
#========================================================#
Running condensed phase simulation locally.
You may tail -f /home2/qyd/projects/forcebalance-dev/studies/017_smirnoff_ethanol/optimize.tmp/ethanol-liquid/iter_0003/298.15K-1.0atm/npt.out in another terminal window
Executing process: [92mbash runcuda.sh python npt.py smirnoff 298.150 1.000[0m Output: npt.out
Running condensed phase simulation locally.
You may tail -f /home2/qyd/projects/forcebalance-dev/studies/017_smirnoff_ethanol/optimize.tmp/ethanol-liquid/iter_0003/320.03K-1.0atm/npt.out in another terminal window
Executing process: [92mbash runcuda.sh python npt.py smirnoff 320.030 1.000[0m Output: npt.out
Reading information from ./298.15K-1.0atm/npt_result.p
Reading information from ./320.03K-1.0atm/npt_result.p
Weights have been renormalized to 1.0
Physical quantity Density uses denominator =  30.0000
Weights have been renormalized to 1.0
Physical quantity H_vap uses denominator =  3.0000
#==========================================================================================#
#| [1;94m                          ethanol-liquid Density (kg m^-3)                            [0m |#
#| [1;94m Temperature  Pressure  Reference  Calculated +- Stdev     Delta    Weight    Term    [0m |#
#==========================================================================================#
      298.15      1.0 atm   785.000      784.447 +- 0.639    -0.553   0.50000   0.00017 
      320.03      1.0 atm   766.000      765.006 +- 0.565    -0.994   0.50000   0.00055 
--------------------------------------------------------------------------------------------
#========================================================#
#| [92m  Density objective function:  0.001, Derivative:   [0m |#
#========================================================#
   0 [ -5.1090e-03 ] : ProperTorsions/Proper/k1/[#6X4:1]-[#6X4:2]-[#8X2H1:3]-[#1:4]
   1 [ -7.4508e-03 ] : ProperTorsions/Proper/k2/[#6X4:1]-[#6X4:2]-[#8X2H1:3]-[#1:4]
   2 [ -1.8809e-01 ] : vdW/Atom/epsilon/[#1:1]-[#6X4]
   3 [  6.8607e-01 ] : vdW/Atom/rmin_half/[#1:1]-[#6X4]
   4 [ -1.0850e-01 ] : vdW/Atom/epsilon/[#1:1]-[#6X4]-[#7,#8,#9,#16,#17,#35]
   5 [  3.4776e-01 ] : vdW/Atom/rmin_half/[#1:1]-[#6X4]-[#7,#8,#9,#16,#17,#35]
   6 [ -3.4137e-05 ] : vdW/Atom/epsilon/[#1:1]-[#8]
   7 [ -2.1764e-01 ] : vdW/Atom/epsilon/[#6X4:1]
   8 [ -8.1400e-02 ] : vdW/Atom/rmin_half/[#6X4:1]
   9 [ -1.1036e-02 ] : vdW/Atom/epsilon/[#8X2H1+0:1]
  10 [  6.6750e-01 ] : vdW/Atom/rmin_half/[#8X2H1+0:1]
----------------------------------------------------------
#==========================================================================================#
#| [1;94m                 ethanol-liquid Enthalpy of Vaporization (kJ mol^-1)                  [0m |#
#| [1;94m Temperature  Pressure  Reference  Calculated +- Stdev     Delta    Weight    Term    [0m |#
#==========================================================================================#
      298.15      1.0 atm    42.300       42.581 +- 0.200     0.281   0.50000   0.00440 
      320.03      1.0 atm    41.000       40.645 +- 0.188    -0.355   0.50000   0.00700 
--------------------------------------------------------------------------------------------
#======================================================================#
#| [92m Enthalpy of Vaporization objective function:  0.011, Derivative: [0m |#
#======================================================================#
   0 [ -8.1282e-03 ] : ProperTorsions/Proper/k1/[#6X4:1]-[#6X4:2]-[#8X2H1:3]-[#1:4]
   1 [ -3.5649e-02 ] : ProperTorsions/Proper/k2/[#6X4:1]-[#6X4:2]-[#8X2H1:3]-[#1:4]
   2 [ -1.7963e-02 ] : vdW/Atom/epsilon/[#1:1]-[#6X4]
   3 [  1.1030e-01 ] : vdW/Atom/rmin_half/[#1:1]-[#6X4]
   4 [ -5.4167e-02 ] : vdW/Atom/epsilon/[#1:1]-[#6X4]-[#7,#8,#9,#16,#17,#35]
   5 [ -2.8442e-02 ] : vdW/Atom/rmin_half/[#1:1]-[#6X4]-[#7,#8,#9,#16,#17,#35]
   6 [  2.3033e-04 ] : vdW/Atom/epsilon/[#1:1]-[#8]
   7 [ -5.1630e-02 ] : vdW/Atom/epsilon/[#6X4:1]
   8 [ -1.4912e-01 ] : vdW/Atom/rmin_half/[#6X4:1]
   9 [ -2.0930e-02 ] : vdW/Atom/epsilon/[#8X2H1+0:1]
  10 [ -1.5195e-01 ] : vdW/Atom/rmin_half/[#8X2H1+0:1]
------------------------------------------------------------------------
#====================================================================#
#| [94m           ethanol-liquid Condensed Phase Properties:           [0m |#
#| [94m  Property Name                Residual x Weight = Contribution [0m |#
#====================================================================#
Density                            0.00072    1.000    7.18042e-04 
Enthalpy of Vaporization           0.01139    1.000    1.13928e-02 
Total                                                  1.21108e-02 
----------------------------------------------------------------------

#============================================================================================#
#|      Target: ethanol-torsiondrive  Type: AbInitio_SMIRNOFF  Objective = 7.71704e-02      |#
#|                    Difference   Denominator     Percent                                  |#
#|  Observable        (Calc-Ref)     RMS (Ref)   Difference       Term   x Wt =   Contrib.  |#
#============================================================================================#
    Energy (kJ/mol)       0.5117        1.8420     27.7796%     0.0772    1.000     0.0772 
----------------------------------------------------------------------------------------------
#===================================================================================#
#| [94m                         Objective Function Breakdown                          [0m |#
#| [94m  Target Name              Residual  x  Weight  =  Contribution (Current-Prev) [0m |#
#===================================================================================#
ethanol-liquid                 0.01211      1.000 [92m     1.21108e-02[0m ( -1.509e-02 ) 
ethanol-torsiondrive           0.07717      1.000 [92m     7.71704e-02[0m ( -1.117e-03 ) 
Regularization                 0.07742      1.000 [91m     7.74246e-02[0m ( +2.779e-03 ) 
Total                                             [92m     1.66706e-01[0m ( -1.343e-02 ) 
-------------------------------------------------------------------------------------
Backing up result/optimize/smirnoff99Frosst.offxml -> result/optimize/smirnoff99Frosst_2.offxml
#========================================================================#
#|  The force field has been written to the result/optimize directory.  |#
#|    Input file with optimization parameters saved to optimize.sav.    |#
#========================================================================#

  Step       |k|        |dk|       |grad|       -=X2=-     Delta(X2)    StepQual
     3   2.783e-01   7.360e-02   8.690e-01[92m   1.66706e-01[0m  -1.343e-02      0.662

#========================================================#
#| [94m                   Total Gradient                   [0m |#
#========================================================#
   0 [ -2.35795798e-02 ] : ProperTorsions/Proper/k1/[#6X4:1]-[#6X4:2]-[#8X2H1:3]-[#1:4]
   1 [ -4.05551710e-02 ] : ProperTorsions/Proper/k2/[#6X4:1]-[#6X4:2]-[#8X2H1:3]-[#1:4]
   2 [ -1.21447649e-01 ] : vdW/Atom/epsilon/[#1:1]-[#6X4]
   3 [  7.12662566e-01 ] : vdW/Atom/rmin_half/[#1:1]-[#6X4]
   4 [ -5.70345690e-02 ] : vdW/Atom/epsilon/[#1:1]-[#6X4]-[#7,#8,#9,#16,#17,#35]
   5 [  3.65204756e-01 ] : vdW/Atom/rmin_half/[#1:1]-[#6X4]-[#7,#8,#9,#16,#17,#35]
   6 [ -5.83223248e-02 ] : vdW/Atom/epsilon/[#1:1]-[#8]
   7 [ -2.04874214e-01 ] : vdW/Atom/epsilon/[#6X4:1]
   8 [ -1.15484454e-01 ] : vdW/Atom/rmin_half/[#6X4:1]
   9 [ -4.07347857e-02 ] : vdW/Atom/epsilon/[#8X2H1+0:1]
  10 [  1.82627757e-01 ] : vdW/Atom/rmin_half/[#8X2H1+0:1]
----------------------------------------------------------
#========================================================#
#| [94m                   Total Hessian                    [0m |#
#========================================================#
 7.26261871e+00  1.35264491e-01  3.19746851e+00 -2.65036458e+00  2.10116407e+00 -9.99630941e-01  9.45856648e-04  2.33376422e+00  3.24042971e+00 -1.76843680e-02 -1.10558876e+01 
 1.35264491e-01  7.72298279e+00  7.48750019e+00 -1.07222114e+01  5.55126612e+00 -3.17165612e+00  2.31494372e-03  6.39664022e+00  8.52595946e+00 -3.59455443e-01 -3.60011749e+01 
 3.19746851e+00  7.48750019e+00  1.68702006e+02 -1.44759255e+02  1.06422650e+02 -5.86074294e+01  5.15355694e-02  1.21152563e+02  1.60291221e+02 -3.52333901e+00 -6.18769681e+02 
-2.65036458e+00 -1.07222114e+01 -1.44759255e+02  3.81523201e+02 -8.82754277e+01  1.83333862e+02 -3.25241151e-02 -1.44755245e+02 -9.36538213e+01 -2.28411773e+00  5.61156559e+02 
 2.10116407e+00  5.55126612e+00  1.06422650e+02 -8.82754277e+01  7.02294477e+01 -3.47980929e+01  3.27383474e-02  7.67864189e+01  1.03673441e+02 -2.38177634e+00 -3.96095204e+02 
-9.99630941e-01 -3.17165612e+00 -5.86074294e+01  1.83333862e+02 -3.47980929e+01  9.27179941e+01 -1.24200966e-02 -6.30662519e+01 -3.14127682e+01 -1.72255379e+00  2.25567836e+02 
 9.45856648e-04  2.31494372e-03  5.15355694e-02 -3.25241151e-02  3.27383474e-02 -1.24200966e-02  2.00001894e+00  3.53373037e-02  5.04514299e-02 -1.57793342e-03 -1.93364314e-01 
 2.33376422e+00  6.39664022e+00  1.21152563e+02 -1.44755245e+02  7.67864189e+01 -6.30662519e+01  3.53373037e-02  9.62519133e+01  1.09658158e+02 -1.71883876e+00 -4.53506420e+02 
 3.24042971e+00  8.52595946e+00  1.60291221e+02 -9.36538213e+01  1.03673441e+02 -3.14127682e+01  5.04514299e-02  1.09658158e+02  1.66022483e+02 -4.36153954e+00 -5.92728557e+02 
-1.76843680e-02 -3.59455443e-01 -3.52333901e+00 -2.28411773e+00 -2.38177634e+00 -1.72255379e+00 -1.57793342e-03 -1.71883876e+00 -4.36153954e+00  2.32472166e+00  1.51644183e+01 
-1.10558876e+01 -3.60011749e+01 -6.18769681e+02  5.61156559e+02 -3.96095204e+02  2.25567836e+02 -1.93364314e-01 -4.53506420e+02 -5.92728557e+02  1.51644183e+01  2.35145759e+03 
----------------------------------------------------------
Convergence criterion reached in step size (1.00e-01)
Convergence criterion reached for objective function (1.00e-01)
#========================================================#
#| [92m               [0m[1mOptimization Converged[0m               [0m |#
#| [92m           Final objective function value           [0m |#
#| [92m  Full:  1.667057e-01  Un-penalized:  8.928117e-02  [0m |#
#========================================================#
#========================================================#
#| [94m           Final optimization parameters:           [0m |#
#========================================================#
   0 [  1.8134e-01 ] : ProperTorsions/Proper/k1/[#6X4:1]-[#6X4:2]-[#8X2H1:3]-[#1:4]
   1 [ -1.2163e-01 ] : ProperTorsions/Proper/k2/[#6X4:1]-[#6X4:2]-[#8X2H1:3]-[#1:4]
   2 [  9.5920e-02 ] : vdW/Atom/epsilon/[#1:1]-[#6X4]
   3 [  8.5317e-02 ] : vdW/Atom/rmin_half/[#1:1]-[#6X4]
   4 [  5.9852e-02 ] : vdW/Atom/epsilon/[#1:1]-[#6X4]-[#7,#8,#9,#16,#17,#35]
   5 [  3.8450e-02 ] : vdW/Atom/rmin_half/[#1:1]-[#6X4]-[#7,#8,#9,#16,#17,#35]
   6 [ -2.9259e-02 ] : vdW/Atom/epsilon/[#1:1]-[#8]
   7 [  3.2197e-02 ] : vdW/Atom/epsilon/[#6X4:1]
   8 [  5.7516e-02 ] : vdW/Atom/rmin_half/[#6X4:1]
   9 [  1.3319e-03 ] : vdW/Atom/epsilon/[#8X2H1+0:1]
  10 [ -5.4793e-02 ] : vdW/Atom/rmin_half/[#8X2H1+0:1]
#========================================================#
#| [94m             Final physical parameters:             [0m |#
#========================================================#
   0 [  3.4134e-01 ] : ProperTorsions/Proper/k1/[#6X4:1]-[#6X4:2]-[#8X2H1:3]-[#1:4]
   1 [  1.2837e-01 ] : ProperTorsions/Proper/k2/[#6X4:1]-[#6X4:2]-[#8X2H1:3]-[#1:4]
   2 [  2.5292e-02 ] : vdW/Atom/epsilon/[#1:1]-[#6X4]
   3 [  1.5723e+00 ] : vdW/Atom/rmin_half/[#1:1]-[#6X4]
   4 [  2.1685e-02 ] : vdW/Atom/epsilon/[#1:1]-[#6X4]-[#7,#8,#9,#16,#17,#35]
   5 [  1.4255e+00 ] : vdW/Atom/rmin_half/[#1:1]-[#6X4]-[#7,#8,#9,#16,#17,#35]
   6 [  0.0000e+00 ] : vdW/Atom/epsilon/[#1:1]-[#8]
   7 [  1.1262e-01 ] : vdW/Atom/epsilon/[#6X4:1]
   8 [  1.9655e+00 ] : vdW/Atom/rmin_half/[#6X4:1]
   9 [  2.1053e-01 ] : vdW/Atom/epsilon/[#8X2H1+0:1]
  10 [  1.6662e+00 ] : vdW/Atom/rmin_half/[#8X2H1+0:1]
----------------------------------------------------------
Backing up result/optimize/smirnoff99Frosst.offxml -> result/optimize/smirnoff99Frosst_3.offxml
#========================================================================#
#|  The force field has been written to the result/optimize directory.  |#
#|    Input file with optimization parameters saved to optimize.sav.    |#
#========================================================================#
#========================================================#
#| [1;44;93m               Calculation Finished.                [0m |#
#| [1;44;93m     ---==(  May the Force be with you!  )==---     [0m |#
#========================================================#
