#======================================================================#
#| [1m            Welcome to ForceBalance version 1.5.5! =D             [0m |#
#| [1m                 Force Field Optimization System                  [0m |#
#| [1m                                                                  [0m |#
#| [1m                             Authors:                             [0m |#
#| [1m                          Lee-Ping Wang                           [0m |#
#| [1m                  Keri A. McKiernan, Yudong Qiu                   [0m |#
#| [1m           Arthur Vigil, Erik G. Brandt, Johnny Israeli           [0m |#
#======================================================================#

                          [44m     [0m                                        
                       [44m        [0m      [43m     [0m                              
                    [44m        [0m   [44m  [0m    [43m         [0m                          
                 [44m       [0m    [44m      [0m      [43m         [0m                       
             [44m        [0m    [44m        [0m          [43m         [0m                    
          [44m        [0m    [44m        [0m                 [43m        [0m                 
       [44m        [0m    [44m       [0m                        [43m        [0m              
    [44m        [0m   [44m        [0m                              [43m         [0m          
   [44m      [0m   [44m        [0m               `.:+@@###@'          [43m         [0m       
    [44m [0m    [44m        [0m          ,;'+###############.             [43m     [0m       
      [44m        [0m         +################':`                    [43m [0m        
      [44m     [0m              `.,,...####+.                                  
                                ,#####      +##.               [44m   [0m   [44m   [0m
 [43m    [0m                            #####      ######             [44m   [0m   [44m   [0m
 [43m    [0m                ###'        ####'     :#####'             [44m   [0m   [44m   [0m
 [43m    [0m                :####@      ####.    ,####'               [44m   [0m   [44m   [0m
 [43m    [0m                 ######     ####    +###+                 [44m   [0m   [44m   [0m
 [43m    [0m                  #####     ####   ###;                   [44m   [0m   [44m   [0m
 [43m    [0m                   :##      ####  ++`                     [44m   [0m   [44m   [0m
 [43m    [0m                            ####``..:;+##############+`   [44m   [0m   [44m   [0m
 [43m    [0m             .,:;;'++##################################`  [44m   [0m   [44m   [0m
 [43m    [0m    `############################++++''';;;;;;;;;;;'';    [44m   [0m   [44m   [0m
 [43m    [0m      ,########':,.``       ####                          [44m   [0m   [44m   [0m
 [43m    [0m                            ####                          [44m   [0m   [44m   [0m
 [43m    [0m                            ####                          [44m   [0m   [44m   [0m
 [43m    [0m                            ####                          [44m   [0m   [44m   [0m
 [43m    [0m                            ####                          [44m   [0m   [44m   [0m
 [43m    [0m                            ####                          [44m   [0m   [44m   [0m
 [43m    [0m                            ####                          [44m   [0m   [44m   [0m
 [43m    [0m                            ####                          [44m   [0m   [44m   [0m
      [44m    [0m                       ####                                   
     [44m        [0m                    ####                                   
    [44m [0m    [44m       [0m                 ####                       [43m     [0m       
   [44m     [0m    [44m        [0m             ####                    [43m        [0m       
   [44m        [0m    [44m        [0m          ###                  [43m         [0m         
      [44m        [0m    [44m        [0m        +`               [43m        [0m             
          [44m        [0m   [44m        [0m                   [43m        [0m                
             [44m        [0m   [44m         [0m           [43m         [0m                   
                [44m        [0m    [44m       [0m      [43m         [0m                      
                   [44m        [0m    [44m   [0m    [43m        [0m                          
                      [44m        [0m       [43m      [0m                             
                          [44m      [0m      [43m  [0m                                
                             [44m  [0m                                         

Reading options from file: 7.box_power12.in
#========================================================#
#| [95m  Options at their default values are not printed   [0m |#
#| [95m        Use 'verbose_options True' to Enable        [0m |#
#========================================================#
Reading force field from file: water.itp
#=========================================================#
#| [92m Starting parameter indices, physical values and IDs [0m |#
#=========================================================#
   0 [  3.1537e-01 ] : VDWS:OW
   1 [  6.4852e-01 ] : VDWT:OW
   2 [  9.5720e-02 ] : BONDSB:HWOW
   3 [  5.0242e+05 ] : BONDSK:HWOW
   4 [  1.0452e+02 ] : ANGLESB:HWOWHW
   5 [  6.2802e+02 ] : ANGLESK:HWOWHW
   6 [  5.2000e-01 ] : COUL:SOL-2
   7 [ -1.0400e+00 ] : COUL:SOL-4
   8 [  1.2800e-01 ] : VSITE3A:SOL-4
-----------------------------------------------------------
#=========================================================#
#| [91m Rescaling Factors by Type (Lower Takes Precedence): [0m |#
#=========================================================#
   BONDSB                               : 1.00000e-02
   BONDSK                               : 1.00000e+02
   ANGLESB                              : 1.00000e+01
   ANGLESK                              : 1.00000e+02
   VDWS                                 : 1.00000e-02
   VDWT                                 : 1.00000e-01
   COUL                                 : 1.00000e-01
   VSITE3A                              : 1.00000e-02
   VSITE3B                              : 1.00000e-02
-----------------------------------------------------------
#========================================================#
#| [91m   Rescaling Types / Factors by Parameter Number:   [0m |#
#========================================================#
   0 [    VDWS                          : 1.00000e-02 ] : VDWS:OW
   1 [    VDWT                          : 1.00000e-01 ] : VDWT:OW
   2 [    BONDSB                        : 1.00000e-02 ] : BONDSB:HWOW
   3 [    BONDSK                        : 1.00000e+02 ] : BONDSK:HWOW
   4 [    ANGLESB                       : 1.00000e+01 ] : ANGLESB:HWOWHW
   5 [    ANGLESK                       : 1.00000e+02 ] : ANGLESK:HWOWHW
   6 [    COUL                          : 1.00000e-01 ] : COUL:SOL-2
   7 [    COUL                          : 1.00000e-01 ] : COUL:SOL-4
   8 [    VSITE3A                       : 1.00000e-02 ] : VSITE3A:SOL-4
----------------------------------------------------------
Building charge constraints...
Parameter 6 occurs 2 times in molecule SOL in locations [1, 2] (COUL:SOL-2 COUL:SOL-3)
Parameter 7 occurs 1 times in molecule SOL in locations [3] (COUL:SOL-4)
#========================================================#
#| [92m               Setup for force field                [0m |#
#========================================================#
fnms                      ['water.itp'] 
priors                    OrderedDict([('BONDSB', 0.01), ('BONDSK', 100.0), ('ANGLESB', 10.0), ('ANGLESK', 100.0), ('VDWS', 0.01), ('VDWT', 0.1), ('COUL', 0.1), ('VSITE3A', 0.01), ('VSITE3B', 0.01)]) 
----------------------------------------------------------
The 'gmxpath' option was not specified; using default.
Fitting the forces on all atoms
#========================================================#
#| [92m           Setup for target cluster-06 :            [0m |#
#========================================================#
name                      cluster-06 
type                      ABINITIO_GMX 
backup                    False 
tgtdir                    targets/cluster-06 
shots                     1208 
----------------------------------------------------------
Fitting the forces on all atoms
#========================================================#
#| [92m           Setup for target cluster-12 :            [0m |#
#========================================================#
name                      cluster-12 
type                      ABINITIO_GMX 
backup                    False 
tgtdir                    targets/cluster-12 
shots                     1201 
----------------------------------------------------------
Using box-style regularization with exponent 12.0, strength 1.0e-03 (+), 0.0e+00 (x)
#========================================================#
#| [92m           Setup for objective function :           [0m |#
#========================================================#
penalty_type              box 
penalty_additive          0.001 
penalty_power             12.0 
----------------------------------------------------------
#========================================================#
#| [92m                Setup for optimizer                 [0m |#
#========================================================#
jobtype                   NEWTON 
trust0                    -1.0 
backup                    False 
input_file                7.box_power12.in 
----------------------------------------------------------
#========================================================#
#| [1m                  Main Optimizer                    [0m |#
#| [1m  Newton-Raphson Method (Hessian Diagonal Search)   [0m |#
#| [1m                                                    [0m |#
#| [1m       [0mConvergence criteria (1 of 3 needed):        [0m |#
#| [1m          [0mObjective Function  : 1.000e-04           [0m |#
#| [1m          [0mNorm of Gradient    : 1.000e-03           [0m |#
#| [1m          [0mParameter step size : 1.000e-04           [0m |#
#========================================================#
#========================================================#
#|       Color Key for Objective Function -=X2=-        |#
#|  [1mBold[0m = Initial step                                 |#
#|  [92mGreen = Current lowest value of objective function[0m  |#
#|  [91mRed = Objective function rises, step rejected[0m       |#
#|  [0mNo color = Not at the lowest value                  |#
#========================================================#
#========================================================#
#| [94m     Iteration 0: Evaluating objective function     [0m |#
#| [94m        and derivatives through second order        [0m |#
#========================================================#

#================================================================================================#
#|               Target: cluster-06  Type: AbInitio_GMX  Objective = 2.29475e-01                |#
#|                        Difference   Denominator     Percent                                  |#
#|  Observable            (Calc-Ref)     RMS (Ref)   Difference       Term   x Wt =   Contrib.  |#
#================================================================================================#
    Energy (kJ/mol)           9.4124       27.3135     34.4605%     0.1188    1.000     0.1188 
    Gradient (kJ/mol/A)      46.4302      139.5348     33.2750%     0.1107    1.000     0.1107 
--------------------------------------------------------------------------------------------------
Maximum force difference on atom 5 (H), frame 1207,  27.6656 kJ/mol/A

#================================================================================================#
#|               Target: cluster-12  Type: AbInitio_GMX  Objective = 2.13018e-01                |#
#|                        Difference   Denominator     Percent                                  |#
#|  Observable            (Calc-Ref)     RMS (Ref)   Difference       Term   x Wt =   Contrib.  |#
#================================================================================================#
    Energy (kJ/mol)          15.2291       47.3455     32.1658%     0.1035    1.000     0.1035 
    Gradient (kJ/mol/A)      45.7106      138.1028     33.0989%     0.1096    1.000     0.1096 
--------------------------------------------------------------------------------------------------
Maximum force difference on atom 19 (M), frame 1200,  46.3943 kJ/mol/A
#====================================================================#
#| [94m                  Objective Function Breakdown                  [0m |#
#| [94m  Target Name              Residual  x  Weight  =  Contribution [0m |#
#====================================================================#
cluster-06                     0.22948      0.500 [94m     1.14738e-01[0m 
cluster-12                     0.21302      0.500 [94m     1.06509e-01[0m 
Regularization                 0.00000      1.000 [94m     0.00000e+00[0m 
Total                                             [94m     2.21247e-01[0m 
----------------------------------------------------------------------

  Step       |k|        |dk|       |grad|       -=X2=-     Delta(X2)    StepQual
     0   0.000e+00   0.000e+00   1.130e+00[1m   2.21247e-01[0m  -0.000e+00      0.000

#========================================================#
#| [94m                   Total Gradient                   [0m |#
#========================================================#
   0 [ -5.15056030e-02 ] : VDWS:OW
   1 [ -1.80412926e-02 ] : VDWT:OW
   2 [ -1.12517554e+00 ] : BONDSB:HWOW
   3 [  7.14110757e-05 ] : BONDSK:HWOW
   4 [ -7.13804492e-02 ] : ANGLESB:HWOWHW
   5 [  3.27233923e-02 ] : ANGLESK:HWOWHW
   6 [ -5.71538974e-03 ] : COUL:SOL-2
   7 [ -4.52212356e-02 ] : COUL:SOL-4
   8 [ -8.59679736e-03 ] : VSITE3A:SOL-4
----------------------------------------------------------
Calculating nonlinear optimization step
Hessian has a small or negative eigenvalue (9.1e-08), mixing in some steepest descent (1.0e-04) to correct this.
Eigenvalues are:
 3.6e+01  2.9e+00  1.9e+00  1.2e-01  3.0e-02  1.2e-02  4.6e-04  1.2e-04  9.1e-08 
Finding trust radius: H+0.0000*I, length 3.8793e+00 (target 1.0000e+00)
Finding trust radius: H+9.0000*I, length 3.2581e-02 (target 1.0000e+00)
Finding trust radius: H+61.6869*I, length 1.1943e-02 (target 1.0000e+00)
Finding trust radius: H+9.0000*I, length 3.2581e-02 (target 1.0000e+00)
Finding trust radius: H+23.5623*I, length 2.0819e-02 (target 1.0000e+00)
Finding trust radius: H+3.4377*I, length 5.1273e-02 (target 1.0000e+00)
Finding trust radius: H+1.3131*I, length 8.3947e-02 (target 1.0000e+00)
Finding trust radius: H+0.5016*I, length 1.5138e-01 (target 1.0000e+00)
Finding trust radius: H+0.1916*I, length 2.8972e-01 (target 1.0000e+00)
Finding trust radius: H+0.0732*I, length 5.2996e-01 (target 1.0000e+00)
Finding trust radius: H+0.0280*I, length 9.2852e-01 (target 1.0000e+00)
Finding trust radius: H+0.0107*I, length 1.5028e+00 (target 1.0000e+00)
Finding trust radius: H+0.0359*I, length 8.0511e-01 (target 1.0000e+00)
Finding trust radius: H+0.0204*I, length 1.1022e+00 (target 1.0000e+00)
Finding trust radius: H+0.0250*I, length 9.8831e-01 (target 1.0000e+00)
Finding trust radius: H+0.0247*I, length 9.9415e-01 (target 1.0000e+00)
Finding trust radius: H+0.0244*I, length 1.0012e+00 (target 1.0000e+00)
Finding trust radius: H+0.0244*I, length 1.0000e+00 (target 1.0000e+00)
Finding trust radius: H+0.0245*I, length 9.9923e-01 (target 1.0000e+00)
Starting Hessian diagonal search with step size 1.0000e+00
Hessian diagonal search: H+0.0244*I, length 1.0000e+00, result -6.9879e-02
Hessian diagonal search: H+13.1429*I, length 2.7435e-02, result -1.9296e-02
Hessian diagonal search: H+29.7745*I, length 1.8453e-02, result -1.5281e-02
Hessian diagonal search: H+0.0244*I, length 1.0000e+00, result -6.9879e-02
Hessian diagonal search: H+3.9506*I, length 4.7927e-02, result -2.4544e-02
Hessian diagonal search: H+2.1944*I, length 6.4061e-02, result -2.7161e-02
Hessian diagonal search: H+0.0523*I, length 6.4737e-01, result -6.0078e-02
Hessian diagonal search: H+0.1164*I, length 3.9904e-01, result -5.0264e-02
Hessian diagonal search: H+0.0004*I, length 3.1197e+00, result  9.2113e+01
Hessian diagonal search: H+0.0515*I, length 6.5311e-01, result -6.0271e-02
Hessian diagonal search: H+0.0108*I, length 1.4963e+00, result -2.7296e-02
Hessian diagonal search: H+0.0336*I, length 8.3690e-01, result -6.5845e-02
Hessian diagonal search: H+0.0186*I, length 1.1570e+00, result -7.2065e-02
Hessian diagonal search: H+0.0154*I, length 1.2730e+00, result -7.0092e-02
Hessian diagonal search: H+0.0195*I, length 1.1276e+00, result -7.1907e-02
Hessian diagonal search: H+0.0185*I, length 1.1580e+00, result -7.2067e-02
Hessian diagonal search: H+0.0182*I, length 1.1698e+00, result -7.2075e-02
Hessian diagonal search: H+0.0171*I, length 1.2078e+00, result -7.1839e-02
Hessian diagonal search: H+0.0183*I, length 1.1667e+00, result -7.2077e-02
Hessian diagonal search: H+0.0182*I, length 1.1677e+00, result -7.2077e-02
Hessian diagonal search: H+0.0183*I, length 1.1657e+00, result -7.2076e-02
Optimization step found (length 1.1667e+00)
#========================================================#
#| [95m  Mathematical Parameters (Current + Step = Next)   [0m |#
#========================================================#
   0 [  0.0000e+00 + 3.7881e-01 =  3.7881e-01 ] : VDWS:OW
   1 [  0.0000e+00 + 1.3308e-01 =  1.3308e-01 ] : VDWT:OW
   2 [  0.0000e+00 + 4.3489e-02 =  4.3489e-02 ] : BONDSB:HWOW
   3 [  0.0000e+00 - 1.9339e-03 = -1.9339e-03 ] : BONDSK:HWOW
   4 [  0.0000e+00 + 5.7349e-02 =  5.7349e-02 ] : ANGLESB:HWOWHW
   5 [  0.0000e+00 - 1.0459e+00 = -1.0459e+00 ] : ANGLESK:HWOWHW
   6 [  0.0000e+00 - 7.1726e-02 = -7.1726e-02 ] : COUL:SOL-2
   7 [  0.0000e+00 + 2.8342e-01 =  2.8342e-01 ] : COUL:SOL-4
   8 [  0.0000e+00 + 1.2384e-01 =  1.2384e-01 ] : VSITE3A:SOL-4
----------------------------------------------------------
#========================================================#
#| [95m    Physical Parameters (Current + Step = Next)     [0m |#
#========================================================#
   0 [  3.1537e-01 + 3.7881e-03 =  3.1915e-01 ] : VDWS:OW
   1 [  6.4852e-01 + 1.3308e-02 =  6.6183e-01 ] : VDWT:OW
   2 [  9.5720e-02 + 4.3489e-04 =  9.6155e-02 ] : BONDSB:HWOW
   3 [  5.0242e+05 - 1.9339e-01 =  5.0242e+05 ] : BONDSK:HWOW
   4 [  1.0452e+02 + 5.7349e-01 =  1.0509e+02 ] : ANGLESB:HWOWHW
   5 [  6.2802e+02 - 1.0459e+02 =  5.2343e+02 ] : ANGLESK:HWOWHW
   6 [  5.2000e-01 - 7.1726e-03 =  5.1283e-01 ] : COUL:SOL-2
   7 [ -1.0400e+00 + 2.8342e-02 = -1.0117e+00 ] : COUL:SOL-4
   8 [  1.2800e-01 + 1.2384e-03 =  1.2924e-01 ] : VSITE3A:SOL-4
----------------------------------------------------------
Backing up 7.box_power12.sav -> 7.box_power12.bak/7.box_power12_5.sav
Input file with saved parameters: 7.box_power12.sav
#========================================================#
#| [94m     Iteration 1: Evaluating objective function     [0m |#
#| [94m        and derivatives through second order        [0m |#
#========================================================#

#================================================================================================#
#|               Target: cluster-06  Type: AbInitio_GMX  Objective = 1.50667e-01                |#
#|                        Difference   Denominator     Percent                                  |#
#|  Observable            (Calc-Ref)     RMS (Ref)   Difference       Term   x Wt =   Contrib.  |#
#================================================================================================#
    Energy (kJ/mol)           8.0533       27.3135     29.4846%     0.0869    1.000     0.0869 
    Gradient (kJ/mol/A)      35.2260      139.5348     25.2453%     0.0637    1.000     0.0637 
--------------------------------------------------------------------------------------------------
Maximum force difference on atom 6 (H), frame 1207,  26.8906 kJ/mol/A

#================================================================================================#
#|               Target: cluster-12  Type: AbInitio_GMX  Objective = 1.44246e-01                |#
#|                        Difference   Denominator     Percent                                  |#
#|  Observable            (Calc-Ref)     RMS (Ref)   Difference       Term   x Wt =   Contrib.  |#
#================================================================================================#
    Energy (kJ/mol)          13.1978       47.3455     27.8755%     0.0777    1.000     0.0777 
    Gradient (kJ/mol/A)      35.6245      138.1028     25.7956%     0.0665    1.000     0.0665 
--------------------------------------------------------------------------------------------------
Maximum force difference on atom 18 (H), frame 1200,  38.2913 kJ/mol/A
#===================================================================================#
#| [94m                         Objective Function Breakdown                          [0m |#
#| [94m  Target Name              Residual  x  Weight  =  Contribution (Current-Prev) [0m |#
#===================================================================================#
cluster-06                     0.15067      0.500 [92m     7.53333e-02[0m ( -3.940e-02 ) 
cluster-12                     0.14425      0.500 [92m     7.21230e-02[0m ( -3.439e-02 ) 
Regularization                 0.00171      1.000 [91m     1.71365e-03[0m ( +1.714e-03 ) 
Total                                             [92m     1.49170e-01[0m ( -7.208e-02 ) 
-------------------------------------------------------------------------------------
#=============================================================================#
#|  The force field has been written to the result/7.box_power12 directory.  |#
#|    Input file with optimization parameters saved to 7.box_power12.sav.    |#
#=============================================================================#

  Step       |k|        |dk|       |grad|       -=X2=-     Delta(X2)    StepQual
     1   1.167e+00   1.167e+00   5.291e-02[92m   1.49170e-01[0m  -7.208e-02      1.000

#========================================================#
#| [94m                   Total Gradient                   [0m |#
#========================================================#
   0 [ -5.25818296e-03 ] : VDWS:OW
   1 [ -1.95391261e-03 ] : VDWT:OW
   2 [  4.36206621e-02 ] : BONDSB:HWOW
   3 [  3.59134133e-05 ] : BONDSK:HWOW
   4 [ -2.84268412e-02 ] : ANGLESB:HWOWHW
   5 [ -9.40975506e-04 ] : ANGLESK:HWOWHW
   6 [ -2.38825800e-03 ] : COUL:SOL-2
   7 [ -6.75608666e-03 ] : COUL:SOL-4
   8 [ -2.21784318e-03 ] : VSITE3A:SOL-4
----------------------------------------------------------
Calculating nonlinear optimization step
Hessian has a small or negative eigenvalue (8.9e-08), mixing in some steepest descent (1.0e-04) to correct this.
Eigenvalues are:
 3.6e+01  2.1e+00  1.8e+00  2.2e-01  1.5e-01  3.4e-02  4.1e-04  1.4e-04  8.9e-08 
Finding trust radius: H+0.0000*I, length 2.5189e+00 (target 1.1667e+00)
Finding trust radius: H+9.0000*I, length 2.5427e-03 (target 1.1667e+00)
Finding trust radius: H+61.6869*I, length 6.2053e-04 (target 1.1667e+00)
Finding trust radius: H+9.0000*I, length 2.5427e-03 (target 1.1667e+00)
Finding trust radius: H+23.5623*I, length 1.2626e-03 (target 1.1667e+00)
Finding trust radius: H+3.4377*I, length 4.9787e-03 (target 1.1667e+00)
Finding trust radius: H+1.3131*I, length 8.7483e-03 (target 1.1667e+00)
Finding trust radius: H+0.5016*I, length 1.4313e-02 (target 1.1667e+00)
Finding trust radius: H+0.1916*I, length 2.3264e-02 (target 1.1667e+00)
Finding trust radius: H+0.0732*I, length 3.6069e-02 (target 1.1667e+00)
Finding trust radius: H+0.0280*I, length 5.8178e-02 (target 1.1667e+00)
Finding trust radius: H+0.0107*I, length 1.1726e-01 (target 1.1667e+00)
Finding trust radius: H+0.0041*I, length 2.6969e-01 (target 1.1667e+00)
Finding trust radius: H+0.0016*I, length 5.9319e-01 (target 1.1667e+00)
Finding trust radius: H+0.0006*I, length 1.1138e+00 (target 1.1667e+00)
Finding trust radius: H+0.0002*I, length 1.6855e+00 (target 1.1667e+00)
Finding trust radius: H+0.0007*I, length 1.0062e+00 (target 1.1667e+00)
Finding trust radius: H+0.0006*I, length 1.1322e+00 (target 1.1667e+00)
Finding trust radius: H+0.0005*I, length 1.1761e+00 (target 1.1667e+00)
Finding trust radius: H+0.0005*I, length 1.1672e+00 (target 1.1667e+00)
Finding trust radius: H+0.0005*I, length 1.1618e+00 (target 1.1667e+00)
Starting Hessian diagonal search with step size 1.1672e+00
Hessian diagonal search: H+0.0005*I, length 1.1672e+00, result  1.4936e-02
Hessian diagonal search: H+9.5691*I, length 2.4314e-03, result -7.9942e-05
Hessian diagonal search: H+64.9769*I, length 5.9611e-04, result -2.6979e-05
Hessian diagonal search: H+9.5691*I, length 2.4314e-03, result -7.9942e-05
Hessian diagonal search: H+24.9079*I, length 1.2130e-03, result -4.8042e-05
Hessian diagonal search: H+3.6892*I, length 4.7541e-03, result -1.2647e-04
Hessian diagonal search: H+1.4304*I, length 8.3573e-03, result -1.7905e-04
Hessian diagonal search: H+0.5596*I, length 1.3538e-02, result -2.2807e-04
Hessian diagonal search: H+0.2221*I, length 2.1635e-02, result -2.7667e-04
Hessian diagonal search: H+0.0901*I, length 3.2923e-02, result -3.1930e-04
Hessian diagonal search: H+0.0378*I, length 4.9150e-02, result -3.5646e-04
Hessian diagonal search: H+0.0167*I, length 8.2396e-02, result -4.0779e-04
Hessian diagonal search: H+0.0079*I, length 1.5205e-01, result -4.9660e-04
Hessian diagonal search: H+0.0041*I, length 2.7059e-01, result -6.3554e-04
Hessian diagonal search: H+0.0023*I, length 4.3187e-01, result -8.1303e-04
Hessian diagonal search: H+0.0015*I, length 6.0913e-01, result -9.7821e-04
Hessian diagonal search: H+0.0011*I, length 7.7110e-01, result -9.4325e-04
Hessian diagonal search: H+0.0014*I, length 6.3268e-01, result -9.9286e-04
Hessian diagonal search: H+0.0013*I, length 6.6509e-01, result -1.0063e-03
Hessian diagonal search: H+0.0012*I, length 7.0319e-01, result -1.0078e-03
Hessian diagonal search: H+0.0013*I, length 6.8784e-01, result -1.0094e-03
Hessian diagonal search: H+0.0013*I, length 6.8499e-01, result -1.0093e-03
Hessian diagonal search: H+0.0013*I, length 6.9070e-01, result -1.0095e-03
Hessian diagonal search: H+0.0013*I, length 6.9544e-01, result -1.0091e-03
Optimization step found (length 6.9070e-01)
#========================================================#
#| [95m  Mathematical Parameters (Current + Step = Next)   [0m |#
#========================================================#
   0 [  3.7881e-01 + 1.7603e-02 =  3.9641e-01 ] : VDWS:OW
   1 [  1.3308e-01 + 7.7640e-02 =  2.1072e-01 ] : VDWT:OW
   2 [  4.3489e-02 - 3.0571e-05 =  4.3459e-02 ] : BONDSB:HWOW
   3 [ -1.9339e-03 - 2.6818e-02 = -2.8752e-02 ] : BONDSK:HWOW
   4 [  5.7349e-02 + 7.1049e-03 =  6.4454e-02 ] : ANGLESB:HWOWHW
   5 [ -1.0459e+00 + 2.1062e-03 = -1.0438e+00 ] : ANGLESK:HWOWHW
   6 [ -7.1726e-02 + 5.8504e-02 = -1.3222e-02 ] : COUL:SOL-2
   7 [  2.8342e-01 - 8.9822e-02 =  1.9360e-01 ] : COUL:SOL-4
   8 [  1.2384e-01 + 6.7710e-01 =  8.0095e-01 ] : VSITE3A:SOL-4
----------------------------------------------------------
#========================================================#
#| [95m    Physical Parameters (Current + Step = Next)     [0m |#
#========================================================#
   0 [  3.1915e-01 + 1.7603e-04 =  3.1933e-01 ] : VDWS:OW
   1 [  6.6183e-01 + 7.7640e-03 =  6.6959e-01 ] : VDWT:OW
   2 [  9.6155e-02 - 3.0571e-07 =  9.6155e-02 ] : BONDSB:HWOW
   3 [  5.0242e+05 - 2.6818e+00 =  5.0241e+05 ] : BONDSK:HWOW
   4 [  1.0509e+02 + 7.1049e-02 =  1.0516e+02 ] : ANGLESB:HWOWHW
   5 [  5.2343e+02 + 2.1062e-01 =  5.2364e+02 ] : ANGLESK:HWOWHW
   6 [  5.1283e-01 + 5.8504e-03 =  5.1868e-01 ] : COUL:SOL-2
   7 [ -1.0117e+00 - 8.9822e-03 = -1.0206e+00 ] : COUL:SOL-4
   8 [  1.2924e-01 + 6.7710e-03 =  1.3601e-01 ] : VSITE3A:SOL-4
----------------------------------------------------------
Input file with saved parameters: 7.box_power12.sav
#========================================================#
#| [94m     Iteration 2: Evaluating objective function     [0m |#
#| [94m        and derivatives through second order        [0m |#
#========================================================#

#================================================================================================#
#|               Target: cluster-06  Type: AbInitio_GMX  Objective = 1.49380e-01                |#
#|                        Difference   Denominator     Percent                                  |#
#|  Observable            (Calc-Ref)     RMS (Ref)   Difference       Term   x Wt =   Contrib.  |#
#================================================================================================#
    Energy (kJ/mol)           7.9839       27.3135     29.2307%     0.0854    1.000     0.0854 
    Gradient (kJ/mol/A)      35.2823      139.5348     25.2857%     0.0639    1.000     0.0639 
--------------------------------------------------------------------------------------------------
Maximum force difference on atom 6 (H), frame 1207,  25.0544 kJ/mol/A

#================================================================================================#
#|               Target: cluster-12  Type: AbInitio_GMX  Objective = 1.43457e-01                |#
#|                        Difference   Denominator     Percent                                  |#
#|  Observable            (Calc-Ref)     RMS (Ref)   Difference       Term   x Wt =   Contrib.  |#
#================================================================================================#
    Energy (kJ/mol)          13.1392       47.3455     27.7516%     0.0770    1.000     0.0770 
    Gradient (kJ/mol/A)      35.5977      138.1028     25.7762%     0.0664    1.000     0.0664 
--------------------------------------------------------------------------------------------------
Maximum force difference on atom 18 (H), frame 1200,  35.9489 kJ/mol/A
#===================================================================================#
#| [94m                         Objective Function Breakdown                          [0m |#
#| [94m  Target Name              Residual  x  Weight  =  Contribution (Current-Prev) [0m |#
#===================================================================================#
cluster-06                     0.14938      0.500 [92m     7.46898e-02[0m ( -6.436e-04 ) 
cluster-12                     0.14346      0.500 [92m     7.17283e-02[0m ( -3.946e-04 ) 
Regularization                 0.00174      1.000 [91m     1.74240e-03[0m ( +2.875e-05 ) 
Total                                             [92m     1.48160e-01[0m ( -1.009e-03 ) 
-------------------------------------------------------------------------------------
#=============================================================================#
#|  The force field has been written to the result/7.box_power12 directory.  |#
#|    Input file with optimization parameters saved to 7.box_power12.sav.    |#
#=============================================================================#

  Step       |k|        |dk|       |grad|       -=X2=-     Delta(X2)    StepQual
     2   1.406e+00   6.907e-01   1.091e-03[92m   1.48160e-01[0m  -1.009e-03      1.000

#========================================================#
#| [94m                   Total Gradient                   [0m |#
#========================================================#
   0 [  1.09086368e-04 ] : VDWS:OW
   1 [ -5.92837254e-05 ] : VDWT:OW
   2 [ -9.03011771e-04 ] : BONDSB:HWOW
   3 [  3.52437651e-05 ] : BONDSK:HWOW
   4 [  3.00140513e-04 ] : ANGLESB:HWOWHW
   5 [  1.91159098e-06 ] : ANGLESK:HWOWHW
   6 [ -4.50306893e-04 ] : COUL:SOL-2
   7 [  2.15805719e-04 ] : COUL:SOL-4
   8 [  1.33404577e-04 ] : VSITE3A:SOL-4
----------------------------------------------------------
Calculating nonlinear optimization step
Hessian has a small or negative eigenvalue (8.8e-08), mixing in some steepest descent (1.0e-04) to correct this.
Eigenvalues are:
 3.6e+01  2.1e+00  1.8e+00  2.1e-01  1.5e-01  3.4e-02  1.4e-02  1.4e-04  8.8e-08 
Starting Hessian diagonal search with step size 5.1784e-01
Hessian diagonal search: H+0.0000*I, length 5.1784e-01, result -3.8058e-05
Hessian diagonal search: H+9.0000*I, length 5.9145e-05, result  6.4966e-08
Hessian diagonal search: H+23.5623*I, length 2.7412e-05, result  4.9251e-08
Hessian diagonal search: H+0.0000*I, length 5.1784e-01, result -3.8058e-05
Hessian diagonal search: H+3.4377*I, length 1.3285e-04, result -1.0983e-07
Hessian diagonal search: H+1.3131*I, length 3.0030e-04, result -1.6552e-07
Hessian diagonal search: H+0.1250*I, length 2.0915e-03, result -6.4946e-07
Hessian diagonal search: H+0.1556*I, length 1.7717e-03, result -5.8467e-07
Hessian diagonal search: H+0.0004*I, length 1.5711e-01, result -1.5729e-05
Hessian diagonal search: H+0.0257*I, length 6.0904e-03, result -1.5988e-06
Hessian diagonal search: H+0.0038*I, length 2.5839e-02, result -3.8455e-06
Hessian diagonal search: H+0.0003*I, length 1.9640e-01, result -1.8886e-05
Hessian diagonal search: H+0.0000*I, length 5.1464e-01, result -3.7990e-05
Hessian diagonal search: H+0.0000*I, length 5.1781e-01, result -3.8057e-05
Hessian diagonal search: H+0.0000*I, length 5.1781e-01, result -3.8057e-05
Optimization step found (length 5.1784e-01)
#========================================================#
#| [95m  Mathematical Parameters (Current + Step = Next)   [0m |#
#========================================================#
   0 [  3.9641e-01 - 1.1988e-01 =  2.7653e-01 ] : VDWS:OW
   1 [  2.1072e-01 + 3.5999e-01 =  5.7070e-01 ] : VDWT:OW
   2 [  4.3459e-02 - 8.3374e-05 =  4.3375e-02 ] : BONDSB:HWOW
   3 [ -2.8752e-02 - 3.5233e-01 = -3.8109e-01 ] : BONDSK:HWOW
   4 [  6.4454e-02 - 3.1300e-04 =  6.4141e-02 ] : ANGLESB:HWOWHW
   5 [ -1.0438e+00 + 3.5756e-05 = -1.0438e+00 ] : ANGLESK:HWOWHW
   6 [ -1.3222e-02 + 2.9367e-03 = -1.0285e-02 ] : COUL:SOL-2
   7 [  1.9360e-01 - 6.5139e-03 =  1.8709e-01 ] : COUL:SOL-4
   8 [  8.0095e-01 - 3.0276e-03 =  7.9792e-01 ] : VSITE3A:SOL-4
----------------------------------------------------------
#========================================================#
#| [95m    Physical Parameters (Current + Step = Next)     [0m |#
#========================================================#
   0 [  3.1933e-01 - 1.1988e-03 =  3.1813e-01 ] : VDWS:OW
   1 [  6.6959e-01 + 3.5999e-02 =  7.0559e-01 ] : VDWT:OW
   2 [  9.6155e-02 - 8.3374e-07 =  9.6154e-02 ] : BONDSB:HWOW
   3 [  5.0241e+05 - 3.5233e+01 =  5.0238e+05 ] : BONDSK:HWOW
   4 [  1.0516e+02 - 3.1300e-03 =  1.0516e+02 ] : ANGLESB:HWOWHW
   5 [  5.2364e+02 + 3.5756e-03 =  5.2364e+02 ] : ANGLESK:HWOWHW
   6 [  5.1868e-01 + 2.9367e-04 =  5.1897e-01 ] : COUL:SOL-2
   7 [ -1.0206e+00 - 6.5139e-04 = -1.0213e+00 ] : COUL:SOL-4
   8 [  1.3601e-01 - 3.0276e-05 =  1.3598e-01 ] : VSITE3A:SOL-4
----------------------------------------------------------
Input file with saved parameters: 7.box_power12.sav
#========================================================#
#| [94m     Iteration 3: Evaluating objective function     [0m |#
#| [94m        and derivatives through second order        [0m |#
#========================================================#

#================================================================================================#
#|               Target: cluster-06  Type: AbInitio_GMX  Objective = 1.49398e-01                |#
#|                        Difference   Denominator     Percent                                  |#
#|  Observable            (Calc-Ref)     RMS (Ref)   Difference       Term   x Wt =   Contrib.  |#
#================================================================================================#
    Energy (kJ/mol)           7.9801       27.3135     29.2168%     0.0854    1.000     0.0854 
    Gradient (kJ/mol/A)      35.3095      139.5348     25.3052%     0.0640    1.000     0.0640 
--------------------------------------------------------------------------------------------------
Maximum force difference on atom 6 (H), frame 1207,  25.1903 kJ/mol/A

#================================================================================================#
#|               Target: cluster-12  Type: AbInitio_GMX  Objective = 1.43368e-01                |#
#|                        Difference   Denominator     Percent                                  |#
#|  Observable            (Calc-Ref)     RMS (Ref)   Difference       Term   x Wt =   Contrib.  |#
#================================================================================================#
    Energy (kJ/mol)          13.1215       47.3455     27.7143%     0.0768    1.000     0.0768 
    Gradient (kJ/mol/A)      35.6293      138.1028     25.7991%     0.0666    1.000     0.0666 
--------------------------------------------------------------------------------------------------
Maximum force difference on atom 18 (H), frame 1200,  36.1660 kJ/mol/A
#===================================================================================#
#| [94m                         Objective Function Breakdown                          [0m |#
#| [94m  Target Name              Residual  x  Weight  =  Contribution (Current-Prev) [0m |#
#===================================================================================#
cluster-06                     0.14940      0.500 [91m     7.46988e-02[0m ( +8.997e-06 ) 
cluster-12                     0.14337      0.500 [92m     7.16839e-02[0m ( -4.446e-05 ) 
Regularization                 0.00174      1.000 [92m     1.73980e-03[0m ( -2.596e-06 ) 
Total                                             [92m     1.48122e-01[0m ( -3.806e-05 ) 
-------------------------------------------------------------------------------------
#=============================================================================#
#|  The force field has been written to the result/7.box_power12 directory.  |#
#|    Input file with optimization parameters saved to 7.box_power12.sav.    |#
#=============================================================================#

  Step       |k|        |dk|       |grad|       -=X2=-     Delta(X2)    StepQual
     3   1.521e+00   5.178e-01   8.392e-04[92m   1.48122e-01[0m  -3.806e-05      1.000

#========================================================#
#| [94m                   Total Gradient                   [0m |#
#========================================================#
   0 [ -4.05068298e-04 ] : VDWS:OW
   1 [ -1.48671939e-04 ] : VDWT:OW
   2 [  3.27325845e-04 ] : BONDSB:HWOW
   3 [  4.32029883e-05 ] : BONDSK:HWOW
   4 [ -2.54402106e-04 ] : ANGLESB:HWOWHW
   5 [  6.71420005e-08 ] : ANGLESK:HWOWHW
   6 [  5.85398093e-04 ] : COUL:SOL-2
   7 [  3.99033213e-05 ] : COUL:SOL-4
   8 [ -6.20935005e-06 ] : VSITE3A:SOL-4
----------------------------------------------------------
Convergence criterion reached for gradient norm (1.00e-03)
Convergence criterion reached for objective function (1.00e-04)
#========================================================#
#| [92m               [0m[1mOptimization Converged[0m               [0m |#
#| [92m           Final objective function value           [0m |#
#| [92m  Full:  1.481224e-01  Un-penalized:  1.463826e-01  [0m |#
#========================================================#
#========================================================#
#| [94m           Final optimization parameters:           [0m |#
#========================================================#
   0 [  2.7653e-01 ] : VDWS:OW
   1 [  5.7070e-01 ] : VDWT:OW
   2 [  4.3375e-02 ] : BONDSB:HWOW
   3 [ -3.8109e-01 ] : BONDSK:HWOW
   4 [  6.4141e-02 ] : ANGLESB:HWOWHW
   5 [ -1.0438e+00 ] : ANGLESK:HWOWHW
   6 [ -1.0285e-02 ] : COUL:SOL-2
   7 [  1.8709e-01 ] : COUL:SOL-4
   8 [  7.9792e-01 ] : VSITE3A:SOL-4
#========================================================#
#| [94m             Final physical parameters:             [0m |#
#========================================================#
   0 [  3.1813e-01 ] : VDWS:OW
   1 [  7.0559e-01 ] : VDWT:OW
   2 [  9.6154e-02 ] : BONDSB:HWOW
   3 [  5.0238e+05 ] : BONDSK:HWOW
   4 [  1.0516e+02 ] : ANGLESB:HWOWHW
   5 [  5.2364e+02 ] : ANGLESK:HWOWHW
   6 [  5.1897e-01 ] : COUL:SOL-2
   7 [ -1.0213e+00 ] : COUL:SOL-4
   8 [  1.3598e-01 ] : VSITE3A:SOL-4
----------------------------------------------------------
#=============================================================================#
#|  The force field has been written to the result/7.box_power12 directory.  |#
#|    Input file with optimization parameters saved to 7.box_power12.sav.    |#
#=============================================================================#
#========================================================#
#| [1;44;93m               Calculation Finished.                [0m |#
#| [1;44;93m     ---==(  May the Force be with you!  )==---     [0m |#
#========================================================#
