
########################################################################
###[1m             Welcome to ForceBalance version 1.0! =D              [0m###
###[1m                 Force Field Optimization System                  [0m###
###[1m                      Author: Lee-Ping Wang                       [0m###
########################################################################

                          [44m     [0m                                        
                       [44m        [0m      [43m     [0m                              
                    [44m        [0m   [44m  [0m    [43m         [0m                          
                 [44m       [0m    [44m      [0m      [43m         [0m                       
             [44m        [0m    [44m        [0m          [43m         [0m                    
          [44m        [0m    [44m        [0m                 [43m        [0m                 
       [44m        [0m    [44m       [0m                        [43m        [0m              
    [44m        [0m   [44m        [0m                              [43m         [0m          
   [44m      [0m   [44m        [0m               `.:+@@###@'          [43m         [0m       
    [44m [0m    [44m        [0m          ,;'+###############.             [43m     [0m       
      [44m        [0m         +################':`                    [43m [0m        
      [44m     [0m              `.,,...####+.                                  
                                ,#####      +##.               [44m   [0m   [44m   [0m
 [43m    [0m                            #####      ######             [44m   [0m   [44m   [0m
 [43m    [0m                ###'        ####'     :#####'             [44m   [0m   [44m   [0m
 [43m    [0m                :####@      ####.    ,####'               [44m   [0m   [44m   [0m
 [43m    [0m                 ######     ####    +###+                 [44m   [0m   [44m   [0m
 [43m    [0m                  #####     ####   ###;                   [44m   [0m   [44m   [0m
 [43m    [0m                   :##      ####  ++`                     [44m   [0m   [44m   [0m
 [43m    [0m                            ####``..:;+##############+`   [44m   [0m   [44m   [0m
 [43m    [0m             .,:;;'++##################################`  [44m   [0m   [44m   [0m
 [43m    [0m    `############################++++''';;;;;;;;;;;'';    [44m   [0m   [44m   [0m
 [43m    [0m      ,########':,.``       ####                          [44m   [0m   [44m   [0m
 [43m    [0m                            ####                          [44m   [0m   [44m   [0m
 [43m    [0m                            ####                          [44m   [0m   [44m   [0m
 [43m    [0m                            ####                          [44m   [0m   [44m   [0m
 [43m    [0m                            ####                          [44m   [0m   [44m   [0m
 [43m    [0m                            ####                          [44m   [0m   [44m   [0m
 [43m    [0m                            ####                          [44m   [0m   [44m   [0m
 [43m    [0m                            ####                          [44m   [0m   [44m   [0m
      [44m    [0m                       ####                                   
     [44m        [0m                    ####                                   
    [44m [0m    [44m       [0m                 ####                       [43m     [0m       
   [44m     [0m    [44m        [0m             ####                    [43m        [0m       
   [44m        [0m    [44m        [0m          ###                  [43m         [0m         
      [44m        [0m    [44m        [0m        +`               [43m        [0m             
          [44m        [0m   [44m        [0m                   [43m        [0m                
             [44m        [0m   [44m         [0m           [43m         [0m                   
                [44m        [0m    [44m       [0m      [43m         [0m                      
                   [44m        [0m    [44m   [0m    [43m        [0m                          
                      [44m        [0m       [43m      [0m                             
                          [44m      [0m      [43m  [0m                                
                             [44m  [0m                                         

Reading options from file: very_simple.in

##########################################################
###[95m  Options at their default values are not printed   [0m###
###[95m        Use 'verbose_options True' to Enable        [0m###
##########################################################
Reading force field from file: water.itp

###########################################################
###[92m Starting parameter indices, physical values and IDs [0m###
###########################################################
   0 [  3.1537e-01 ] : VDWS:OW
   1 [  6.4852e-01 ] : VDWT:OW
   2 [  9.5720e-02 ] : BONDSB:HWOW
   3 [  5.0242e+05 ] : BONDSK:HWOW
   4 [  1.0452e+02 ] : ANGLESB:HWOWHW
   5 [  6.2802e+02 ] : ANGLESK:HWOWHW
   6 [  5.2000e-01 ] : COUL:SOL-2 COUL:SOL-3
   7 [ -1.0400e+00 ] : COUL:SOL-4
   8 [  1.2800e-01 ] : VSITE3B:SOL-4 VSITE3A:SOL-4
-----------------------------------------------------------

##########################################################
###[91m    Rescaling Factors (Lower Takes Precedence):     [0m###
##########################################################
   BONDSB                               : 5.29177e-02
   BONDSK                               : 9.37583e+05
   VSITE3A                              : 5.29177e-02
   VSITE3B                              : 5.29177e-02
   ANGLESB                              : 5.72958e+01
   VDWS                                 : 5.29177e-02
   ANGLESK                              : 6.05928e+02
   COUL                                 : 1.00000e+00
   VDWT                                 : 2.47894e+00
----------------------------------------------------------
Building charge constraints...
Parameter 6 occurs 2 times in molecule SOL in locations [1, 2] (COUL:SOL-2 COUL:SOL-3)
Parameter 7 occurs 1 times in molecule SOL in locations [3] (COUL:SOL-4)

##########################################################
###[92m               Setup for force field                [0m###
##########################################################

----------------------------------------------------------

##########################################################
###[92m           Setup for target cluster-06 :            [0m###
##########################################################
name                      cluster-06 
type                      ABINITIO_GMX 
tgtdir                    targets/cluster-06 
shots                     1208 
----------------------------------------------------------

##########################################################
###[92m           Setup for target cluster-12 :            [0m###
##########################################################
name                      cluster-12 
type                      ABINITIO_GMX 
tgtdir                    targets/cluster-12 
shots                     1201 
----------------------------------------------------------
Using parabolic regularization (Gaussian prior) with strength 1.0e-02 (+), 0.0e+00 (x)

##########################################################
###[92m           Setup for objective function :           [0m###
##########################################################
penalty_additive          0.01 
----------------------------------------------------------

##########################################################
###[92m                Setup for optimizer                 [0m###
##########################################################
jobtype                   NEWTON 
----------------------------------------------------------

##########################################################
###[1m                   Main Optimizer                   [0m###
###[1m       Newton-Raphson Mode (Adaptive Radius)        [0m###
##########################################################

Target: cluster-06      Errors: Energy =   9.4124 kJ/mol (34.4605%) Atomic Force (%) =  32.4778 Objective = 1.12062e-01
Target: cluster-12      Errors: Energy =  15.2291 kJ/mol (32.1658%) Atomic Force (%) =  32.3608 Objective = 1.04094e-01

######################################################################
###[94m                  Objective Function Breakdown                  [0m###
###[94m  Target Name              Residual  x  Weight  =  Contribution [0m###
######################################################################
cluster-06                     0.11206      0.500 [94m     5.60309e-02[0m 
cluster-12                     0.10409      0.500 [94m     5.20472e-02[0m 
Regularization                 0.00000      1.000 [94m     0.00000e+00[0m 
Total                                             [94m     1.08078e-01[0m 
----------------------------------------------------------------------
  Step       |k|        |dk|       |grad|       -=X2=-     Stdev(X2)    StepQual
     0   0.000e+00   0.000e+00   3.202e+00[1m   1.08078e-01[0m   0.000e+00      1.000


##########################################################
###[96m                   Total Gradient                   [0m###
##########################################################
   0 [ -1.3660e-01 ] : VDWS:OW
   1 [ -2.2433e-01 ] : VDWT:OW
   2 [ -3.1494e+00 ] : BONDSB:HWOW
   3 [  3.5524e-01 ] : BONDSK:HWOW
   4 [ -3.2448e-01 ] : ANGLESB:HWOWHW
   5 [  8.9350e-02 ] : ANGLESK:HWOWHW
   6 [  0.0000e+00 ] : COUL:SOL-2 COUL:SOL-3
   7 [ -1.6540e-01 ] : COUL:SOL-4
   8 [ -2.2355e-02 ] : VSITE3B:SOL-4 VSITE3A:SOL-4
----------------------------------------------------------

Levenberg-Marquardt: Newton-Raphson step found (length 1.000e-01), Hessian diagonal is scaled by  4.394

##########################################################
###[93m  Mathematical Parameters (Current + Step = Next)   [0m###
##########################################################
   0 [  0.0000e+00 + 2.1358e-02 =  2.1358e-02 ] : VDWS:OW
   1 [  0.0000e+00 + 1.3608e-02 =  1.3608e-02 ] : VDWT:OW
   2 [  0.0000e+00 + 1.3185e-03 =  1.3185e-03 ] : BONDSB:HWOW
   3 [  0.0000e+00 - 1.4385e-02 = -1.4385e-02 ] : BONDSK:HWOW
   4 [  0.0000e+00 + 1.3960e-03 =  1.3960e-03 ] : ANGLESB:HWOWHW
   5 [  0.0000e+00 - 8.6541e-02 = -8.6541e-02 ] : ANGLESK:HWOWHW
   6 [  0.0000e+00 + 0.0000e+00 =  0.0000e+00 ] : COUL:SOL-2 COUL:SOL-3
   7 [  0.0000e+00 + 5.9651e-03 =  5.9651e-03 ] : COUL:SOL-4
   8 [  0.0000e+00 + 4.0295e-02 =  4.0295e-02 ] : VSITE3B:SOL-4 VSITE3A:SOL-4
----------------------------------------------------------

##########################################################
###[93m    Physical Parameters (Current + Step = Next)     [0m###
##########################################################
   0 [  3.1537e-01 + 1.1302e-03 =  3.1650e-01 ] : VDWS:OW
   1 [  6.4852e-01 + 3.3734e-02 =  6.8225e-01 ] : VDWT:OW
   2 [  9.5720e-02 + 6.9774e-05 =  9.5790e-02 ] : BONDSB:HWOW
   3 [  5.0242e+05 - 1.3487e+04 =  4.8893e+05 ] : BONDSK:HWOW
   4 [  1.0452e+02 + 7.9985e-02 =  1.0460e+02 ] : ANGLESB:HWOWHW
   5 [  6.2802e+02 - 5.2438e+01 =  5.7558e+02 ] : ANGLESK:HWOWHW
   6 [  5.2000e-01 - 2.3860e-03 =  5.1761e-01 ] : COUL:SOL-2 COUL:SOL-3
   7 [ -1.0400e+00 + 4.7721e-03 = -1.0352e+00 ] : COUL:SOL-4
   8 [  1.2800e-01 + 2.1323e-03 =  1.3013e-01 ] : VSITE3B:SOL-4 VSITE3A:SOL-4
----------------------------------------------------------
Target: cluster-06      Errors: Energy =   8.6451 kJ/mol (31.6513%) Atomic Force (%) =  28.1040 Objective = 8.95353e-02
Target: cluster-12      Errors: Energy =  14.0941 kJ/mol (29.7686%) Atomic Force (%) =  28.1275 Objective = 8.38673e-02

#####################################################################################
###[94m                         Objective Function Breakdown                          [0m###
###[94m  Target Name              Residual  x  Weight  =  Contribution (Current-Prev) [0m###
#####################################################################################
cluster-06                     0.08954      0.500 [92m     4.47677e-02[0m ( -1.126e-02 ) 
cluster-12                     0.08387      0.500 [92m     4.19337e-02[0m ( -1.011e-02 ) 
Regularization                 0.00010      1.000 [91m     1.00006e-04[0m ( +1.000e-04 ) 
Total                                             [92m     8.68013e-02[0m ( -2.128e-02 ) 
-------------------------------------------------------------------------------------
  Step       |k|        |dk|       |grad|       -=X2=-     Stdev(X2)    StepQual
     1   1.000e-01   1.000e-01   2.281e+00[92m   8.68013e-02[0m   1.064e-02      1.000


##########################################################
###[96m                   Total Gradient                   [0m###
##########################################################
   0 [ -8.2294e-02 ] : VDWS:OW
   1 [ -1.3099e-01 ] : VDWT:OW
   2 [ -2.2462e+00 ] : BONDSB:HWOW
   3 [  2.4669e-01 ] : BONDSK:HWOW
   4 [ -2.5086e-01 ] : ANGLESB:HWOWHW
   5 [  6.7668e-02 ] : ANGLESK:HWOWHW
   6 [  0.0000e+00 ] : COUL:SOL-2 COUL:SOL-3
   7 [ -8.0363e-02 ] : COUL:SOL-4
   8 [ -1.1347e-02 ] : VSITE3B:SOL-4 VSITE3A:SOL-4
----------------------------------------------------------

Levenberg-Marquardt: Newton-Raphson step found (length 1.250e-01), Hessian diagonal is scaled by  2.430

##########################################################
###[93m  Mathematical Parameters (Current + Step = Next)   [0m###
##########################################################
   0 [  2.1358e-02 + 1.5738e-02 =  3.7097e-02 ] : VDWS:OW
   1 [  1.3608e-02 + 1.0931e-02 =  2.4539e-02 ] : VDWT:OW
   2 [  1.3185e-03 + 1.7011e-03 =  3.0196e-03 ] : BONDSB:HWOW
   3 [ -1.4385e-02 - 1.7057e-02 = -3.1442e-02 ] : BONDSK:HWOW
   4 [  1.3960e-03 + 2.8650e-03 =  4.2610e-03 ] : ANGLESB:HWOWHW
   5 [ -8.6541e-02 - 1.1817e-01 = -2.0471e-01 ] : ANGLESK:HWOWHW
   6 [  0.0000e+00 + 0.0000e+00 =  0.0000e+00 ] : COUL:SOL-2 COUL:SOL-3
   7 [  5.9651e-03 + 3.9638e-03 =  9.9289e-03 ] : COUL:SOL-4
   8 [  4.0295e-02 + 3.1259e-02 =  7.1554e-02 ] : VSITE3B:SOL-4 VSITE3A:SOL-4
----------------------------------------------------------

##########################################################
###[93m    Physical Parameters (Current + Step = Next)     [0m###
##########################################################
   0 [  3.1650e-01 + 8.3284e-04 =  3.1733e-01 ] : VDWS:OW
   1 [  6.8225e-01 + 2.7097e-02 =  7.0935e-01 ] : VDWT:OW
   2 [  9.5790e-02 + 9.0018e-05 =  9.5880e-02 ] : BONDSB:HWOW
   3 [  4.8893e+05 - 1.5992e+04 =  4.7294e+05 ] : BONDSK:HWOW
   4 [  1.0460e+02 + 1.6415e-01 =  1.0476e+02 ] : ANGLESB:HWOWHW
   5 [  5.7558e+02 - 7.1602e+01 =  5.0398e+02 ] : ANGLESK:HWOWHW
   6 [  5.1761e-01 - 1.5855e-03 =  5.1603e-01 ] : COUL:SOL-2 COUL:SOL-3
   7 [ -1.0352e+00 + 3.1710e-03 = -1.0321e+00 ] : COUL:SOL-4
   8 [  1.3013e-01 + 1.6541e-03 =  1.3179e-01 ] : VSITE3B:SOL-4 VSITE3A:SOL-4
----------------------------------------------------------
Target: cluster-06      Errors: Energy =   8.2144 kJ/mol (30.0746%) Atomic Force (%) =  23.6752 Objective = 7.32114e-02
Target: cluster-12      Errors: Energy =  13.4725 kJ/mol (28.4557%) Atomic Force (%) =  23.8781 Objective = 6.89942e-02

#####################################################################################
###[94m                         Objective Function Breakdown                          [0m###
###[94m  Target Name              Residual  x  Weight  =  Contribution (Current-Prev) [0m###
#####################################################################################
cluster-06                     0.07321      0.500 [92m     3.66057e-02[0m ( -8.162e-03 ) 
cluster-12                     0.06899      0.500 [92m     3.44971e-02[0m ( -7.437e-03 ) 
Regularization                 0.00050      1.000 [91m     5.01193e-04[0m ( +4.012e-04 ) 
Total                                             [92m     7.16040e-02[0m ( -1.520e-02 ) 
-------------------------------------------------------------------------------------
  Step       |k|        |dk|       |grad|       -=X2=-     Stdev(X2)    StepQual
     2   2.239e-01   1.250e-01   1.177e+00[92m   7.16040e-02[0m   1.496e-02      0.993


##########################################################
###[96m                   Total Gradient                   [0m###
##########################################################
   0 [ -2.9801e-02 ] : VDWS:OW
   1 [ -4.8029e-02 ] : VDWT:OW
   2 [ -1.1540e+00 ] : BONDSB:HWOW
   3 [  1.1918e-01 ] : BONDSK:HWOW
   4 [ -1.8386e-01 ] : ANGLESB:HWOWHW
   5 [  3.8576e-02 ] : ANGLESK:HWOWHW
   6 [  0.0000e+00 ] : COUL:SOL-2 COUL:SOL-3
   7 [ -2.2056e-02 ] : COUL:SOL-4
   8 [ -3.7047e-03 ] : VSITE3B:SOL-4 VSITE3A:SOL-4
----------------------------------------------------------


##########################################################
###[93m  Mathematical Parameters (Current + Step = Next)   [0m###
##########################################################
   0 [  3.7097e-02 + 5.0639e-03 =  4.2160e-02 ] : VDWS:OW
   1 [  2.4539e-02 + 4.2944e-03 =  2.8833e-02 ] : VDWT:OW
   2 [  3.0196e-03 + 1.1514e-03 =  4.1710e-03 ] : BONDSB:HWOW
   3 [ -3.1442e-02 - 9.7881e-03 = -4.1230e-02 ] : BONDSK:HWOW
   4 [  4.2610e-03 + 3.5286e-03 =  7.7896e-03 ] : ANGLESB:HWOWHW
   5 [ -2.0471e-01 - 8.2711e-02 = -2.8742e-01 ] : ANGLESK:HWOWHW
   6 [  0.0000e+00 + 0.0000e+00 =  0.0000e+00 ] : COUL:SOL-2 COUL:SOL-3
   7 [  9.9289e-03 + 8.2966e-04 =  1.0759e-02 ] : COUL:SOL-4
   8 [  7.1554e-02 + 1.2535e-02 =  8.4089e-02 ] : VSITE3B:SOL-4 VSITE3A:SOL-4
----------------------------------------------------------

##########################################################
###[93m    Physical Parameters (Current + Step = Next)     [0m###
##########################################################
   0 [  3.1733e-01 + 2.6797e-04 =  3.1760e-01 ] : VDWS:OW
   1 [  7.0935e-01 + 1.0646e-02 =  7.2000e-01 ] : VDWT:OW
   2 [  9.5880e-02 + 6.0929e-05 =  9.5941e-02 ] : BONDSB:HWOW
   3 [  4.7294e+05 - 9.1771e+03 =  4.6376e+05 ] : BONDSK:HWOW
   4 [  1.0476e+02 + 2.0218e-01 =  1.0497e+02 ] : ANGLESB:HWOWHW
   5 [  5.0398e+02 - 5.0117e+01 =  4.5386e+02 ] : ANGLESK:HWOWHW
   6 [  5.1603e-01 - 3.3187e-04 =  5.1570e-01 ] : COUL:SOL-2 COUL:SOL-3
   7 [ -1.0321e+00 + 6.6373e-04 = -1.0314e+00 ] : COUL:SOL-4
   8 [  1.3179e-01 + 6.6333e-04 =  1.3245e-01 ] : VSITE3B:SOL-4 VSITE3A:SOL-4
----------------------------------------------------------
Target: cluster-06      Errors: Energy =   8.1094 kJ/mol (29.6901%) Atomic Force (%) =  21.7679 Objective = 6.77327e-02
Target: cluster-12      Errors: Energy =  13.2851 kJ/mol (28.0599%) Atomic Force (%) =  22.0633 Objective = 6.37054e-02

#####################################################################################
###[94m                         Objective Function Breakdown                          [0m###
###[94m  Target Name              Residual  x  Weight  =  Contribution (Current-Prev) [0m###
#####################################################################################
cluster-06                     0.06773      0.500 [92m     3.38663e-02[0m ( -2.739e-03 ) 
cluster-12                     0.06371      0.500 [92m     3.18527e-02[0m ( -2.644e-03 ) 
Regularization                 0.00094      1.000 [91m     9.41849e-04[0m ( +4.407e-04 ) 
Total                                             [92m     6.66609e-02[0m ( -4.943e-03 ) 
-------------------------------------------------------------------------------------
  Step       |k|        |dk|       |grad|       -=X2=-     Stdev(X2)    StepQual
     3   3.069e-01   8.457e-02   5.284e-01[92m   6.66609e-02[0m   8.570e-03      0.988


##########################################################
###[96m                   Total Gradient                   [0m###
##########################################################
   0 [ -7.7337e-03 ] : VDWS:OW
   1 [ -1.4481e-02 ] : VDWT:OW
   2 [ -5.1013e-01 ] : BONDSB:HWOW
   3 [  4.6205e-02 ] : BONDSK:HWOW
   4 [ -1.2738e-01 ] : ANGLESB:HWOWHW
   5 [  1.8715e-02 ] : ANGLESK:HWOWHW
   6 [  0.0000e+00 ] : COUL:SOL-2 COUL:SOL-3
   7 [ -4.0752e-03 ] : COUL:SOL-4
   8 [ -1.1710e-03 ] : VSITE3B:SOL-4 VSITE3A:SOL-4
----------------------------------------------------------


##########################################################
###[93m  Mathematical Parameters (Current + Step = Next)   [0m###
##########################################################
   0 [  4.2160e-02 + 8.0256e-04 =  4.2963e-02 ] : VDWS:OW
   1 [  2.8833e-02 + 1.3470e-03 =  3.0180e-02 ] : VDWT:OW
   2 [  4.1710e-03 + 5.6947e-04 =  4.7405e-03 ] : BONDSB:HWOW
   3 [ -4.1230e-02 - 3.7378e-03 = -4.4968e-02 ] : BONDSK:HWOW
   4 [  7.7896e-03 + 2.8513e-03 =  1.0641e-02 ] : ANGLESB:HWOWHW
   5 [ -2.8742e-01 - 4.0942e-02 = -3.2836e-01 ] : ANGLESK:HWOWHW
   6 [  0.0000e+00 + 0.0000e+00 =  0.0000e+00 ] : COUL:SOL-2 COUL:SOL-3
   7 [  1.0759e-02 - 1.9841e-04 =  1.0560e-02 ] : COUL:SOL-4
   8 [  8.4089e-02 + 4.1787e-03 =  8.8268e-02 ] : VSITE3B:SOL-4 VSITE3A:SOL-4
----------------------------------------------------------

##########################################################
###[93m    Physical Parameters (Current + Step = Next)     [0m###
##########################################################
   0 [  3.1760e-01 + 4.2470e-05 =  3.1764e-01 ] : VDWS:OW
   1 [  7.2000e-01 + 3.3390e-03 =  7.2334e-01 ] : VDWT:OW
   2 [  9.5941e-02 + 3.0135e-05 =  9.5971e-02 ] : BONDSB:HWOW
   3 [  4.6376e+05 - 3.5045e+03 =  4.6025e+05 ] : BONDSK:HWOW
   4 [  1.0497e+02 + 1.6337e-01 =  1.0513e+02 ] : ANGLESB:HWOWHW
   5 [  4.5386e+02 - 2.4808e+01 =  4.2906e+02 ] : ANGLESK:HWOWHW
   6 [  5.1570e-01 + 7.9363e-05 =  5.1578e-01 ] : COUL:SOL-2 COUL:SOL-3
   7 [ -1.0314e+00 - 1.5873e-04 = -1.0316e+00 ] : COUL:SOL-4
   8 [  1.3245e-01 + 2.2113e-04 =  1.3267e-01 ] : VSITE3B:SOL-4 VSITE3A:SOL-4
----------------------------------------------------------
Target: cluster-06      Errors: Energy =   8.0878 kJ/mol (29.6110%) Atomic Force (%) =  21.2233 Objective = 6.63286e-02
Target: cluster-12      Errors: Energy =  13.2144 kJ/mol (27.9107%) Atomic Force (%) =  21.5314 Objective = 6.21269e-02

#####################################################################################
###[94m                         Objective Function Breakdown                          [0m###
###[94m  Target Name              Residual  x  Weight  =  Contribution (Current-Prev) [0m###
#####################################################################################
cluster-06                     0.06633      0.500 [92m     3.31643e-02[0m ( -7.020e-04 ) 
cluster-12                     0.06213      0.500 [92m     3.10635e-02[0m ( -7.892e-04 ) 
Regularization                 0.00121      1.000 [91m     1.20640e-03[0m ( +2.646e-04 ) 
Total                                             [92m     6.54342e-02[0m ( -1.227e-03 ) 
-------------------------------------------------------------------------------------
  Step       |k|        |dk|       |grad|       -=X2=-     Stdev(X2)    StepQual
     4   3.473e-01   4.146e-02   2.587e-01[92m   6.54342e-02[0m   2.667e-03      0.988


##########################################################
###[96m                   Total Gradient                   [0m###
##########################################################
   0 [ -1.3626e-03 ] : VDWS:OW
   1 [ -4.7170e-03 ] : VDWT:OW
   2 [ -2.4368e-01 ] : BONDSB:HWOW
   3 [  1.7308e-02 ] : BONDSK:HWOW
   4 [ -8.4474e-02 ] : ANGLESB:HWOWHW
   5 [  9.3895e-03 ] : ANGLESK:HWOWHW
   6 [  0.0000e+00 ] : COUL:SOL-2 COUL:SOL-3
   7 [  3.3740e-04 ] : COUL:SOL-4
   8 [ -4.1364e-04 ] : VSITE3B:SOL-4 VSITE3A:SOL-4
----------------------------------------------------------


##########################################################
###[93m  Mathematical Parameters (Current + Step = Next)   [0m###
##########################################################
   0 [  4.2963e-02 - 2.5682e-04 =  4.2706e-02 ] : VDWS:OW
   1 [  3.0180e-02 + 5.5268e-04 =  3.0733e-02 ] : VDWT:OW
   2 [  4.7405e-03 + 3.0086e-04 =  5.0414e-03 ] : BONDSB:HWOW
   3 [ -4.4968e-02 - 1.2882e-03 = -4.6256e-02 ] : BONDSK:HWOW
   4 [  1.0641e-02 + 2.0406e-03 =  1.2682e-02 ] : ANGLESB:HWOWHW
   5 [ -3.2836e-01 - 2.1100e-02 = -3.4946e-01 ] : ANGLESK:HWOWHW
   6 [  0.0000e+00 + 0.0000e+00 =  0.0000e+00 ] : COUL:SOL-2 COUL:SOL-3
   7 [  1.0560e-02 - 3.9368e-04 =  1.0166e-02 ] : COUL:SOL-4
   8 [  8.8268e-02 + 1.4273e-03 =  8.9695e-02 ] : VSITE3B:SOL-4 VSITE3A:SOL-4
----------------------------------------------------------

##########################################################
###[93m    Physical Parameters (Current + Step = Next)     [0m###
##########################################################
   0 [  3.1764e-01 - 1.3590e-05 =  3.1762e-01 ] : VDWS:OW
   1 [  7.2334e-01 + 1.3701e-03 =  7.2471e-01 ] : VDWT:OW
   2 [  9.5971e-02 + 1.5921e-05 =  9.5987e-02 ] : BONDSB:HWOW
   3 [  4.6025e+05 - 1.2078e+03 =  4.5905e+05 ] : BONDSK:HWOW
   4 [  1.0513e+02 + 1.1692e-01 =  1.0525e+02 ] : ANGLESB:HWOWHW
   5 [  4.2906e+02 - 1.2785e+01 =  4.1627e+02 ] : ANGLESK:HWOWHW
   6 [  5.1578e-01 + 1.5747e-04 =  5.1593e-01 ] : COUL:SOL-2 COUL:SOL-3
   7 [ -1.0316e+00 - 3.1495e-04 = -1.0319e+00 ] : COUL:SOL-4
   8 [  1.3267e-01 + 7.5529e-05 =  1.3275e-01 ] : VSITE3B:SOL-4 VSITE3A:SOL-4
----------------------------------------------------------
Target: cluster-06      Errors: Energy =   8.0821 kJ/mol (29.5900%) Atomic Force (%) =  21.0563 Objective = 6.59135e-02
Target: cluster-12      Errors: Energy =  13.1761 kJ/mol (27.8296%) Atomic Force (%) =  21.3527 Objective = 6.15172e-02

#####################################################################################
###[94m                         Objective Function Breakdown                          [0m###
###[94m  Target Name              Residual  x  Weight  =  Contribution (Current-Prev) [0m###
#####################################################################################
cluster-06                     0.06591      0.500 [92m     3.29568e-02[0m ( -2.075e-04 ) 
cluster-12                     0.06152      0.500 [92m     3.07586e-02[0m ( -3.049e-04 ) 
Regularization                 0.00135      1.000 [91m     1.35368e-03[0m ( +1.473e-04 ) 
Total                                             [92m     6.50690e-02[0m ( -3.651e-04 ) 
-------------------------------------------------------------------------------------
  Step       |k|        |dk|       |grad|       -=X2=-     Stdev(X2)    StepQual
     5   3.679e-01   2.130e-02   1.389e-01[92m   6.50690e-02[0m   6.809e-04      0.991


##########################################################
###[96m                   Total Gradient                   [0m###
##########################################################
   0 [  3.4633e-04 ] : VDWS:OW
   1 [ -1.9366e-03 ] : VDWT:OW
   2 [ -1.2759e-01 ] : BONDSB:HWOW
   3 [  5.8984e-03 ] : BONDSK:HWOW
   4 [ -5.4213e-02 ] : ANGLESB:HWOWHW
   5 [  4.9527e-03 ] : ANGLESK:HWOWHW
   6 [  0.0000e+00 ] : COUL:SOL-2 COUL:SOL-3
   7 [  1.3666e-03 ] : COUL:SOL-4
   8 [ -1.4573e-04 ] : VSITE3B:SOL-4 VSITE3A:SOL-4
----------------------------------------------------------


##########################################################
###[93m  Mathematical Parameters (Current + Step = Next)   [0m###
##########################################################
   0 [  4.2706e-02 - 4.6875e-04 =  4.2237e-02 ] : VDWS:OW
   1 [  3.0733e-02 + 3.5333e-04 =  3.1086e-02 ] : VDWT:OW
   2 [  5.0414e-03 + 1.7151e-04 =  5.2129e-03 ] : BONDSB:HWOW
   3 [ -4.6256e-02 - 3.2765e-04 = -4.6584e-02 ] : BONDSK:HWOW
   4 [  1.2682e-02 + 1.3643e-03 =  1.4046e-02 ] : ANGLESB:HWOWHW
   5 [ -3.4946e-01 - 1.1441e-02 = -3.6091e-01 ] : ANGLESK:HWOWHW
   6 [  0.0000e+00 + 0.0000e+00 =  0.0000e+00 ] : COUL:SOL-2 COUL:SOL-3
   7 [  1.0166e-02 - 3.8215e-04 =  9.7843e-03 ] : COUL:SOL-4
   8 [  8.9695e-02 + 4.4752e-04 =  9.0143e-02 ] : VSITE3B:SOL-4 VSITE3A:SOL-4
----------------------------------------------------------

##########################################################
###[93m    Physical Parameters (Current + Step = Next)     [0m###
##########################################################
   0 [  3.1762e-01 - 2.4805e-05 =  3.1760e-01 ] : VDWS:OW
   1 [  7.2471e-01 + 8.7588e-04 =  7.2558e-01 ] : VDWT:OW
   2 [  9.5987e-02 + 9.0760e-06 =  9.5996e-02 ] : BONDSB:HWOW
   3 [  4.5905e+05 - 3.0720e+02 =  4.5874e+05 ] : BONDSK:HWOW
   4 [  1.0525e+02 + 7.8168e-02 =  1.0532e+02 ] : ANGLESB:HWOWHW
   5 [  4.1627e+02 - 6.9324e+00 =  4.0934e+02 ] : ANGLESK:HWOWHW
   6 [  5.1593e-01 + 1.5286e-04 =  5.1609e-01 ] : COUL:SOL-2 COUL:SOL-3
   7 [ -1.0319e+00 - 3.0572e-04 = -1.0322e+00 ] : COUL:SOL-4
   8 [  1.3275e-01 + 2.3682e-05 =  1.3277e-01 ] : VSITE3B:SOL-4 VSITE3A:SOL-4
----------------------------------------------------------
Target: cluster-06      Errors: Energy =   8.0800 kJ/mol (29.5826%) Atomic Force (%) =  21.0035 Objective = 6.57809e-02
Target: cluster-12      Errors: Energy =  13.1527 kJ/mol (27.7803%) Atomic Force (%) =  21.2858 Objective = 6.12370e-02

#####################################################################################
###[94m                         Objective Function Breakdown                          [0m###
###[94m  Target Name              Residual  x  Weight  =  Contribution (Current-Prev) [0m###
#####################################################################################
cluster-06                     0.06578      0.500 [92m     3.28904e-02[0m ( -6.632e-05 ) 
cluster-12                     0.06124      0.500 [92m     3.06185e-02[0m ( -1.401e-04 ) 
Regularization                 0.00144      1.000 [91m     1.43619e-03[0m ( +8.251e-05 ) 
Total                                             [92m     6.49451e-02[0m ( -1.239e-04 ) 
-------------------------------------------------------------------------------------
  Step       |k|        |dk|       |grad|       -=X2=-     Stdev(X2)    StepQual
     6   3.790e-01   1.156e-02   8.045e-02[92m   6.49451e-02[0m   2.076e-04      0.994


##########################################################
###[96m                   Total Gradient                   [0m###
##########################################################
   0 [  7.0775e-04 ] : VDWS:OW
   1 [ -1.2143e-03 ] : VDWT:OW
   2 [ -7.2744e-02 ] : BONDSB:HWOW
   3 [  1.4752e-03 ] : BONDSK:HWOW
   4 [ -3.4151e-02 ] : ANGLESB:HWOWHW
   5 [  2.7513e-03 ] : ANGLESK:HWOWHW
   6 [  0.0000e+00 ] : COUL:SOL-2 COUL:SOL-3
   7 [  1.4317e-03 ] : COUL:SOL-4
   8 [ -4.7997e-05 ] : VSITE3B:SOL-4 VSITE3A:SOL-4
----------------------------------------------------------


##########################################################
###[93m  Mathematical Parameters (Current + Step = Next)   [0m###
##########################################################
   0 [  4.2237e-02 - 4.6996e-04 =  4.1767e-02 ] : VDWS:OW
   1 [  3.1086e-02 + 3.1335e-04 =  3.1400e-02 ] : VDWT:OW
   2 [  5.2129e-03 + 1.0415e-04 =  5.3170e-03 ] : BONDSB:HWOW
   3 [ -4.6584e-02 + 2.5271e-05 = -4.6558e-02 ] : BONDSK:HWOW
   4 [  1.4046e-02 + 8.8067e-04 =  1.4927e-02 ] : ANGLESB:HWOWHW
   5 [ -3.6091e-01 - 6.5016e-03 = -3.6741e-01 ] : ANGLESK:HWOWHW
   6 [  0.0000e+00 + 0.0000e+00 =  0.0000e+00 ] : COUL:SOL-2 COUL:SOL-3
   7 [  9.7843e-03 - 3.2074e-04 =  9.4636e-03 ] : COUL:SOL-4
   8 [  9.0143e-02 + 1.3739e-04 =  9.0280e-02 ] : VSITE3B:SOL-4 VSITE3A:SOL-4
----------------------------------------------------------

##########################################################
###[93m    Physical Parameters (Current + Step = Next)     [0m###
##########################################################
   0 [  3.1760e-01 - 2.4869e-05 =  3.1758e-01 ] : VDWS:OW
   1 [  7.2558e-01 + 7.7679e-04 =  7.2636e-01 ] : VDWT:OW
   2 [  9.5996e-02 + 5.5115e-06 =  9.6001e-02 ] : BONDSB:HWOW
   3 [  4.5874e+05 + 2.3693e+01 =  4.5876e+05 ] : BONDSK:HWOW
   4 [  1.0532e+02 + 5.0458e-02 =  1.0538e+02 ] : ANGLESB:HWOWHW
   5 [  4.0934e+02 - 3.9395e+00 =  4.0540e+02 ] : ANGLESK:HWOWHW
   6 [  5.1609e-01 + 1.2830e-04 =  5.1621e-01 ] : COUL:SOL-2 COUL:SOL-3
   7 [ -1.0322e+00 - 2.5660e-04 = -1.0324e+00 ] : COUL:SOL-4
   8 [  1.3277e-01 + 7.2702e-06 =  1.3278e-01 ] : VSITE3B:SOL-4 VSITE3A:SOL-4
----------------------------------------------------------
Target: cluster-06      Errors: Energy =   8.0790 kJ/mol (29.5789%) Atomic Force (%) =  20.9879 Objective = 6.57373e-02
Target: cluster-12      Errors: Energy =  13.1380 kJ/mol (27.7491%) Atomic Force (%) =  21.2594 Objective = 6.10941e-02

#####################################################################################
###[94m                         Objective Function Breakdown                          [0m###
###[94m  Target Name              Residual  x  Weight  =  Contribution (Current-Prev) [0m###
#####################################################################################
cluster-06                     0.06574      0.500 [92m     3.28686e-02[0m ( -2.182e-05 ) 
cluster-12                     0.06109      0.500 [92m     3.05470e-02[0m ( -7.147e-05 ) 
Regularization                 0.00148      1.000 [91m     1.48377e-03[0m ( +4.758e-05 ) 
Total                                             [92m     6.48994e-02[0m ( -4.570e-05 ) 
-------------------------------------------------------------------------------------
  Step       |k|        |dk|       |grad|       -=X2=-     Stdev(X2)    StepQual
     7   3.852e-01   6.595e-03   4.920e-02[92m   6.48994e-02[0m   7.165e-05      0.996

Convergence criterion reached for objective function (1.00e-04)

@@@@@@@@@@@@@@@@@@@@@@@@@@@@@@@@@@@@@@@@@@@@@@@@@@@@@@@@@@
@@@[1;92m           Final objective function value           [0m@@@
@@@[1;92m  Full:  6.489943e-02  Un-penalized:  6.341566e-02  [0m@@@
@@@@@@@@@@@@@@@@@@@@@@@@@@@@@@@@@@@@@@@@@@@@@@@@@@@@@@@@@@

##########################################################
###[1;94m           Final optimization parameters:           [0m###
###[1;94m           Paste to input file to restart           [0m###
##########################################################
read_mvals
   0 [  4.1767e-02 ] : VDWS:OW
   1 [  3.1400e-02 ] : VDWT:OW
   2 [  5.3170e-03 ] : BONDSB:HWOW
   3 [ -4.6558e-02 ] : BONDSK:HWOW
   4 [  1.4927e-02 ] : ANGLESB:HWOWHW
   5 [ -3.6741e-01 ] : ANGLESK:HWOWHW
   6 [  0.0000e+00 ] : COUL:SOL-2 COUL:SOL-3
   7 [  9.4636e-03 ] : COUL:SOL-4
   8 [  9.0280e-02 ] : VSITE3B:SOL-4 VSITE3A:SOL-4
/read_mvals

##########################################################
###[1;94m             Final physical parameters:             [0m###
##########################################################
   0 [  3.1758e-01 ] : VDWS:OW
   1 [  7.2636e-01 ] : VDWT:OW
   2 [  9.6001e-02 ] : BONDSB:HWOW
   3 [  4.5876e+05 ] : BONDSK:HWOW
   4 [  1.0538e+02 ] : ANGLESB:HWOWHW
   5 [  4.0540e+02 ] : ANGLESK:HWOWHW
   6 [  5.1621e-01 ] : COUL:SOL-2 COUL:SOL-3
   7 [ -1.0324e+00 ] : COUL:SOL-4
   8 [  1.3278e-01 ] : VSITE3B:SOL-4 VSITE3A:SOL-4
----------------------------------------------------------
