
#======================================================================#
#| [1m             Welcome to ForceBalance version 1.1! =D              [0m |#
#| [1m                 Force Field Optimization System                  [0m |#
#| [1m                      Author: Lee-Ping Wang                       [0m |#
#======================================================================#

                          [44m     [0m                                        
                       [44m        [0m      [43m     [0m                              
                    [44m        [0m   [44m  [0m    [43m         [0m                          
                 [44m       [0m    [44m      [0m      [43m         [0m                       
             [44m        [0m    [44m        [0m          [43m         [0m                    
          [44m        [0m    [44m        [0m                 [43m        [0m                 
       [44m        [0m    [44m       [0m                        [43m        [0m              
    [44m        [0m   [44m        [0m                              [43m         [0m          
   [44m      [0m   [44m        [0m               `.:+@@###@'          [43m         [0m       
    [44m [0m    [44m        [0m          ,;'+###############.             [43m     [0m       
      [44m        [0m         +################':`                    [43m [0m        
      [44m     [0m              `.,,...####+.                                  
                                ,#####      +##.               [44m   [0m   [44m   [0m
 [43m    [0m                            #####      ######             [44m   [0m   [44m   [0m
 [43m    [0m                ###'        ####'     :#####'             [44m   [0m   [44m   [0m
 [43m    [0m                :####@      ####.    ,####'               [44m   [0m   [44m   [0m
 [43m    [0m                 ######     ####    +###+                 [44m   [0m   [44m   [0m
 [43m    [0m                  #####     ####   ###;                   [44m   [0m   [44m   [0m
 [43m    [0m                   :##      ####  ++`                     [44m   [0m   [44m   [0m
 [43m    [0m                            ####``..:;+##############+`   [44m   [0m   [44m   [0m
 [43m    [0m             .,:;;'++##################################`  [44m   [0m   [44m   [0m
 [43m    [0m    `############################++++''';;;;;;;;;;;'';    [44m   [0m   [44m   [0m
 [43m    [0m      ,########':,.``       ####                          [44m   [0m   [44m   [0m
 [43m    [0m                            ####                          [44m   [0m   [44m   [0m
 [43m    [0m                            ####                          [44m   [0m   [44m   [0m
 [43m    [0m                            ####                          [44m   [0m   [44m   [0m
 [43m    [0m                            ####                          [44m   [0m   [44m   [0m
 [43m    [0m                            ####                          [44m   [0m   [44m   [0m
 [43m    [0m                            ####                          [44m   [0m   [44m   [0m
 [43m    [0m                            ####                          [44m   [0m   [44m   [0m
      [44m    [0m                       ####                                   
     [44m        [0m                    ####                                   
    [44m [0m    [44m       [0m                 ####                       [43m     [0m       
   [44m     [0m    [44m        [0m             ####                    [43m        [0m       
   [44m        [0m    [44m        [0m          ###                  [43m         [0m         
      [44m        [0m    [44m        [0m        +`               [43m        [0m             
          [44m        [0m   [44m        [0m                   [43m        [0m                
             [44m        [0m   [44m         [0m           [43m         [0m                   
                [44m        [0m    [44m       [0m      [43m         [0m                      
                   [44m        [0m    [44m   [0m    [43m        [0m                          
                      [44m        [0m       [43m      [0m                             
                          [44m      [0m      [43m  [0m                                
                             [44m  [0m                                         

Reading options from file: very_simple.in

#========================================================#
#| [95m  Options at their default values are not printed   [0m |#
#| [95m        Use 'verbose_options True' to Enable        [0m |#
#========================================================#
Reading force field from file: water.itp

#=========================================================#
#| [92m Starting parameter indices, physical values and IDs [0m |#
#=========================================================#
   0 [  3.1537e-01 ] : VDWS:OW
   1 [  6.4852e-01 ] : VDWT:OW
   2 [  9.5720e-02 ] : BONDSB:HWOW
   3 [  5.0242e+05 ] : BONDSK:HWOW
   4 [  1.0452e+02 ] : ANGLESB:HWOWHW
   5 [  6.2802e+02 ] : ANGLESK:HWOWHW
   6 [  5.2000e-01 ] : COUL:SOL-2 COUL:SOL-3
   7 [ -1.0400e+00 ] : COUL:SOL-4
   8 [  1.2800e-01 ] : VSITE3B:SOL-4 VSITE3A:SOL-4
-----------------------------------------------------------

#========================================================#
#| [91m    Rescaling Factors (Lower Takes Precedence):     [0m |#
#========================================================#
   BONDSB                               : 5.29177e-02
   BONDSK                               : 9.37583e+05
   VSITE3A                              : 5.29177e-02
   VSITE3B                              : 5.29177e-02
   ANGLESB                              : 5.72958e+01
   VDWS                                 : 5.29177e-02
   ANGLESK                              : 6.05928e+02
   COUL                                 : 1.00000e+00
   VDWT                                 : 2.47894e+00
----------------------------------------------------------
Building charge constraints...
Parameter 6 occurs 2 times in molecule SOL in locations [1, 2] (COUL:SOL-2 COUL:SOL-3)
Parameter 7 occurs 1 times in molecule SOL in locations [3] (COUL:SOL-4)

#========================================================#
#| [92m               Setup for force field                [0m |#
#========================================================#
fnms                      ['water.itp'] 
----------------------------------------------------------
Backing up: temp/cluster-06 to: backups/cluster-06_3.tar.bz2

#========================================================#
#| [92m           Setup for target cluster-06 :            [0m |#
#========================================================#
name                      cluster-06 
type                      ABINITIO_GMX 
tgtdir                    targets/cluster-06 
shots                     1208 
----------------------------------------------------------
Backing up: temp/cluster-12 to: backups/cluster-12_2.tar.bz2

#========================================================#
#| [92m           Setup for target cluster-12 :            [0m |#
#========================================================#
name                      cluster-12 
type                      ABINITIO_GMX 
tgtdir                    targets/cluster-12 
shots                     1201 
----------------------------------------------------------
Using parabolic regularization (Gaussian prior) with strength 1.0e-02 (+), 0.0e+00 (x)

#========================================================#
#| [92m           Setup for objective function :           [0m |#
#========================================================#
penalty_additive          0.01 
----------------------------------------------------------

#========================================================#
#| [92m                Setup for optimizer                 [0m |#
#========================================================#
jobtype                   NEWTON 
----------------------------------------------------------

#========================================================#
#| [1m                   Main Optimizer                   [0m |#
#| [1m       Newton-Raphson Mode (Adaptive Radius)        [0m |#
#========================================================#


#=======================================================================#
#| [92m Target: cluster-06 Type: AbInitio_GMX Objective = 1.12035e-01     [0m |#
#| [92m                             Difference   Denominator     Percent  [0m |#
#| [92m Physical Variable           (Calc-Ref)     RMS (Ref)   Difference [0m |#
#=======================================================================#
    Energy (kJ/mol)                 9.4124       27.3135     34.4605% 
    Gradient (kJ/mol/nm)          391.9632     1190.8405     32.9148% 
-------------------------------------------------------------------------

#=======================================================================#
#| [92m Target: cluster-12 Type: AbInitio_GMX Objective = 1.04039e-01     [0m |#
#| [92m                             Difference   Denominator     Percent  [0m |#
#| [92m Physical Variable           (Calc-Ref)     RMS (Ref)   Difference [0m |#
#=======================================================================#
    Energy (kJ/mol)                15.2291       47.3455     32.1658% 
    Gradient (kJ/mol/nm)          385.4013     1180.2403     32.6545% 
-------------------------------------------------------------------------

#====================================================================#
#| [94m                  Objective Function Breakdown                  [0m |#
#| [94m  Target Name              Residual  x  Weight  =  Contribution [0m |#
#====================================================================#
cluster-06                     0.11203      0.500 [94m     5.60173e-02[0m 
cluster-12                     0.10404      0.500 [94m     5.20195e-02[0m 
Regularization                 0.00000      1.000 [94m     0.00000e+00[0m 
Total                                             [94m     1.08037e-01[0m 
----------------------------------------------------------------------
  Step       |k|        |dk|       |grad|       -=X2=-     Delta(X2)    StepQual
     0   0.000e+00   0.000e+00   3.206e+00[1m   1.08037e-01[0m   0.000e+00      0.000


#========================================================#
#| [94m                   Total Gradient                   [0m |#
#========================================================#
   0 [ -1.36605285e-01 ] : VDWS:OW
   1 [ -2.24335748e-01 ] : VDWT:OW
   2 [ -3.14688760e+00 ] : BONDSB:HWOW
   3 [  3.54975985e-01 ] : BONDSK:HWOW
   4 [ -3.24607484e-01 ] : ANGLESB:HWOWHW
   5 [  8.92900123e-02 ] : ANGLESK:HWOWHW
   6 [ -7.50893285e-02 ] : COUL:SOL-2 COUL:SOL-3
   7 [ -2.44318391e-01 ] : COUL:SOL-4
   8 [ -2.23561237e-02 ] : VSITE3B:SOL-4 VSITE3A:SOL-4
----------------------------------------------------------

Levenberg-Marquardt: Newton-Raphson step found (length 1.000e-01),  0.92958359 added to Hessian diagonal

#========================================================#
#| [95m  Mathematical Parameters (Current + Step = Next)   [0m |#
#========================================================#
   0 [  0.0000e+00 + 2.3057e-02 =  2.3057e-02 ] : VDWS:OW
   1 [  0.0000e+00 + 3.7320e-02 =  3.7320e-02 ] : VDWT:OW
   2 [  0.0000e+00 + 5.7207e-03 =  5.7207e-03 ] : BONDSB:HWOW
   3 [  0.0000e+00 - 3.8228e-02 = -3.8228e-02 ] : BONDSK:HWOW
   4 [  0.0000e+00 + 8.6160e-03 =  8.6160e-03 ] : ANGLESB:HWOWHW
   5 [  0.0000e+00 - 7.4597e-02 = -7.4597e-02 ] : ANGLESK:HWOWHW
   6 [  0.0000e+00 - 7.4155e-03 = -7.4155e-03 ] : COUL:SOL-2 COUL:SOL-3
   7 [  0.0000e+00 + 2.9107e-02 =  2.9107e-02 ] : COUL:SOL-4
   8 [  0.0000e+00 + 6.3479e-03 =  6.3479e-03 ] : VSITE3B:SOL-4 VSITE3A:SOL-4
----------------------------------------------------------

#========================================================#
#| [95m    Physical Parameters (Current + Step = Next)     [0m |#
#========================================================#
   0 [  3.1537e-01 + 1.2201e-03 =  3.1659e-01 ] : VDWS:OW
   1 [  6.4852e-01 + 9.2513e-02 =  7.4103e-01 ] : VDWT:OW
   2 [  9.5720e-02 + 3.0273e-04 =  9.6023e-02 ] : BONDSB:HWOW
   3 [  5.0242e+05 - 3.5842e+04 =  4.6657e+05 ] : BONDSK:HWOW
   4 [  1.0452e+02 + 4.9366e-01 =  1.0501e+02 ] : ANGLESB:HWOWHW
   5 [  6.2802e+02 - 4.5200e+01 =  5.8282e+02 ] : ANGLESK:HWOWHW
   6 [  5.2000e-01 - 7.4155e-03 =  5.1258e-01 ] : COUL:SOL-2 COUL:SOL-3
   7 [ -1.0400e+00 + 2.9107e-02 = -1.0109e+00 ] : COUL:SOL-4
   8 [  1.2800e-01 + 3.3591e-04 =  1.2834e-01 ] : VSITE3B:SOL-4 VSITE3A:SOL-4
----------------------------------------------------------

#=======================================================================#
#| [92m Target: cluster-06 Type: AbInitio_GMX Objective = 7.55909e-02     [0m |#
#| [92m                             Difference   Denominator     Percent  [0m |#
#| [92m Physical Variable           (Calc-Ref)     RMS (Ref)   Difference [0m |#
#=======================================================================#
    Energy (kJ/mol)                 8.0920       27.3135     29.6263% 
    Gradient (kJ/mol/nm)          301.3784     1190.8405     25.3080% 
-------------------------------------------------------------------------

#=======================================================================#
#| [92m Target: cluster-12 Type: AbInitio_GMX Objective = 7.17029e-02     [0m |#
#| [92m                             Difference   Denominator     Percent  [0m |#
#| [92m Physical Variable           (Calc-Ref)     RMS (Ref)   Difference [0m |#
#=======================================================================#
    Energy (kJ/mol)                13.2306       47.3455     27.9447% 
    Gradient (kJ/mol/nm)          301.3300     1180.2403     25.5312% 
-------------------------------------------------------------------------

#===================================================================================#
#| [94m                         Objective Function Breakdown                          [0m |#
#| [94m  Target Name              Residual  x  Weight  =  Contribution (Current-Prev) [0m |#
#===================================================================================#
cluster-06                     0.07559      0.500 [92m     3.77955e-02[0m ( -1.822e-02 ) 
cluster-12                     0.07170      0.500 [92m     3.58514e-02[0m ( -1.617e-02 ) 
Regularization                 0.00010      1.000 [91m     9.99999e-05[0m ( +1.000e-04 ) 
Total                                             [92m     7.37469e-02[0m ( -3.429e-02 ) 
-------------------------------------------------------------------------------------
  Step       |k|        |dk|       |grad|       -=X2=-     Delta(X2)    StepQual
     1   1.000e-01   1.000e-01   1.941e-01[92m   7.37469e-02[0m   3.429e-02      1.001


#========================================================#
#| [94m                   Total Gradient                   [0m |#
#========================================================#
   0 [ -2.05461998e-02 ] : VDWS:OW
   1 [ -2.98392352e-02 ] : VDWT:OW
   2 [ -1.67598431e-01 ] : BONDSB:HWOW
   3 [  4.34101436e-02 ] : BONDSK:HWOW
   4 [ -2.12312549e-02 ] : ANGLESB:HWOWHW
   5 [  6.91130923e-02 ] : ANGLESK:HWOWHW
   6 [ -1.74044406e-02 ] : COUL:SOL-2 COUL:SOL-3
   7 [ -2.87695276e-02 ] : COUL:SOL-4
   8 [ -4.83739182e-03 ] : VSITE3B:SOL-4 VSITE3A:SOL-4
----------------------------------------------------------

Levenberg-Marquardt: Newton-Raphson step found (length 1.250e-01),  0.32636774 added to Hessian diagonal

#========================================================#
#| [95m  Mathematical Parameters (Current + Step = Next)   [0m |#
#========================================================#
   0 [  2.3057e-02 + 4.7460e-03 =  2.7803e-02 ] : VDWS:OW
   1 [  3.7320e-02 + 6.6366e-03 =  4.3956e-02 ] : VDWT:OW
   2 [  5.7207e-03 - 2.3448e-05 =  5.6973e-03 ] : BONDSB:HWOW
   3 [ -3.8228e-02 - 8.1244e-03 = -4.6353e-02 ] : BONDSK:HWOW
   4 [  8.6160e-03 + 2.3139e-03 =  1.0930e-02 ] : ANGLESB:HWOWHW
   5 [ -7.4597e-02 - 1.2408e-01 = -1.9868e-01 ] : ANGLESK:HWOWHW
   6 [ -7.4155e-03 + 1.5737e-03 = -5.8417e-03 ] : COUL:SOL-2 COUL:SOL-3
   7 [  2.9107e-02 - 1.2468e-03 =  2.7861e-02 ] : COUL:SOL-4
   8 [  6.3479e-03 + 9.3418e-03 =  1.5690e-02 ] : VSITE3B:SOL-4 VSITE3A:SOL-4
----------------------------------------------------------

#========================================================#
#| [95m    Physical Parameters (Current + Step = Next)     [0m |#
#========================================================#
   0 [  3.1659e-01 + 2.5115e-04 =  3.1684e-01 ] : VDWS:OW
   1 [  7.4103e-01 + 1.6452e-02 =  7.5748e-01 ] : VDWT:OW
   2 [  9.6023e-02 - 1.2408e-06 =  9.6021e-02 ] : BONDSB:HWOW
   3 [  4.6657e+05 - 7.6173e+03 =  4.5896e+05 ] : BONDSK:HWOW
   4 [  1.0501e+02 + 1.3257e-01 =  1.0515e+02 ] : ANGLESB:HWOWHW
   5 [  5.8282e+02 - 7.5183e+01 =  5.0764e+02 ] : ANGLESK:HWOWHW
   6 [  5.1258e-01 + 1.5737e-03 =  5.1416e-01 ] : COUL:SOL-2 COUL:SOL-3
   7 [ -1.0109e+00 - 1.2468e-03 = -1.0121e+00 ] : COUL:SOL-4
   8 [  1.2834e-01 + 4.9435e-04 =  1.2883e-01 ] : VSITE3B:SOL-4 VSITE3A:SOL-4
----------------------------------------------------------

#=======================================================================#
#| [92m Target: cluster-06 Type: AbInitio_GMX Objective = 6.78955e-02     [0m |#
#| [92m                             Difference   Denominator     Percent  [0m |#
#| [92m Physical Variable           (Calc-Ref)     RMS (Ref)   Difference [0m |#
#=======================================================================#
    Energy (kJ/mol)                 7.9578       27.3135     29.1352% 
    Gradient (kJ/mol/nm)          268.9384     1190.8405     22.5839% 
-------------------------------------------------------------------------

#=======================================================================#
#| [92m Target: cluster-12 Type: AbInitio_GMX Objective = 6.42870e-02     [0m |#
#| [92m                             Difference   Denominator     Percent  [0m |#
#| [92m Physical Variable           (Calc-Ref)     RMS (Ref)   Difference [0m |#
#=======================================================================#
    Energy (kJ/mol)                13.0444       47.3455     27.5514% 
    Gradient (kJ/mol/nm)          269.7731     1180.2403     22.8575% 
-------------------------------------------------------------------------

#===================================================================================#
#| [94m                         Objective Function Breakdown                          [0m |#
#| [94m  Target Name              Residual  x  Weight  =  Contribution (Current-Prev) [0m |#
#===================================================================================#
cluster-06                     0.06790      0.500 [92m     3.39478e-02[0m ( -3.848e-03 ) 
cluster-12                     0.06429      0.500 [92m     3.21435e-02[0m ( -3.708e-03 ) 
Regularization                 0.00046      1.000 [91m     4.55346e-04[0m ( +3.553e-04 ) 
Total                                             [92m     6.65466e-02[0m ( -7.200e-03 ) 
-------------------------------------------------------------------------------------
  Step       |k|        |dk|       |grad|       -=X2=-     Delta(X2)    StepQual
     2   2.134e-01   1.250e-01   4.452e-02[92m   6.65466e-02[0m   7.200e-03      1.000


#========================================================#
#| [94m                   Total Gradient                   [0m |#
#========================================================#
   0 [ -1.74479189e-03 ] : VDWS:OW
   1 [ -2.46093933e-03 ] : VDWT:OW
   2 [  1.26884063e-02 ] : BONDSB:HWOW
   3 [  2.10679087e-03 ] : BONDSK:HWOW
   4 [ -1.32939642e-02 ] : ANGLESB:HWOWHW
   5 [  4.02405493e-02 ] : ANGLESK:HWOWHW
   6 [  1.18253480e-03 ] : COUL:SOL-2 COUL:SOL-3
   7 [ -2.20318950e-05 ] : COUL:SOL-4
   8 [ -3.22470617e-03 ] : VSITE3B:SOL-4 VSITE3A:SOL-4
----------------------------------------------------------

Levenberg-Marquardt: Newton-Raphson step found (length 1.526e-01),  0.04929377 added to Hessian diagonal

#========================================================#
#| [95m  Mathematical Parameters (Current + Step = Next)   [0m |#
#========================================================#
   0 [  2.7803e-02 + 3.0006e-03 =  3.0804e-02 ] : VDWS:OW
   1 [  4.3956e-02 - 4.4506e-05 =  4.3912e-02 ] : VDWT:OW
   2 [  5.6973e-03 - 1.3154e-04 =  5.5658e-03 ] : BONDSB:HWOW
   3 [ -4.6353e-02 + 2.3939e-04 = -4.6113e-02 ] : BONDSK:HWOW
   4 [  1.0930e-02 + 3.2329e-03 =  1.4163e-02 ] : ANGLESB:HWOWHW
   5 [ -1.9868e-01 - 1.4578e-01 = -3.4446e-01 ] : ANGLESK:HWOWHW
   6 [ -5.8417e-03 + 3.4399e-03 = -2.4018e-03 ] : COUL:SOL-2 COUL:SOL-3
   7 [  2.7861e-02 - 6.7449e-03 =  2.1116e-02 ] : COUL:SOL-4
   8 [  1.5690e-02 + 4.4164e-02 =  5.9854e-02 ] : VSITE3B:SOL-4 VSITE3A:SOL-4
----------------------------------------------------------

#========================================================#
#| [95m    Physical Parameters (Current + Step = Next)     [0m |#
#========================================================#
   0 [  3.1684e-01 + 1.5879e-04 =  3.1700e-01 ] : VDWS:OW
   1 [  7.5748e-01 - 1.1033e-04 =  7.5737e-01 ] : VDWT:OW
   2 [  9.6021e-02 - 6.9607e-06 =  9.6015e-02 ] : BONDSB:HWOW
   3 [  4.5896e+05 + 2.2445e+02 =  4.5918e+05 ] : BONDSK:HWOW
   4 [  1.0515e+02 + 1.8523e-01 =  1.0533e+02 ] : ANGLESB:HWOWHW
   5 [  5.0764e+02 - 8.8334e+01 =  4.1930e+02 ] : ANGLESK:HWOWHW
   6 [  5.1416e-01 + 3.4399e-03 =  5.1760e-01 ] : COUL:SOL-2 COUL:SOL-3
   7 [ -1.0121e+00 - 6.7449e-03 = -1.0189e+00 ] : COUL:SOL-4
   8 [  1.2883e-01 + 2.3371e-03 =  1.3117e-01 ] : VSITE3B:SOL-4 VSITE3A:SOL-4
----------------------------------------------------------

#=======================================================================#
#| [92m Target: cluster-06 Type: AbInitio_GMX Objective = 6.36391e-02     [0m |#
#| [92m                             Difference   Denominator     Percent  [0m |#
#| [92m Physical Variable           (Calc-Ref)     RMS (Ref)   Difference [0m |#
#=======================================================================#
    Energy (kJ/mol)                 7.9259       27.3135     29.0181% 
    Gradient (kJ/mol/nm)          244.6806     1190.8405     20.5469% 
-------------------------------------------------------------------------

#=======================================================================#
#| [92m Target: cluster-12 Type: AbInitio_GMX Objective = 5.97033e-02     [0m |#
#| [92m                             Difference   Denominator     Percent  [0m |#
#| [92m Physical Variable           (Calc-Ref)     RMS (Ref)   Difference [0m |#
#=======================================================================#
    Energy (kJ/mol)                12.9487       47.3455     27.3493% 
    Gradient (kJ/mol/nm)          246.1119     1180.2403     20.8527% 
-------------------------------------------------------------------------

#===================================================================================#
#| [94m                         Objective Function Breakdown                          [0m |#
#| [94m  Target Name              Residual  x  Weight  =  Contribution (Current-Prev) [0m |#
#===================================================================================#
cluster-06                     0.06364      0.500 [92m     3.18196e-02[0m ( -2.128e-03 ) 
cluster-12                     0.05970      0.500 [92m     2.98516e-02[0m ( -2.292e-03 ) 
Regularization                 0.00128      1.000 [91m     1.27922e-03[0m ( +8.239e-04 ) 
Total                                             [92m     6.29504e-02[0m ( -3.596e-03 ) 
-------------------------------------------------------------------------------------
  Step       |k|        |dk|       |grad|       -=X2=-     Delta(X2)    StepQual
     3   3.577e-01   1.526e-01   2.768e-02[92m   6.29504e-02[0m   3.596e-03      0.999


#========================================================#
#| [94m                   Total Gradient                   [0m |#
#========================================================#
   0 [ -6.54024776e-04 ] : VDWS:OW
   1 [ -8.25506243e-04 ] : VDWT:OW
   2 [  2.03070616e-02 ] : BONDSB:HWOW
   3 [ -8.81527041e-04 ] : BONDSK:HWOW
   4 [ -1.72271399e-02 ] : ANGLESB:HWOWHW
   5 [  6.69227754e-03 ] : ANGLESK:HWOWHW
   6 [  1.90840502e-03 ] : COUL:SOL-2 COUL:SOL-3
   7 [ -7.92373989e-04 ] : COUL:SOL-4
   8 [ -2.49056852e-03 ] : VSITE3B:SOL-4 VSITE3A:SOL-4
----------------------------------------------------------


#========================================================#
#| [95m  Mathematical Parameters (Current + Step = Next)   [0m |#
#========================================================#
   0 [  3.0804e-02 + 2.3555e-03 =  3.3160e-02 ] : VDWS:OW
   1 [  4.3912e-02 - 7.7837e-04 =  4.3133e-02 ] : VDWT:OW
   2 [  5.5658e-03 - 5.2197e-05 =  5.5136e-03 ] : BONDSB:HWOW
   3 [ -4.6113e-02 + 1.8283e-04 = -4.5930e-02 ] : BONDSK:HWOW
   4 [  1.4163e-02 + 1.2746e-03 =  1.5437e-02 ] : ANGLESB:HWOWHW
   5 [ -3.4446e-01 - 3.2040e-02 = -3.7650e-01 ] : ANGLESK:HWOWHW
   6 [ -2.4018e-03 + 4.6480e-03 =  2.2462e-03 ] : COUL:SOL-2 COUL:SOL-3
   7 [  2.1116e-02 - 8.7667e-03 =  1.2349e-02 ] : COUL:SOL-4
   8 [  5.9854e-02 + 8.8794e-02 =  1.4865e-01 ] : VSITE3B:SOL-4 VSITE3A:SOL-4
----------------------------------------------------------

#========================================================#
#| [95m    Physical Parameters (Current + Step = Next)     [0m |#
#========================================================#
   0 [  3.1700e-01 + 1.2465e-04 =  3.1712e-01 ] : VDWS:OW
   1 [  7.5737e-01 - 1.9295e-03 =  7.5544e-01 ] : VDWT:OW
   2 [  9.6015e-02 - 2.7621e-06 =  9.6012e-02 ] : BONDSB:HWOW
   3 [  4.5918e+05 + 1.7141e+02 =  4.5935e+05 ] : BONDSK:HWOW
   4 [  1.0533e+02 + 7.3029e-02 =  1.0540e+02 ] : ANGLESB:HWOWHW
   5 [  4.1930e+02 - 1.9414e+01 =  3.9989e+02 ] : ANGLESK:HWOWHW
   6 [  5.1760e-01 + 4.6480e-03 =  5.2225e-01 ] : COUL:SOL-2 COUL:SOL-3
   7 [ -1.0189e+00 - 8.7667e-03 = -1.0277e+00 ] : COUL:SOL-4
   8 [  1.3117e-01 + 4.6988e-03 =  1.3587e-01 ] : VSITE3B:SOL-4 VSITE3A:SOL-4
----------------------------------------------------------

#=======================================================================#
#| [92m Target: cluster-06 Type: AbInitio_GMX Objective = 6.30685e-02     [0m |#
#| [92m                             Difference   Denominator     Percent  [0m |#
#| [92m Physical Variable           (Calc-Ref)     RMS (Ref)   Difference [0m |#
#=======================================================================#
    Energy (kJ/mol)                 7.9103       27.3135     28.9610% 
    Gradient (kJ/mol/nm)          241.8614     1190.8405     20.3101% 
-------------------------------------------------------------------------

#=======================================================================#
#| [92m Target: cluster-12 Type: AbInitio_GMX Objective = 5.89955e-02     [0m |#
#| [92m                             Difference   Denominator     Percent  [0m |#
#| [92m Physical Variable           (Calc-Ref)     RMS (Ref)   Difference [0m |#
#=======================================================================#
    Energy (kJ/mol)                12.9102       47.3455     27.2681% 
    Gradient (kJ/mol/nm)          242.9378     1180.2403     20.5838% 
-------------------------------------------------------------------------

#===================================================================================#
#| [94m                         Objective Function Breakdown                          [0m |#
#| [94m  Target Name              Residual  x  Weight  =  Contribution (Current-Prev) [0m |#
#===================================================================================#
cluster-06                     0.06307      0.500 [92m     3.15343e-02[0m ( -2.853e-04 ) 
cluster-12                     0.05900      0.500 [92m     2.94978e-02[0m ( -3.539e-04 ) 
Regularization                 0.00169      1.000 [91m     1.69344e-03[0m ( +4.142e-04 ) 
Total                                             [92m     6.27254e-02[0m ( -2.250e-04 ) 
-------------------------------------------------------------------------------------
  Step       |k|        |dk|       |grad|       -=X2=-     Delta(X2)    StepQual
     4   4.115e-01   9.496e-02   1.815e-03[92m   6.27254e-02[0m   2.250e-04      1.014


#========================================================#
#| [94m                   Total Gradient                   [0m |#
#========================================================#
   0 [  9.12585992e-05 ] : VDWS:OW
   1 [  1.15501479e-04 ] : VDWT:OW
   2 [  6.50834940e-04 ] : BONDSB:HWOW
   3 [ -2.72525125e-05 ] : BONDSK:HWOW
   4 [ -1.06291362e-03 ] : ANGLESB:HWOWHW
   5 [ -3.77223390e-05 ] : ANGLESK:HWOWHW
   6 [ -1.30855455e-03 ] : COUL:SOL-2 COUL:SOL-3
   7 [  7.02193102e-05 ] : COUL:SOL-4
   8 [  1.63152883e-06 ] : VSITE3B:SOL-4 VSITE3A:SOL-4
----------------------------------------------------------


#========================================================#
#| [95m  Mathematical Parameters (Current + Step = Next)   [0m |#
#========================================================#
   0 [  3.3160e-02 + 1.7698e-06 =  3.3161e-02 ] : VDWS:OW
   1 [  4.3133e-02 + 1.7790e-04 =  4.3311e-02 ] : VDWT:OW
   2 [  5.5136e-03 - 6.5751e-06 =  5.5070e-03 ] : BONDSB:HWOW
   3 [ -4.5930e-02 - 2.5914e-06 = -4.5933e-02 ] : BONDSK:HWOW
   4 [  1.5437e-02 + 5.9687e-05 =  1.5497e-02 ] : ANGLESB:HWOWHW
   5 [ -3.7650e-01 - 4.5455e-05 = -3.7655e-01 ] : ANGLESK:HWOWHW
   6 [  2.2462e-03 + 2.4672e-04 =  2.4929e-03 ] : COUL:SOL-2 COUL:SOL-3
   7 [  1.2349e-02 - 4.7457e-04 =  1.1874e-02 ] : COUL:SOL-4
   8 [  1.4865e-01 + 2.4321e-03 =  1.5108e-01 ] : VSITE3B:SOL-4 VSITE3A:SOL-4
----------------------------------------------------------

#========================================================#
#| [95m    Physical Parameters (Current + Step = Next)     [0m |#
#========================================================#
   0 [  3.1712e-01 + 9.3654e-08 =  3.1712e-01 ] : VDWS:OW
   1 [  7.5544e-01 + 4.4100e-04 =  7.5589e-01 ] : VDWT:OW
   2 [  9.6012e-02 - 3.4794e-07 =  9.6011e-02 ] : BONDSB:HWOW
   3 [  4.5935e+05 - 2.4296e+00 =  4.5935e+05 ] : BONDSK:HWOW
   4 [  1.0540e+02 + 3.4198e-03 =  1.0541e+02 ] : ANGLESB:HWOWHW
   5 [  3.9989e+02 - 2.7542e-02 =  3.9986e+02 ] : ANGLESK:HWOWHW
   6 [  5.2225e-01 + 2.4672e-04 =  5.2249e-01 ] : COUL:SOL-2 COUL:SOL-3
   7 [ -1.0277e+00 - 4.7457e-04 = -1.0281e+00 ] : COUL:SOL-4
   8 [  1.3587e-01 + 1.2870e-04 =  1.3599e-01 ] : VSITE3B:SOL-4 VSITE3A:SOL-4
----------------------------------------------------------

#=======================================================================#
#| [92m Target: cluster-06 Type: AbInitio_GMX Objective = 6.30676e-02     [0m |#
#| [92m                             Difference   Denominator     Percent  [0m |#
#| [92m Physical Variable           (Calc-Ref)     RMS (Ref)   Difference [0m |#
#=======================================================================#
    Energy (kJ/mol)                 7.9083       27.3135     28.9539% 
    Gradient (kJ/mol/nm)          241.9906     1190.8405     20.3210% 
-------------------------------------------------------------------------

#=======================================================================#
#| [92m Target: cluster-12 Type: AbInitio_GMX Objective = 5.89806e-02     [0m |#
#| [92m                             Difference   Denominator     Percent  [0m |#
#| [92m Physical Variable           (Calc-Ref)     RMS (Ref)   Difference [0m |#
#=======================================================================#
    Energy (kJ/mol)                12.9053       47.3455     27.2578% 
    Gradient (kJ/mol/nm)          243.0212     1180.2403     20.5908% 
-------------------------------------------------------------------------

#===================================================================================#
#| [94m                         Objective Function Breakdown                          [0m |#
#| [94m  Target Name              Residual  x  Weight  =  Contribution (Current-Prev) [0m |#
#===================================================================================#
cluster-06                     0.06307      0.500 [92m     3.15338e-02[0m ( -4.544e-07 ) 
cluster-12                     0.05898      0.500 [92m     2.94903e-02[0m ( -7.454e-06 ) 
Regularization                 0.00170      1.000 [91m     1.70115e-03[0m ( +7.704e-06 ) 
Total                                             [92m     6.27252e-02[0m ( -2.045e-07 ) 
-------------------------------------------------------------------------------------
  Step       |k|        |dk|       |grad|       -=X2=-     Delta(X2)    StepQual
     5   4.124e-01   2.498e-03   2.130e-05[92m   6.27252e-02[0m   2.045e-07      1.029

Convergence criterion reached for gradient norm (1.00e-04)

@========================================================@
@| [1;92m           Final objective function value           [0m |@
@| [1;92m  Full:  6.272524e-02  Un-penalized:  6.102410e-02  [0m |@
@========================================================@

#========================================================#
#| [1;94m           Final optimization parameters:           [0m |#
#| [1;94m           Paste to input file to restart           [0m |#
#========================================================#
read_mvals
   0 [  3.3161e-02 ] : VDWS:OW
   1 [  4.3311e-02 ] : VDWT:OW
   2 [  5.5070e-03 ] : BONDSB:HWOW
   3 [ -4.5933e-02 ] : BONDSK:HWOW
   4 [  1.5497e-02 ] : ANGLESB:HWOWHW
   5 [ -3.7655e-01 ] : ANGLESK:HWOWHW
   6 [  2.4929e-03 ] : COUL:SOL-2 COUL:SOL-3
   7 [  1.1874e-02 ] : COUL:SOL-4
   8 [  1.5108e-01 ] : VSITE3B:SOL-4 VSITE3A:SOL-4
/read_mvals

#========================================================#
#| [1;94m             Final physical parameters:             [0m |#
#========================================================#
   0 [  3.1712e-01 ] : VDWS:OW
   1 [  7.5589e-01 ] : VDWT:OW
   2 [  9.6011e-02 ] : BONDSB:HWOW
   3 [  4.5935e+05 ] : BONDSK:HWOW
   4 [  1.0541e+02 ] : ANGLESB:HWOWHW
   5 [  3.9986e+02 ] : ANGLESK:HWOWHW
   6 [  5.2249e-01 ] : COUL:SOL-2 COUL:SOL-3
   7 [ -1.0281e+00 ] : COUL:SOL-4
   8 [  1.3599e-01 ] : VSITE3B:SOL-4 VSITE3A:SOL-4
----------------------------------------------------------

The final force field has been printed to the 'result' directory.

#========================================================#
#| [1;44;93m     Congratulations, ForceBalance has finished     [0m |#
#| [1;44;93m          Give yourself a pat on the back!          [0m |#
#========================================================#
