#======================================================================#
#| [1m            Welcome to ForceBalance version 1.6.0! =D             [0m |#
#| [1m                 Force Field Optimization System                  [0m |#
#| [1m                                                                  [0m |#
#| [1m                             Authors:                             [0m |#
#| [1m                          Lee-Ping Wang                           [0m |#
#| [1m                  Yudong Qiu, Keri A. McKiernan                   [0m |#
#| [1m          Jeffrey R. Wagner, Hyesu Jang, Simon Boothroyd          [0m |#
#| [1m           Arthur Vigil, Erik G. Brandt, Johnny Israeli           [0m |#
#======================================================================#

                          [44m     [0m                                        
                       [44m        [0m      [43m     [0m                              
                    [44m        [0m   [44m  [0m    [43m         [0m                          
                 [44m       [0m    [44m      [0m      [43m         [0m                       
             [44m        [0m    [44m        [0m          [43m         [0m                    
          [44m        [0m    [44m        [0m                 [43m        [0m                 
       [44m        [0m    [44m       [0m                        [43m        [0m              
    [44m        [0m   [44m        [0m                              [43m         [0m          
   [44m      [0m   [44m        [0m               `.:+@@###@'          [43m         [0m       
    [44m [0m    [44m        [0m          ,;'+###############.             [43m     [0m       
      [44m        [0m         +################':`                    [43m [0m        
      [44m     [0m              `.,,...####+.                                  
                                ,#####      +##.               [44m   [0m   [44m   [0m
 [43m    [0m                            #####      ######             [44m   [0m   [44m   [0m
 [43m    [0m                ###'        ####'     :#####'             [44m   [0m   [44m   [0m
 [43m    [0m                :####@      ####.    ,####'               [44m   [0m   [44m   [0m
 [43m    [0m                 ######     ####    +###+                 [44m   [0m   [44m   [0m
 [43m    [0m                  #####     ####   ###;                   [44m   [0m   [44m   [0m
 [43m    [0m                   :##      ####  ++`                     [44m   [0m   [44m   [0m
 [43m    [0m                            ####``..:;+##############+`   [44m   [0m   [44m   [0m
 [43m    [0m             .,:;;'++##################################`  [44m   [0m   [44m   [0m
 [43m    [0m    `############################++++''';;;;;;;;;;;'';    [44m   [0m   [44m   [0m
 [43m    [0m      ,########':,.``       ####                          [44m   [0m   [44m   [0m
 [43m    [0m                            ####                          [44m   [0m   [44m   [0m
 [43m    [0m                            ####                          [44m   [0m   [44m   [0m
 [43m    [0m                            ####                          [44m   [0m   [44m   [0m
 [43m    [0m                            ####                          [44m   [0m   [44m   [0m
 [43m    [0m                            ####                          [44m   [0m   [44m   [0m
 [43m    [0m                            ####                          [44m   [0m   [44m   [0m
 [43m    [0m                            ####                          [44m   [0m   [44m   [0m
      [44m    [0m                       ####                                   
     [44m        [0m                    ####                                   
    [44m [0m    [44m       [0m                 ####                       [43m     [0m       
   [44m     [0m    [44m        [0m             ####                    [43m        [0m       
   [44m        [0m    [44m        [0m          ###                  [43m         [0m         
      [44m        [0m    [44m        [0m        +`               [43m        [0m             
          [44m        [0m   [44m        [0m                   [43m        [0m                
             [44m        [0m   [44m         [0m           [43m         [0m                   
                [44m        [0m    [44m       [0m      [43m         [0m                      
                   [44m        [0m    [44m   [0m    [43m        [0m                          
                      [44m        [0m       [43m      [0m                             
                          [44m      [0m      [43m  [0m                                
                             [44m  [0m                                         

Reading options from file: very_simple.in
#========================================================#
#| [95m  Options at their default values are not printed   [0m |#
#| [95m        Use 'verbose_options True' to Enable        [0m |#
#========================================================#
Reading force field from file: water.itp
#=========================================================#
#| [92m Starting parameter indices, physical values and IDs [0m |#
#=========================================================#
   0 [  3.1537e-01 ] : VDWS:OW
   1 [  6.4852e-01 ] : VDWT:OW
   2 [  9.5720e-02 ] : BONDSB:HWOW
   3 [  5.0242e+05 ] : BONDSK:HWOW
   4 [  1.0452e+02 ] : ANGLESB:HWOWHW
   5 [  6.2802e+02 ] : ANGLESK:HWOWHW
   6 [  5.2000e-01 ] : COUL:SOL-2
   7 [ -1.0400e+00 ] : COUL:SOL-4
   8 [  1.2800e-01 ] : VSITE3A:SOL-4
-----------------------------------------------------------
#=========================================================#
#| [91m Rescaling Factors by Type (Lower Takes Precedence): [0m |#
#=========================================================#
   BONDSB                               : 5.29177e-02
   BONDSK                               : 9.37583e+05
   ANGLESB                              : 5.72958e+01
   ANGLESK                              : 6.05928e+02
   VDWS                                 : 5.29177e-02
   VDWT                                 : 2.47894e+00
   COUL                                 : 1.00000e+00
   VSITE3A                              : 5.29177e-02
   VSITE3B                              : 5.29177e-02
-----------------------------------------------------------
#========================================================#
#| [91m   Rescaling Types / Factors by Parameter Number:   [0m |#
#========================================================#
   0 [    VDWS                          : 5.29177e-02 ] : VDWS:OW
   1 [    VDWT                          : 2.47894e+00 ] : VDWT:OW
   2 [    BONDSB                        : 5.29177e-02 ] : BONDSB:HWOW
   3 [    BONDSK                        : 9.37583e+05 ] : BONDSK:HWOW
   4 [    ANGLESB                       : 5.72958e+01 ] : ANGLESB:HWOWHW
   5 [    ANGLESK                       : 6.05928e+02 ] : ANGLESK:HWOWHW
   6 [    COUL                          : 1.00000e+00 ] : COUL:SOL-2
   7 [    COUL                          : 1.00000e+00 ] : COUL:SOL-4
   8 [    VSITE3A                       : 5.29177e-02 ] : VSITE3A:SOL-4
----------------------------------------------------------
Building charge constraints...
Parameter 6 occurs 2 times in molecule SOL in locations [1, 2] (COUL:SOL-2 COUL:SOL-3)
Parameter 7 occurs 1 times in molecule SOL in locations [3] (COUL:SOL-4)
#========================================================#
#| [92m               Setup for force field                [0m |#
#========================================================#
fnms                      ['water.itp'] 
----------------------------------------------------------
Fitting the forces on all atoms
#========================================================#
#| [92m           Setup for target cluster-06 :            [0m |#
#========================================================#
name                      cluster-06 
type                      ABINITIO_GMX 
backup                    False 
tgtdir                    targets/cluster-06 
shots                     1208 
----------------------------------------------------------
Fitting the forces on all atoms
#========================================================#
#| [92m           Setup for target cluster-12 :            [0m |#
#========================================================#
name                      cluster-12 
type                      ABINITIO_GMX 
backup                    False 
tgtdir                    targets/cluster-12 
shots                     1201 
----------------------------------------------------------
Using parabolic regularization (Gaussian prior) with strength 1.0e-02 (+), 0.0e+00 (x)
#========================================================#
#| [92m           Setup for objective function :           [0m |#
#========================================================#
penalty_additive          0.01 
----------------------------------------------------------
#========================================================#
#| [92m                Setup for optimizer                 [0m |#
#========================================================#
jobtype                   NEWTON 
trust0                    1.0 
backup                    False 
input_file                very_simple.in 
----------------------------------------------------------
Calculation started at 2019-11-03 07:05 PM
#========================================================#
#| [1m                  Main Optimizer                    [0m |#
#| [1m   Newton-Raphson Method (Adaptive Trust Radius)    [0m |#
#| [1m                                                    [0m |#
#| [1m       [0mConvergence criteria (1 of 3 needed):        [0m |#
#| [1m          [0mObjective Function  : 1.000e-04           [0m |#
#| [1m          [0mNorm of Gradient    : 1.000e-03           [0m |#
#| [1m          [0mParameter step size : 1.000e-04           [0m |#
#========================================================#
#========================================================#
#|       Color Key for Objective Function -=X2=-        |#
#|  [1mBold[0m = Initial step                                 |#
#|  [92mGreen = Current lowest value of objective function[0m  |#
#|  [91mRed = Objective function rises, step rejected[0m       |#
#|  [0mNo color = Not at the lowest value                  |#
#========================================================#
#========================================================#
#| [94m     Iteration 0: Evaluating objective function     [0m |#
#| [94m        and derivatives through second order        [0m |#
#========================================================#

#================================================================================================#
#|               Target: cluster-06  Type: AbInitio_GMX  Objective = 2.29475e-01                |#
#|                        Difference   Denominator     Percent                                  |#
#|  Observable            (Calc-Ref)     RMS (Ref)   Difference       Term   x Wt =   Contrib.  |#
#================================================================================================#
    Energy (kJ/mol)           9.4124       27.3135     34.4606%     0.1188    1.000     0.1188 
    Gradient (kJ/mol/A)      46.4302      139.5348     33.2750%     0.1107    1.000     0.1107 
--------------------------------------------------------------------------------------------------
Maximum force difference on atom 5 (H), frame 1207,  27.6656 kJ/mol/A

#================================================================================================#
#|               Target: cluster-12  Type: AbInitio_GMX  Objective = 2.13018e-01                |#
#|                        Difference   Denominator     Percent                                  |#
#|  Observable            (Calc-Ref)     RMS (Ref)   Difference       Term   x Wt =   Contrib.  |#
#================================================================================================#
    Energy (kJ/mol)          15.2290       47.3455     32.1658%     0.1035    1.000     0.1035 
    Gradient (kJ/mol/A)      45.7106      138.1028     33.0989%     0.1096    1.000     0.1096 
--------------------------------------------------------------------------------------------------
Maximum force difference on atom 19 (M), frame 1200,  46.3942 kJ/mol/A
#====================================================================#
#| [94m                  Objective Function Breakdown                  [0m |#
#| [94m  Target Name              Residual  x  Weight  =  Contribution [0m |#
#====================================================================#
cluster-06                     0.22948      0.500 [94m     1.14738e-01[0m 
cluster-12                     0.21302      0.500 [94m     1.06509e-01[0m 
Regularization                 0.00000      1.000 [94m     0.00000e+00[0m 
Total                                             [94m     2.21247e-01[0m 
----------------------------------------------------------------------

  Step       |k|        |dk|       |grad|       -=X2=-     Delta(X2)    StepQual
     0   0.000e+00   0.000e+00   6.055e+00[1m   2.21247e-01[0m   0.000e+00      0.000

#========================================================#
#| [94m                   Total Gradient                   [0m |#
#========================================================#
   0 [ -2.72549524e-01 ] : VDWS:OW
   1 [ -4.46898464e-01 ] : VDWT:OW
   2 [ -5.95495189e+00 ] : BONDSB:HWOW
   3 [  7.14529502e-01 ] : BONDSK:HWOW
   4 [ -4.08977224e-01 ] : ANGLESB:HWOWHW
   5 [  1.98270298e-01 ] : ANGLESK:HWOWHW
   6 [ -5.74982530e-02 ] : COUL:SOL-2
   7 [ -4.52602314e-01 ] : COUL:SOL-4
   8 [ -4.53648218e-02 ] : VSITE3A:SOL-4
----------------------------------------------------------
Calculating nonlinear optimization step
Newton-Raphson step found (length 4.9340e-01)
#========================================================#
#| [95m  Mathematical Parameters (Current + Step = Next)   [0m |#
#========================================================#
   0 [  0.0000e+00 + 5.9360e-02 =  5.9360e-02 ] : VDWS:OW
   1 [  0.0000e+00 + 2.5399e-02 =  2.5399e-02 ] : VDWT:OW
   2 [  0.0000e+00 + 5.1945e-03 =  5.1945e-03 ] : BONDSB:HWOW
   3 [  0.0000e+00 - 4.8094e-02 = -4.8094e-02 ] : BONDSK:HWOW
   4 [  0.0000e+00 + 9.9496e-03 =  9.9496e-03 ] : ANGLESB:HWOWHW
   5 [  0.0000e+00 - 4.1705e-01 = -4.1705e-01 ] : ANGLESK:HWOWHW
   6 [  0.0000e+00 + 5.6705e-03 =  5.6705e-03 ] : COUL:SOL-2
   7 [  0.0000e+00 + 5.5427e-03 =  5.5427e-03 ] : COUL:SOL-4
   8 [  0.0000e+00 + 2.5068e-01 =  2.5068e-01 ] : VSITE3A:SOL-4
----------------------------------------------------------
#========================================================#
#| [95m    Physical Parameters (Current + Step = Next)     [0m |#
#========================================================#
   0 [  3.1537e-01 + 3.1412e-03 =  3.1851e-01 ] : VDWS:OW
   1 [  6.4852e-01 + 6.2964e-02 =  7.1148e-01 ] : VDWT:OW
   2 [  9.5720e-02 + 2.7488e-04 =  9.5995e-02 ] : BONDSB:HWOW
   3 [  5.0242e+05 - 4.5092e+04 =  4.5732e+05 ] : BONDSK:HWOW
   4 [  1.0452e+02 + 5.7007e-01 =  1.0509e+02 ] : ANGLESB:HWOWHW
   5 [  6.2802e+02 - 2.5270e+02 =  3.7532e+02 ] : ANGLESK:HWOWHW
   6 [  5.2000e-01 + 5.6705e-03 =  5.2567e-01 ] : COUL:SOL-2
   7 [ -1.0400e+00 + 5.5427e-03 = -1.0345e+00 ] : COUL:SOL-4
   8 [  1.2800e-01 + 1.3265e-02 =  1.4127e-01 ] : VSITE3A:SOL-4
----------------------------------------------------------
Input file with saved parameters: very_simple.sav
#========================================================#
#| [94m     Iteration 1: Evaluating objective function     [0m |#
#| [94m        and derivatives through second order        [0m |#
#========================================================#

#================================================================================================#
#|               Target: cluster-06  Type: AbInitio_GMX  Objective = 1.26114e-01                |#
#|                        Difference   Denominator     Percent                                  |#
#|  Observable            (Calc-Ref)     RMS (Ref)   Difference       Term   x Wt =   Contrib.  |#
#================================================================================================#
    Energy (kJ/mol)           7.9598       27.3135     29.1422%     0.0849    1.000     0.0849 
    Gradient (kJ/mol/A)      28.3180      139.5348     20.2946%     0.0412    1.000     0.0412 
--------------------------------------------------------------------------------------------------
Maximum force difference on atom 6 (H), frame 1207,  26.6778 kJ/mol/A

#================================================================================================#
#|               Target: cluster-12  Type: AbInitio_GMX  Objective = 1.19489e-01                |#
#|                        Difference   Denominator     Percent                                  |#
#|  Observable            (Calc-Ref)     RMS (Ref)   Difference       Term   x Wt =   Contrib.  |#
#================================================================================================#
    Energy (kJ/mol)          13.0598       47.3455     27.5840%     0.0761    1.000     0.0761 
    Gradient (kJ/mol/A)      28.7707      138.1028     20.8328%     0.0434    1.000     0.0434 
--------------------------------------------------------------------------------------------------
Maximum force difference on atom 12 (O), frame 1200,  34.9022 kJ/mol/A
#===================================================================================#
#| [94m                         Objective Function Breakdown                          [0m |#
#| [94m  Target Name              Residual  x  Weight  =  Contribution (Current-Prev) [0m |#
#===================================================================================#
cluster-06                     0.12611      0.500 [92m     6.30568e-02[0m ( -5.168e-02 ) 
cluster-12                     0.11949      0.500 [92m     5.97443e-02[0m ( -4.676e-02 ) 
Regularization                 0.00243      1.000 [91m     2.43442e-03[0m ( +2.434e-03 ) 
Total                                             [92m     1.25236e-01[0m ( -9.601e-02 ) 
-------------------------------------------------------------------------------------
Creating the directory /Users/leeping/src/forcebalance/studies/001_water_tutorial/result/very_simple to print the force field
#===========================================================================#
#|  The force field has been written to the result/very_simple directory.  |#
#|    Input file with optimization parameters saved to very_simple.sav.    |#
#===========================================================================#

  Step       |k|        |dk|       |grad|       -=X2=-     Delta(X2)    StepQual
     1   4.934e-01   4.934e-01   2.579e-01[92m   1.25236e-01[0m  -9.601e-02      0.991

#========================================================#
#| [94m                   Total Gradient                   [0m |#
#========================================================#
   0 [  2.06586678e-02 ] : VDWS:OW
   1 [  2.79442158e-02 ] : VDWT:OW
   2 [  8.35149005e-02 ] : BONDSB:HWOW
   3 [ -2.27658286e-03 ] : BONDSK:HWOW
   4 [ -2.33586043e-01 ] : ANGLESB:HWOWHW
   5 [ -5.69902920e-03 ] : ANGLESK:HWOWHW
   6 [ -5.57455232e-02 ] : COUL:SOL-2
   7 [ -2.53043288e-02 ] : COUL:SOL-4
   8 [ -1.05348927e-03 ] : VSITE3A:SOL-4
----------------------------------------------------------
Calculating nonlinear optimization step
Newton-Raphson step found (length 2.0404e-02)
#========================================================#
#| [95m  Mathematical Parameters (Current + Step = Next)   [0m |#
#========================================================#
   0 [  5.9360e-02 - 1.6959e-02 =  4.2401e-02 ] : VDWS:OW
   1 [  2.5399e-02 + 5.7854e-03 =  3.1185e-02 ] : VDWT:OW
   2 [  5.1945e-03 + 4.9861e-04 =  5.6931e-03 ] : BONDSB:HWOW
   3 [ -4.8094e-02 - 1.8712e-05 = -4.8113e-02 ] : BONDSK:HWOW
   4 [  9.9496e-03 + 6.7956e-03 =  1.6745e-02 ] : ANGLESB:HWOWHW
   5 [ -4.1705e-01 - 1.5735e-04 = -4.1721e-01 ] : ANGLESK:HWOWHW
   6 [  5.6705e-03 + 5.0229e-04 =  6.1728e-03 ] : COUL:SOL-2
   7 [  5.5427e-03 - 7.2745e-04 =  4.8152e-03 ] : COUL:SOL-4
   8 [  2.5068e-01 + 6.9278e-03 =  2.5761e-01 ] : VSITE3A:SOL-4
----------------------------------------------------------
#========================================================#
#| [95m    Physical Parameters (Current + Step = Next)     [0m |#
#========================================================#
   0 [  3.1851e-01 - 8.9745e-04 =  3.1761e-01 ] : VDWS:OW
   1 [  7.1148e-01 + 1.4342e-02 =  7.2583e-01 ] : VDWT:OW
   2 [  9.5995e-02 + 2.6385e-05 =  9.6021e-02 ] : BONDSB:HWOW
   3 [  4.5732e+05 - 1.7544e+01 =  4.5731e+05 ] : BONDSK:HWOW
   4 [  1.0509e+02 + 3.8936e-01 =  1.0548e+02 ] : ANGLESB:HWOWHW
   5 [  3.7532e+02 - 9.5345e-02 =  3.7522e+02 ] : ANGLESK:HWOWHW
   6 [  5.2567e-01 + 5.0229e-04 =  5.2617e-01 ] : COUL:SOL-2
   7 [ -1.0345e+00 - 7.2745e-04 = -1.0352e+00 ] : COUL:SOL-4
   8 [  1.4127e-01 + 3.6660e-04 =  1.4163e-01 ] : VSITE3A:SOL-4
----------------------------------------------------------
Input file with saved parameters: very_simple.sav
#========================================================#
#| [94m     Iteration 2: Evaluating objective function     [0m |#
#| [94m        and derivatives through second order        [0m |#
#========================================================#

#================================================================================================#
#|               Target: cluster-06  Type: AbInitio_GMX  Objective = 1.26174e-01                |#
#|                        Difference   Denominator     Percent                                  |#
#|  Observable            (Calc-Ref)     RMS (Ref)   Difference       Term   x Wt =   Contrib.  |#
#================================================================================================#
    Energy (kJ/mol)           7.9496       27.3135     29.1050%     0.0847    1.000     0.0847 
    Gradient (kJ/mol/A)      28.4131      139.5348     20.3627%     0.0415    1.000     0.0415 
--------------------------------------------------------------------------------------------------
Maximum force difference on atom 6 (H), frame 1207,  23.7175 kJ/mol/A

#================================================================================================#
#|               Target: cluster-12  Type: AbInitio_GMX  Objective = 1.17628e-01                |#
#|                        Difference   Denominator     Percent                                  |#
#|  Observable            (Calc-Ref)     RMS (Ref)   Difference       Term   x Wt =   Contrib.  |#
#================================================================================================#
    Energy (kJ/mol)          12.9350       47.3455     27.3203%     0.0746    1.000     0.0746 
    Gradient (kJ/mol/A)      28.6335      138.1028     20.7334%     0.0430    1.000     0.0430 
--------------------------------------------------------------------------------------------------
Maximum force difference on atom 12 (O), frame 1200,  31.9140 kJ/mol/A
#===================================================================================#
#| [94m                         Objective Function Breakdown                          [0m |#
#| [94m  Target Name              Residual  x  Weight  =  Contribution (Current-Prev) [0m |#
#===================================================================================#
cluster-06                     0.12617      0.500 [91m     6.30871e-02[0m ( +3.030e-05 ) 
cluster-12                     0.11763      0.500 [92m     5.88138e-02[0m ( -9.305e-04 ) 
Regularization                 0.00246      1.000 [91m     2.45883e-03[0m ( +2.441e-05 ) 
Total                                             [92m     1.24360e-01[0m ( -8.758e-04 ) 
-------------------------------------------------------------------------------------
#===========================================================================#
#|  The force field has been written to the result/very_simple directory.  |#
#|    Input file with optimization parameters saved to very_simple.sav.    |#
#===========================================================================#

  Step       |k|        |dk|       |grad|       -=X2=-     Delta(X2)    StepQual
     2   4.959e-01   2.040e-02   6.852e-04[92m   1.24360e-01[0m  -8.758e-04      1.001

#========================================================#
#| [94m                   Total Gradient                   [0m |#
#========================================================#
   0 [ -1.71939717e-04 ] : VDWS:OW
   1 [ -2.35752365e-04 ] : VDWT:OW
   2 [  2.06043642e-04 ] : BONDSB:HWOW
   3 [ -4.68743258e-06 ] : BONDSK:HWOW
   4 [ -1.62241626e-04 ] : ANGLESB:HWOWHW
   5 [ -8.05811697e-06 ] : ANGLESK:HWOWHW
   6 [  5.33351960e-04 ] : COUL:SOL-2
   7 [  1.63096149e-04 ] : COUL:SOL-4
   8 [ -6.62438692e-05 ] : VSITE3A:SOL-4
----------------------------------------------------------
Convergence criterion reached for gradient norm (1.00e-03)
#========================================================#
#| [92m               [0m[1mOptimization Converged[0m               [0m |#
#| [92m           Final objective function value           [0m |#
#| [92m  Full:  1.243598e-01  Un-penalized:  1.219010e-01  [0m |#
#========================================================#
#========================================================#
#| [94m           Final optimization parameters:           [0m |#
#========================================================#
   0 [  4.2401e-02 ] : VDWS:OW
   1 [  3.1185e-02 ] : VDWT:OW
   2 [  5.6931e-03 ] : BONDSB:HWOW
   3 [ -4.8113e-02 ] : BONDSK:HWOW
   4 [  1.6745e-02 ] : ANGLESB:HWOWHW
   5 [ -4.1721e-01 ] : ANGLESK:HWOWHW
   6 [  6.1728e-03 ] : COUL:SOL-2
   7 [  4.8152e-03 ] : COUL:SOL-4
   8 [  2.5761e-01 ] : VSITE3A:SOL-4
#========================================================#
#| [94m             Final physical parameters:             [0m |#
#========================================================#
   0 [  3.1761e-01 ] : VDWS:OW
   1 [  7.2583e-01 ] : VDWT:OW
   2 [  9.6021e-02 ] : BONDSB:HWOW
   3 [  4.5731e+05 ] : BONDSK:HWOW
   4 [  1.0548e+02 ] : ANGLESB:HWOWHW
   5 [  3.7522e+02 ] : ANGLESK:HWOWHW
   6 [  5.2617e-01 ] : COUL:SOL-2
   7 [ -1.0352e+00 ] : COUL:SOL-4
   8 [  1.4163e-01 ] : VSITE3A:SOL-4
----------------------------------------------------------
#===========================================================================#
#|  The force field has been written to the result/very_simple directory.  |#
#|    Input file with optimization parameters saved to very_simple.sav.    |#
#===========================================================================#
Wall time since calculation start: 46.4 seconds
#========================================================#
#| [1;44;93m               Calculation Finished.                [0m |#
#| [1;44;93m     ---==(  May the Force be with you!  )==---     [0m |#
#========================================================#
