#======================================================================#
#| [1m             Welcome to ForceBalance version 1.3! =D              [0m |#
#| [1m                 Force Field Optimization System                  [0m |#
#| [1m                                                                  [0m |#
#| [1m                             Authors:                             [0m |#
#| [1m                          Lee-Ping Wang                           [0m |#
#| [1m                  Arthur Vigil, Keri McKiernan,                   [0m |#
#| [1m                   Erik Brandt, Johnny Israeli                    [0m |#
#======================================================================#

                          [44m     [0m                                        
                       [44m        [0m      [43m     [0m                              
                    [44m        [0m   [44m  [0m    [43m         [0m                          
                 [44m       [0m    [44m      [0m      [43m         [0m                       
             [44m        [0m    [44m        [0m          [43m         [0m                    
          [44m        [0m    [44m        [0m                 [43m        [0m                 
       [44m        [0m    [44m       [0m                        [43m        [0m              
    [44m        [0m   [44m        [0m                              [43m         [0m          
   [44m      [0m   [44m        [0m               `.:+@@###@'          [43m         [0m       
    [44m [0m    [44m        [0m          ,;'+###############.             [43m     [0m       
      [44m        [0m         +################':`                    [43m [0m        
      [44m     [0m              `.,,...####+.                                  
                                ,#####      +##.               [44m   [0m   [44m   [0m
 [43m    [0m                            #####      ######             [44m   [0m   [44m   [0m
 [43m    [0m                ###'        ####'     :#####'             [44m   [0m   [44m   [0m
 [43m    [0m                :####@      ####.    ,####'               [44m   [0m   [44m   [0m
 [43m    [0m                 ######     ####    +###+                 [44m   [0m   [44m   [0m
 [43m    [0m                  #####     ####   ###;                   [44m   [0m   [44m   [0m
 [43m    [0m                   :##      ####  ++`                     [44m   [0m   [44m   [0m
 [43m    [0m                            ####``..:;+##############+`   [44m   [0m   [44m   [0m
 [43m    [0m             .,:;;'++##################################`  [44m   [0m   [44m   [0m
 [43m    [0m    `############################++++''';;;;;;;;;;;'';    [44m   [0m   [44m   [0m
 [43m    [0m      ,########':,.``       ####                          [44m   [0m   [44m   [0m
 [43m    [0m                            ####                          [44m   [0m   [44m   [0m
 [43m    [0m                            ####                          [44m   [0m   [44m   [0m
 [43m    [0m                            ####                          [44m   [0m   [44m   [0m
 [43m    [0m                            ####                          [44m   [0m   [44m   [0m
 [43m    [0m                            ####                          [44m   [0m   [44m   [0m
 [43m    [0m                            ####                          [44m   [0m   [44m   [0m
 [43m    [0m                            ####                          [44m   [0m   [44m   [0m
      [44m    [0m                       ####                                   
     [44m        [0m                    ####                                   
    [44m [0m    [44m       [0m                 ####                       [43m     [0m       
   [44m     [0m    [44m        [0m             ####                    [43m        [0m       
   [44m        [0m    [44m        [0m          ###                  [43m         [0m         
      [44m        [0m    [44m        [0m        +`               [43m        [0m             
          [44m        [0m   [44m        [0m                   [43m        [0m                
             [44m        [0m   [44m         [0m           [43m         [0m                   
                [44m        [0m    [44m       [0m      [43m         [0m                      
                   [44m        [0m    [44m   [0m    [43m        [0m                          
                      [44m        [0m       [43m      [0m                             
                          [44m      [0m      [43m  [0m                                
                             [44m  [0m                                         

Reading options from file: very_simple.in
#========================================================#
#| [95m  Options at their default values are not printed   [0m |#
#| [95m        Use 'verbose_options True' to Enable        [0m |#
#========================================================#
Reading force field from file: water.itp
#=========================================================#
#| [92m Starting parameter indices, physical values and IDs [0m |#
#=========================================================#
   0 [  3.1537e-01 ] : VDWS:OW
   1 [  6.4852e-01 ] : VDWT:OW
   2 [  9.5720e-02 ] : BONDSB:HWOW
   3 [  5.0242e+05 ] : BONDSK:HWOW
   4 [  1.0452e+02 ] : ANGLESB:HWOWHW
   5 [  6.2802e+02 ] : ANGLESK:HWOWHW
   6 [  5.2000e-01 ] : COUL:SOL-2
   7 [ -1.0400e+00 ] : COUL:SOL-4
   8 [  1.2800e-01 ] : VSITE3A:SOL-4
-----------------------------------------------------------
#=========================================================#
#| [91m Rescaling Factors by Type (Lower Takes Precedence): [0m |#
#=========================================================#
   BONDSB                               : 5.29177e-02
   BONDSK                               : 9.37583e+05
   VSITE3A                              : 5.29177e-02
   VSITE3B                              : 5.29177e-02
   VDWS                                 : 5.29177e-02
   VDWT                                 : 2.47894e+00
   ANGLESB                              : 5.72958e+01
   ANGLESK                              : 6.05928e+02
   COUL                                 : 1.00000e+00
-----------------------------------------------------------
#========================================================#
#| [91m   Rescaling Types / Factors by Parameter Number:   [0m |#
#========================================================#
   0 [    VDWS                          : 5.29177e-02 ] : VDWS:OW
   1 [    VDWT                          : 2.47894e+00 ] : VDWT:OW
   2 [    BONDSB                        : 5.29177e-02 ] : BONDSB:HWOW
   3 [    BONDSK                        : 9.37583e+05 ] : BONDSK:HWOW
   4 [    ANGLESB                       : 5.72958e+01 ] : ANGLESB:HWOWHW
   5 [    ANGLESK                       : 6.05928e+02 ] : ANGLESK:HWOWHW
   6 [    COUL                          : 1.00000e+00 ] : COUL:SOL-2
   7 [    COUL                          : 1.00000e+00 ] : COUL:SOL-4
   8 [    VSITE3A                       : 5.29177e-02 ] : VSITE3A:SOL-4
----------------------------------------------------------
Building charge constraints...
Parameter 6 occurs 2 times in molecule SOL in locations [1, 2] (COUL:SOL-2 COUL:SOL-3)
Parameter 7 occurs 1 times in molecule SOL in locations [3] (COUL:SOL-4)
#========================================================#
#| [92m               Setup for force field                [0m |#
#========================================================#
fnms                      ['water.itp'] 
----------------------------------------------------------
Fitting the forces on all atoms
#========================================================#
#| [92m           Setup for target cluster-06 :            [0m |#
#========================================================#
name                      cluster-06 
type                      ABINITIO_GMX 
backup                    False 
tgtdir                    targets/cluster-06 
shots                     1208 
----------------------------------------------------------
Fitting the forces on all atoms
#========================================================#
#| [92m           Setup for target cluster-12 :            [0m |#
#========================================================#
name                      cluster-12 
type                      ABINITIO_GMX 
backup                    False 
tgtdir                    targets/cluster-12 
shots                     1201 
----------------------------------------------------------
Using parabolic regularization (Gaussian prior) with strength 1.0e-02 (+), 0.0e+00 (x)
#========================================================#
#| [92m           Setup for objective function :           [0m |#
#========================================================#
penalty_additive          0.01 
----------------------------------------------------------
#========================================================#
#| [92m                Setup for optimizer                 [0m |#
#========================================================#
jobtype                   NEWTON 
trust0                    1.0 
backup                    False 
input_file                very_simple.in 
----------------------------------------------------------
#========================================================#
#| [1m                  Main Optimizer                    [0m |#
#| [1m   Newton-Raphson Method (Adaptive Trust Radius)    [0m |#
#| [1m                                                    [0m |#
#| [1m       [0mConvergence criteria (1 of 3 needed):        [0m |#
#| [1m          [0mObjective Function  : 1.000e-04           [0m |#
#| [1m          [0mNorm of Gradient    : 1.000e-03           [0m |#
#| [1m          [0mParameter step size : 1.000e-04           [0m |#
#========================================================#
#========================================================#
#|       Color Key for Objective Function -=X2=-        |#
#|  [1mBold[0m = Initial step                                 |#
#|  [92mGreen = Current lowest value of objective function[0m  |#
#|  [91mRed = Objective function rises, step rejected[0m       |#
#|  [0mNo color = Not at the lowest value                  |#
#========================================================#
#========================================================#
#| [94m     Iteration 0: Evaluating objective function     [0m |#
#| [94m        and derivatives through second order        [0m |#
#========================================================#
#=========================================================================================#
#|            Target: cluster-06  Type: AbInitio_GMX  Objective = 2.29475e-01            |#
#|                        Difference   Denominator     Percent                           |#
#|  Observable            (Calc-Ref)     RMS (Ref)   Difference   Weight   Contribution  |#
#=========================================================================================#
    Energy (kJ/mol)           9.4124       27.3135     34.4606%    1.000         0.1188 
    Gradient (kJ/mol/A)      46.4302      139.5348     33.2750%    1.000         0.1107 
-------------------------------------------------------------------------------------------
Maximum force error on atom 5 (H), frame 1207,  27.6656 kJ/mol/A
#=========================================================================================#
#|            Target: cluster-12  Type: AbInitio_GMX  Objective = 2.13018e-01            |#
#|                        Difference   Denominator     Percent                           |#
#|  Observable            (Calc-Ref)     RMS (Ref)   Difference   Weight   Contribution  |#
#=========================================================================================#
    Energy (kJ/mol)          15.2290       47.3455     32.1658%    1.000         0.1035 
    Gradient (kJ/mol/A)      45.7106      138.1028     33.0989%    1.000         0.1096 
-------------------------------------------------------------------------------------------
Maximum force error on atom 19 (M), frame 1200,  46.3942 kJ/mol/A
#====================================================================#
#| [94m                  Objective Function Breakdown                  [0m |#
#| [94m  Target Name              Residual  x  Weight  =  Contribution [0m |#
#====================================================================#
cluster-06                     0.22948      0.500 [94m     1.14738e-01[0m 
cluster-12                     0.21302      0.500 [94m     1.06509e-01[0m 
Regularization                 0.00000      1.000 [94m     0.00000e+00[0m 
Total                                             [94m     2.21247e-01[0m 
----------------------------------------------------------------------

  Step       |k|        |dk|       |grad|       -=X2=-     Delta(X2)    StepQual
     0   0.000e+00   0.000e+00   6.055e+00[1m   2.21247e-01[0m  -0.000e+00      0.000

#========================================================#
#| [94m                   Total Gradient                   [0m |#
#========================================================#
   0 [ -2.72549797e-01 ] : VDWS:OW
   1 [ -4.46894350e-01 ] : VDWT:OW
   2 [ -5.95495340e+00 ] : BONDSB:HWOW
   3 [  7.14531548e-01 ] : BONDSK:HWOW
   4 [ -4.08975733e-01 ] : ANGLESB:HWOWHW
   5 [  1.98269502e-01 ] : ANGLESK:HWOWHW
   6 [ -5.75031317e-02 ] : COUL:SOL-2
   7 [ -4.52562898e-01 ] : COUL:SOL-4
   8 [ -4.53799691e-02 ] : VSITE3A:SOL-4
----------------------------------------------------------
Calculating nonlinear optimization step
Newton-Raphson step found (length 4.9358e-01)
#========================================================#
#| [95m  Mathematical Parameters (Current + Step = Next)   [0m |#
#========================================================#
   0 [  0.0000e+00 + 5.9439e-02 =  5.9439e-02 ] : VDWS:OW
   1 [  0.0000e+00 + 2.5364e-02 =  2.5364e-02 ] : VDWT:OW
   2 [  0.0000e+00 + 5.1941e-03 =  5.1941e-03 ] : BONDSB:HWOW
   3 [  0.0000e+00 - 4.8095e-02 = -4.8095e-02 ] : BONDSK:HWOW
   4 [  0.0000e+00 + 9.9481e-03 =  9.9481e-03 ] : ANGLESB:HWOWHW
   5 [  0.0000e+00 - 4.1705e-01 = -4.1705e-01 ] : ANGLESK:HWOWHW
   6 [  0.0000e+00 + 5.6931e-03 =  5.6931e-03 ] : COUL:SOL-2
   7 [  0.0000e+00 + 5.4994e-03 =  5.4994e-03 ] : COUL:SOL-4
   8 [  0.0000e+00 + 2.5103e-01 =  2.5103e-01 ] : VSITE3A:SOL-4
----------------------------------------------------------
#========================================================#
#| [95m    Physical Parameters (Current + Step = Next)     [0m |#
#========================================================#
   0 [  3.1537e-01 + 3.1454e-03 =  3.1851e-01 ] : VDWS:OW
   1 [  6.4852e-01 + 6.2875e-02 =  7.1139e-01 ] : VDWT:OW
   2 [  9.5720e-02 + 2.7486e-04 =  9.5995e-02 ] : BONDSB:HWOW
   3 [  5.0242e+05 - 4.5093e+04 =  4.5732e+05 ] : BONDSK:HWOW
   4 [  1.0452e+02 + 5.6998e-01 =  1.0509e+02 ] : ANGLESB:HWOWHW
   5 [  6.2802e+02 - 2.5270e+02 =  3.7532e+02 ] : ANGLESK:HWOWHW
   6 [  5.2000e-01 + 5.6931e-03 =  5.2569e-01 ] : COUL:SOL-2
   7 [ -1.0400e+00 + 5.4994e-03 = -1.0345e+00 ] : COUL:SOL-4
   8 [  1.2800e-01 + 1.3284e-02 =  1.4128e-01 ] : VSITE3A:SOL-4
----------------------------------------------------------
Input file with saved parameters: very_simple.sav
#========================================================#
#| [94m     Iteration 1: Evaluating objective function     [0m |#
#| [94m        and derivatives through second order        [0m |#
#========================================================#
#=========================================================================================#
#|            Target: cluster-06  Type: AbInitio_GMX  Objective = 1.26112e-01            |#
#|                        Difference   Denominator     Percent                           |#
#|  Observable            (Calc-Ref)     RMS (Ref)   Difference   Weight   Contribution  |#
#=========================================================================================#
    Energy (kJ/mol)           7.9596       27.3135     29.1417%    1.000         0.0849 
    Gradient (kJ/mol/A)      28.3184      139.5348     20.2949%    1.000         0.0412 
-------------------------------------------------------------------------------------------
Maximum force error on atom 6 (H), frame 1207,  26.6794 kJ/mol/A
#=========================================================================================#
#|            Target: cluster-12  Type: AbInitio_GMX  Objective = 1.19487e-01            |#
#|                        Difference   Denominator     Percent                           |#
#|  Observable            (Calc-Ref)     RMS (Ref)   Difference   Weight   Contribution  |#
#=========================================================================================#
    Energy (kJ/mol)          13.0596       47.3455     27.5837%    1.000         0.0761 
    Gradient (kJ/mol/A)      28.7710      138.1028     20.8331%    1.000         0.0434 
-------------------------------------------------------------------------------------------
Maximum force error on atom 12 (O), frame 1200,  34.9031 kJ/mol/A
#===================================================================================#
#| [94m                         Objective Function Breakdown                          [0m |#
#| [94m  Target Name              Residual  x  Weight  =  Contribution (Current-Prev) [0m |#
#===================================================================================#
cluster-06                     0.12611      0.500 [92m     6.30559e-02[0m ( -5.168e-02 ) 
cluster-12                     0.11949      0.500 [92m     5.97437e-02[0m ( -4.677e-02 ) 
Regularization                 0.00244      1.000 [91m     2.43622e-03[0m ( +2.436e-03 ) 
Total                                             [92m     1.25236e-01[0m ( -9.601e-02 ) 
-------------------------------------------------------------------------------------

  Step       |k|        |dk|       |grad|       -=X2=-     Delta(X2)    StepQual
     1   4.936e-01   4.936e-01   2.580e-01[92m   1.25236e-01[0m  -9.601e-02      0.991

#========================================================#
#| [94m                   Total Gradient                   [0m |#
#========================================================#
   0 [  2.06994130e-02 ] : VDWS:OW
   1 [  2.79984086e-02 ] : VDWT:OW
   2 [  8.35527959e-02 ] : BONDSB:HWOW
   3 [ -2.28124356e-03 ] : BONDSK:HWOW
   4 [ -2.33616223e-01 ] : ANGLESB:HWOWHW
   5 [ -5.69439932e-03 ] : ANGLESK:HWOWHW
   6 [ -5.57711960e-02 ] : COUL:SOL-2
   7 [ -2.53033448e-02 ] : COUL:SOL-4
   8 [ -1.17135016e-03 ] : VSITE3A:SOL-4
----------------------------------------------------------
Calculating nonlinear optimization step
Newton-Raphson step found (length 2.2138e-02)
#========================================================#
#| [95m  Mathematical Parameters (Current + Step = Next)   [0m |#
#========================================================#
   0 [  5.9439e-02 - 1.7168e-02 =  4.2272e-02 ] : VDWS:OW
   1 [  2.5364e-02 + 5.9281e-03 =  3.1292e-02 ] : VDWT:OW
   2 [  5.1941e-03 + 4.9758e-04 =  5.6916e-03 ] : BONDSB:HWOW
   3 [ -4.8095e-02 - 1.9692e-05 = -4.8115e-02 ] : BONDSK:HWOW
   4 [  9.9481e-03 + 6.7767e-03 =  1.6725e-02 ] : ANGLESB:HWOWHW
   5 [ -4.1705e-01 - 1.9226e-04 = -4.1724e-01 ] : ANGLESK:HWOWHW
   6 [  5.6931e-03 + 6.8201e-04 =  6.3751e-03 ] : COUL:SOL-2
   7 [  5.4994e-03 - 1.0634e-03 =  4.4360e-03 ] : COUL:SOL-4
   8 [  2.5103e-01 + 1.0602e-02 =  2.6163e-01 ] : VSITE3A:SOL-4
----------------------------------------------------------
#========================================================#
#| [95m    Physical Parameters (Current + Step = Next)     [0m |#
#========================================================#
   0 [  3.1851e-01 - 9.0849e-04 =  3.1760e-01 ] : VDWS:OW
   1 [  7.1139e-01 + 1.4695e-02 =  7.2609e-01 ] : VDWT:OW
   2 [  9.5995e-02 + 2.6331e-05 =  9.6021e-02 ] : BONDSB:HWOW
   3 [  4.5732e+05 - 1.8463e+01 =  4.5730e+05 ] : BONDSK:HWOW
   4 [  1.0509e+02 + 3.8827e-01 =  1.0548e+02 ] : ANGLESB:HWOWHW
   5 [  3.7532e+02 - 1.1650e-01 =  3.7520e+02 ] : ANGLESK:HWOWHW
   6 [  5.2569e-01 + 6.8201e-04 =  5.2638e-01 ] : COUL:SOL-2
   7 [ -1.0345e+00 - 1.0634e-03 = -1.0356e+00 ] : COUL:SOL-4
   8 [  1.4128e-01 + 5.6104e-04 =  1.4185e-01 ] : VSITE3A:SOL-4
----------------------------------------------------------
Input file with saved parameters: very_simple.sav
#========================================================#
#| [94m     Iteration 2: Evaluating objective function     [0m |#
#| [94m        and derivatives through second order        [0m |#
#========================================================#
#=========================================================================================#
#|            Target: cluster-06  Type: AbInitio_GMX  Objective = 1.26151e-01            |#
#|                        Difference   Denominator     Percent                           |#
#|  Observable            (Calc-Ref)     RMS (Ref)   Difference   Weight   Contribution  |#
#=========================================================================================#
    Energy (kJ/mol)           7.9490       27.3135     29.1028%    1.000         0.0847 
    Gradient (kJ/mol/A)      28.4096      139.5348     20.3602%    1.000         0.0415 
-------------------------------------------------------------------------------------------
Maximum force error on atom 6 (H), frame 1207,  23.7056 kJ/mol/A
#=========================================================================================#
#|            Target: cluster-12  Type: AbInitio_GMX  Objective = 1.17608e-01            |#
#|                        Difference   Denominator     Percent                           |#
#|  Observable            (Calc-Ref)     RMS (Ref)   Difference   Weight   Contribution  |#
#=========================================================================================#
    Energy (kJ/mol)          12.9342       47.3455     27.3187%    1.000         0.0746 
    Gradient (kJ/mol/A)      28.6300      138.1028     20.7309%    1.000         0.0430 
-------------------------------------------------------------------------------------------
Maximum force error on atom 12 (O), frame 1200,  31.8938 kJ/mol/A
#===================================================================================#
#| [94m                         Objective Function Breakdown                          [0m |#
#| [94m  Target Name              Residual  x  Weight  =  Contribution (Current-Prev) [0m |#
#===================================================================================#
cluster-06                     0.12615      0.500 [91m     6.30757e-02[0m ( +1.976e-05 ) 
cluster-12                     0.11761      0.500 [92m     5.88042e-02[0m ( -9.395e-04 ) 
Regularization                 0.00248      1.000 [91m     2.47993e-03[0m ( +4.371e-05 ) 
Total                                             [92m     1.24360e-01[0m ( -8.761e-04 ) 
-------------------------------------------------------------------------------------

  Step       |k|        |dk|       |grad|       -=X2=-     Delta(X2)    StepQual
     2   4.980e-01   2.214e-02   7.160e-04[92m   1.24360e-01[0m  -8.761e-04      0.999

#========================================================#
#| [94m                   Total Gradient                   [0m |#
#========================================================#
   0 [ -1.89874971e-04 ] : VDWS:OW
   1 [ -2.61127769e-04 ] : VDWT:OW
   2 [  3.08926644e-04 ] : BONDSB:HWOW
   3 [ -9.69936175e-06 ] : BONDSK:HWOW
   4 [ -2.05286048e-04 ] : ANGLESB:HWOWHW
   5 [ -1.08965812e-05 ] : ANGLESK:HWOWHW
   6 [  5.10191488e-04 ] : COUL:SOL-2
   7 [  8.50210769e-05 ] : COUL:SOL-4
   8 [  5.58166429e-05 ] : VSITE3A:SOL-4
----------------------------------------------------------
Convergence criterion reached for gradient norm (1.00e-03)
#========================================================#
#| [92m               [0m[1mOptimization Converged[0m               [0m |#
#| [92m           Final objective function value           [0m |#
#| [92m  Full:  1.243598e-01  Un-penalized:  1.218799e-01  [0m |#
#========================================================#
#========================================================#
#| [94m           Final optimization parameters:           [0m |#
#========================================================#
   0 [  4.2272e-02 ] : VDWS:OW
   1 [  3.1292e-02 ] : VDWT:OW
   2 [  5.6916e-03 ] : BONDSB:HWOW
   3 [ -4.8115e-02 ] : BONDSK:HWOW
   4 [  1.6725e-02 ] : ANGLESB:HWOWHW
   5 [ -4.1724e-01 ] : ANGLESK:HWOWHW
   6 [  6.3751e-03 ] : COUL:SOL-2
   7 [  4.4360e-03 ] : COUL:SOL-4
   8 [  2.6163e-01 ] : VSITE3A:SOL-4
#========================================================#
#| [94m             Final physical parameters:             [0m |#
#========================================================#
   0 [  3.1760e-01 ] : VDWS:OW
   1 [  7.2609e-01 ] : VDWT:OW
   2 [  9.6021e-02 ] : BONDSB:HWOW
   3 [  4.5730e+05 ] : BONDSK:HWOW
   4 [  1.0548e+02 ] : ANGLESB:HWOWHW
   5 [  3.7520e+02 ] : ANGLESK:HWOWHW
   6 [  5.2638e-01 ] : COUL:SOL-2
   7 [ -1.0356e+00 ] : COUL:SOL-4
   8 [  1.4185e-01 ] : VSITE3A:SOL-4
----------------------------------------------------------
Creating the directory /home/leeping/src/forcebalance/studies/001_water_tutorial/demo/result/very_simple to print the force field
#===========================================================================#
#|  The force field has been written to the result/very_simple directory.  |#
#|    Input file with optimization parameters saved to very_simple.sav.    |#
#===========================================================================#
#========================================================#
#| [1;44;93m               Calculation Finished.                [0m |#
#| [1;44;93m     ---==(  May the Force be with you!  )==---     [0m |#
#========================================================#
